Dark web scammers exploit Covid-19 fear and doubt,"""They're exploiting the fear, uncertainty and doubt people are experiencing during the pandemic, and using the anxiety and desperation to get people to buy things or click on things they wouldn't have otherwise,"" says Morgan Wright, a former senior adviser to the US Department of State anti-terrorism assistance programme.He's talking about the scammers and criminals that inhabit the ""dark web"" who have found a new angle - anxiety over Covid-19.Mr Wright, who is now chief security adviser at security software company SentinelOne, used to teach behavioural analysts at the US National Security Agency (NSA) about the exploitation of human behaviour. He is now seeing some of those techniques being used on the dark web, an encrypted part of the internet that can be accessed using popular networks such as Tor.The Tor browser is privacy-focused, meaning it can obscure who is using it and what data is being accessed. It offers bad actors a way to operate with a degree of impunity, as law enforcement find it much more difficult to track down criminals that use it.Tor is a way to access the internet that requires software, known as the Tor browser, to use it.The name is an acronym for The Onion Router. Just as there are many layers to the vegetable, there are many layers of encryption on the network.It was originally designed by the US Naval Research Laboratory, and continues to receive funding from the US State Department.It attempts to hide a person's location and identity by sending data across the internet via a very circuitous route involving several ""nodes"" - which, in this context, means using volunteers' PCs and computer servers as connection points.Encryption applied at each hop along this route makes it very hard to connect a person to any particular activity.To the website that ultimately receives the request, it appears as if the data traffic comes from the last computer in the chain - known as an ""exit node"" - rather than the person responsible.Since the beginning of the global pandemic, marketplaces on the dark web have seen a rise in Covid-19 related products and services. Sought-after N95 masks, gowns, gloves and the drug chloroquine have all been listed on these marketplaces. Last month, security software firm IntSights found blood allegedly belonging to recovered coronavirus patients was even being offered for sale. Criminals hope a heightened sense of fear will make people rush to buy these products, and as a result these items are not cheap; an Australian Institute of Criminology report found the average fake vaccine was being sold for about $370 (£300), while one supposedly sourced from China was selling for between $10-15,000 (£8-12,000).One of the reasons for the rise in such sales may be because many fraudsters are having to turn from their normal methods of making money on the dark web - such as selling fake flights booked using stolen airmiles - because these industries are currently dormant. Many criminals also see an opportunity - as the majority of people are working from home, there is a greater chance of lax cyber security in place. ""There was suddenly a huge shift [on the dark web] of talking about vulnerabilities in collaboration software when they realised people were going to be working from home,"" says IntSights chief security officer Etay Maor. More Technology of BusinessPhishing scams have also been on the rise. These are where fraudsters pretend to be a different organisation or person by email, hoping the person will provide some login details or personal data, which can then be used to steal money or someone's identity. ""The phishing attacks started with those pretending to be from the NHS, and then extended to secondary organisations that are related to Covid-19 like banks or HMRC emailing about funding, grants or being furloughed,"" says Javvad Malik, security advocate at training company KnowBe4.""Now there are Covid-19 related phishing templates making their way into all of the phishing kits that are available on the dark web - meaning people can imitate Apple or LinkedIn with a set of standard templates,"" he adds.In addition, many services and products, including phishing kits are being offered at discount in ""coronavirus sales"".""There are people who have been specialising in phishing pages, shady VPNs or spamming services for a number of years, who are now offering discounts because they believe it's the best time to make money and spread these kits,"" says Liv Rowley, threat intelligence analyst at Blueliv, a computer and network security firm.The dark web was designed by the US Naval Research Laboratory, with the idea of enabling human rights activists and people within the military to talk and collaborate in a secure, anonymous way. While the introduction of bitcoin enabled criminals to make money on the dark web, there remains a huge number of users that opt to use it for its initial purpose - speaking to others anonymously on forums.According to Mr Malik, these forums have often been used to fuel conspiracy theories around the virus.""Conspiracies about 5G being the vehicle of this virus, or bioweaponry or that Bill Gates is the man behind it tend to crop up on the dark web,"" he says.As social media companies and other news outlets crack down on misinformation, many others may be pushed onto the dark web. These forums often act as a gateway to marketplaces, for people to plug their products or services to a targeted audience. This could be a way for fraudsters to make further money in the months to come. The flipside to this is that many journalists, activists and citizens may be using the dark web to communicate in countries where there is a lot of censorship. Tor versions of many news outlets, including the BBC and New York Times, may be used if the original sites are blocked by governments or states, for instance. Netblocks, a digital rights advocacy group says that many countries have cut access to the web in different ways, as they seek to control the flow of information about the coronavirus outbreak.Two ransomware groups had said they would not attack any hospitals or healthcare organisations during the pandemic, but as Foreign Secretary Dominic Raab outlined in a recent press briefing, there is evidence that criminal gangs are actively targeting national and international organisations that are responding to the pandemic - including hospitals.""These organisations are targeted because of how vulnerable they are at this time and because of the likelihood that a ransom would be paid,"" says Charity Wright, cyber threat intelligence adviser at IntSights.The co-ordination and orchestration of many of these attacks often begin on the dark web.""We are seeing more offerings on the dark web specifically for healthcare-related information and for targeting healthcare facilities and doctors. There's even a database someone has created on the dark web with all kinds of information about medical staff,"" says Etay Maor from IntSights. At its core, the dark web may still be being used for the same reasons it was intended to be used for - from a privacy and security perspective. But criminals are using this to try to exploit a global crisis for financial gain.""That's the double-edged sword that as a society we haven't quite worked out: how do we safeguard freedom of speech and ensure privacy, but at the same time track down and stop people abusing those freedoms?"" says Javvad Malik. ",19 May 2020,business
What Trump wants from global trade,"President Donald Trump's approach to international trade is driven to a large extent by his belief that the United States is being unfairly treated by other countries.His main supporting evidence is the trade deficit - the US buys more than it sells internationally. He has referred to the deficit as losing money. In one tweet he wrote about losing $500bn (£388bn) a year as a result of crazy trade with China. No more, he promised.  One of his central economic objectives has been to reduce it. In November 2017, his first year in office, he referred to the total deficit with all trade partners of almost $800bn a year as unacceptable. He said: ""We are going to start whittling that down, and as fast as possible"". Rivals is a season of in-depth coverage on BBC News about the contest for supremacy between the US and China across trade, tech, defence and soft power.Read more here.But it hasn't come down. The figure that President Trump referred to was for trade in goods alone. It has increased in both of the full years since he took office. It was $750bn in the final year under President Barack Obama, $887bn in 2018, and the increase has continued. We have figures for the first nine months of this year, showing the deficit was larger, though only slightly, than in the same period of 2018. Mr Trump focuses on bilateral deficits, often suggesting they are evidence of the unfair actions of the other country concerned.The deficit with China is by far the largest. It rose in Mr Trump's first two years, but for the first nine months of 2019 it is lower. Both imports and exports have fallen, imports by more. That is hardly surprising as the two countries have applied increased tariffs to large swathes of one another's goods. So a success for President Trump?  Only if you think bilateral trade balances really matter. And most economists think they don't. Getting one bilateral deficit down does not guarantee you reduce the overall deficit. The deficit with China may be down, but others have increased - Vietnam, Mexico and Taiwan for example. More from the BBC's series taking an international perspective on trade:Part of the underlying story is the fact that the trade balance with the rest of the world is mainly driven not by barriers that countries put in the way of one another's goods.Instead, it's about whether countries buy more goods and services than they produce. Prof Greg Mankiw of Harvard University (who used to be a supporter of the Republican Party) puts it like this: ""If you really want to reduce a trade deficit, the way to do it is to bring down spending relative to production, not to demonise trading partners around the world.""President Trump has, if anything, done just the opposite. His tax cuts have given a boost to the US economy, though that may now be fading. But it's not really surprising that the trade deficit should rise as Americans - families and businesses - have had more to spend, and some of that money goes on imported goods. There is an idea in economics known as the ""twin deficits hypothesis"", that there is a link between a government budget deficit and a trade deficit - or strictly speaking, a current account deficit that includes some financial transactions in addition to trade in goods and services. It is by no means a settled debate, but the idea that tax cuts can in some circumstances lead to a larger trade deficit is entirely credible.  So there is a coherent story here that President Trump has taken steps - tax cuts - that make it harder to achieve something else he wants - a reduction in the trade deficit.  That's not to say that President Trump isn't on to something, in the sense that his views on trade may reflect real economic damage in some communities. The Nobel Prize winner Esther Duflo says there is among economists an ""instinctive view on trade, that it should be good for everyone"". But it's not true she says.Although trade boosts growth overall, it does produce concentrated pockets of job losses, she says. That's not a new view, and it doesn't mean you can turn the clock back or reverse the losses by putting up new trade barriers. ",28 November 2019,business
The garlic farmers who love Trump's tariffs,"US garlic growers say they have finally started to win their 25-year battle with Chinese imports - thanks to President Donald Trump.The president slapped a second round of tariffs on garlic from China this year, boosting demand for the US-grown crop.""It is untrue that there are no winners in a trade war,"" says Ken Christopher, executive vice president of California-based Christopher Ranch, the nation's latest garlic producer.""When President Trump's tariffs for garlic kicked in, it was at that point that California garlic truly became competitive.""US garlic growers have complained since the early 1990s that China was flooding the US with the pungent vegetable, selling it at below the cost of production. This is a trade practice known as ""dumping"".The US government investigated, and back in 1994 agreed that some Chinese firms were indeed selling their garlic in the US ""at less than fair value"".As a result, any Chinese company found guilty of the practice was hit by a whopping 377% duty. However, Chinese firms soon found ways around these case-by-case penalties, such as by simply setting up new shell businesses.Mr Christopher likened it to ""playing whack-a-mole"", and cheap Chinese garlic continued to flood into the US. As a result of this, of the 12 US commercial garlic farms that existed in the 1990s, only three of the largest producers survived.Today the remaining US garlic farmers say that Trump's tariffs on Chinese garlic are working because they apply across the board and straight away - there is now no way for the importers to get around them.US tariffs on Chinese garlic were first set at 10% in September 2018, before rising to 25% from May of this year.""Trump's tariffs are all assessed and billed up front,"" says Mr Christopher. ""So it is impossible for dumpers from China to evade them.""Christopher Ranch was one of the three US garlic producers that made it through the 1990s. Today it harvests more than 100 million pounds (45 million kg) of the bulbs every year, supplying almost one third of all fresh garlic consumed in the US.Mr Christopher says that the family-owned business has seen sales soar since the tariffs on Chinese imports were first put in place.""We're seeing growth year-over-year of between 6 to 23% every week on our fresh garlic,"" he says. ""It may not seem like a lot, but when measured in millions of pounds [in weight of sales] it makes a huge difference to our bottom line.""To access the impact of the tariffs, the BBC looked at daily prices measured by the US Department of Agriculture.For white garlic sold in Boston in August, 2018, a 30lb (13.6kg) box from China cost between $25 and $30 (£19 and £23). A container of Californian garlic of the same size was $68.Following the tariffs, the cost of the same box of Chinese garlic has risen to between $52 and $55, while the Californian garlic is now between $70 and $74. So while the Chinese garlic is still cheaper, the difference in price has markedly narrowed.Fourth generation Californian farmer Jack Vessey is, however, missing out on the renewed demand for US garlic - his family business Vessey & Company stopped growing the crop a number of years ago, as they couldn't make it profitable in the face of the Chinese imports.""Stepping away from the garlic business was a very difficult decision for me,"" he says.""There were three generations before me who dedicated much of their lives to garlic. [But] I decided that if there was a chance for our business to survive into a fifth generation we had to divest our garlic holdings.""For almost 100 years his family had grown garlic together with other vegetables, such as cabbage and cauliflower.Rivals is a season of in-depth coverage on BBC News about the contest for supremacy between the US and China across trade, tech, defence and soft power.Read more here.""Garlic, for many years, accounted for more than 50% of our receipts,"" adds Mr Vessey. ""But once the Chinese began dumping product in the US market, we started to cut back on our acreage and build other sectors of our business.""Frank Lavin, a former Under Secretary for International Trade at the Department of Commerce, explains that the problem with the levy introduced in 1994 was that the Chinese importers were too fast on their feet.""They would be discovered and sanctioned, and then they would simply set up another dummy structure,"" he says.""The fact is they were more nimble, occasionally, in setting up these entities than US Customs could be in discovering them.""Mr Christopher says that - by contrast - President Trump's tariffs ""are very easy to enforce because garlic can't even enter the country now before the tariff is billed to them. That's what's tactically changing the game.""He adds that the media is wrong to attack the president's strident tariff policy - the US has now put in place tariffs on $200bn of Chinese goods.""It's been a difficult thing to talk about, as the media continually simplifies the tariffs as injuring farmers, whereas it actually benefits the domestic garlic industry,"" says Mr Christopher.More from the BBC's series taking an international perspective on trade:However, trade experts caution that higher costs are likely to be passed onto consumers.""If you are a domestic firm that is being sheltered from foreign competition by tariff walls, then you tend to like tariffs because it keeps out foreign competition,"" says Deborah Elms, head of the Temasek Foundation Centre for Trade and Negotiations.""But what that does is keep out foreign competition and allow domestic competitors to potentially provide goods that are less competitive in the longer run.""Mr Christopher says that while he understands that it is ""not in the long-term macroeconomic interest of the US to engage in trade wars, our industry needed immediate relief"".",21 November 2019,business
How China plans to lead the computer chip industry,"On a university campus on the outskirts of Hong Kong a group of engineers are designing computer chips they hope will be used in the next generation of Chinese made smart phones.Patrick Yue leans back in his chair in a coffee shop on the campus, sporting a Stanford University t-shirt. He is the lead engineer and professor overseeing the project.His research team designs optical communication chips, which use light rather than electrical signals to transfer information, and are needed in 5G mobile phones and other internet-connected devices.He tells me about the challenges China faces in developing a world-beating computer chip industry.""I actually think the actual designers will be as big a bottle neck as the manufacturing. We don't have nearly as many research institutes and industry bases to train the designers,"" he says.His department is part-funded by Huawei, the Chinese communications and telecom giant at the centre of an international political storm. In May the US added Huawei to a list of companies that US firms cannot trade with unless they have a licence, blaming security concerns.Rivals is a season of in-depth coverage on BBC News about the contest for supremacy between the US and China across trade, tech, defence and soft power.Read more here.Many industry observers fear that the US-Chinese trade war, risks unravelling the global technology supply chain.In particular, China relies on overseas companies for computer chips (or semiconductors), the tiny devices used in everything from consumer electronics to military hardware. ""Politically everything can be used as a bargaining power,"" says Mr Yue.""If these companies and countries start to hold back on technology then everyone will get hurt. It's not good from a technological point of view,"" Mr Yue says.China has made no secret of its desire to become self-sufficient in technology. The nation is both the world's largest importer and consumer of semiconductors.It currently produces just 16% of the semiconductors fuelling its tech boom. But it has plans to produce 40% of all semiconductors it uses by 2020, and 70% by 2025, an ambitious plan spurred by the trade war with the US.In May 2018 China's President Xi Jinping met with the country's leading scientists and engineers, calling for specialists to work towards self-reliance in the production of core technologies.That meeting was just a month after the US government banned US firms from selling components to ZTE, China's second-largest maker of telecom network equipment.The ban highlighted to China's leaders that the nation's tech boom was dependent on foreign technology. In October this year, in its latest bid to help wean the nation's tech sector away from US technology, the Chinese government created a $29bn (£22bn) fund to support the semiconductor industry.""There is no question that China has the engineers to make chips. The question is whether they can make competitive ones,"" questions Piero Scaruffi, a Silicon Valley historian, and artificial intelligence researcher who works in Silicon Valley.More Technology of Business""Certainly, Huawei can develop its own chips and operating systems, and the government can make sure that they will be successful in China. But Huawei and other Chinese phone makers are successful also in foreign markets, and that's a totally different question: Will Huawei's chips and operating systems be as competitive as Qualcomm's and Android? Most likely not. At best, it will take years before they are,"" Mr Scaruffi adds.Mr Scaruffi estimates that China could be as many as 10 years behind the leading producers of high-end computer chips. The majority of chips made for high-end electronics are manufactured by specialist foundries like the Taiwanese Semiconductor Manufacturing Company (TSMC). It produces more than 70% of chips designed by third party companies. Just securing the best machinery needed to make high-end chips is difficult.""To start out with equipment, its very high precision equipment. You need to print very fine features.  The equipment that is needed to have this kind of technology is controlled by a few companies in the world,"" says Mr Yue. He believes that Chinese technology is three to four generations behind companies like TSMC. China lacks the industry experience to manufacture high end chips, he says. But he believes that companies like Huawei are already competitive when it comes to designing chips.Where does this leave the tech giant Huawei?Mr Yue argues that Huawei is trying to replicate the successful business models of firms like Samsung, which produces its own computer chips - rather than trying to fall into line with Beijing's industrial ambitions.""You can almost view them as an integrated company with the expertise of what Apple or Qualcomm has,"" says Mr Yue.Li Changzhu is a lifelong employee of Huawei and president of the company's handset business. He joined the company 23 years ago as a fresh graduate and has watched it grow into the international tech giant. He claims that the goal of companies like Huawei is simply to satisfy consumer needs. ""We are open to use other vendors chipsets. Every year we purchase a lot of chips from Qualcomm. We are open to that. We use the best chipsets to satisfy our customers,"" he says sitting on the side of a tech conference in Macau, a semi- autonomous southern Chinese city.Growth in the semiconductor industry is typically driven by disruptive new technologies. In the late 2000s the introduction of smartphones boosted demand for the tiny integrated circuits that control everything from memory to Bluetooth and wifi.But today China's ambition to dominate sectors such as artificial intelligence and 5G is expected to further ramp up demand for high-end chips.Industry analysts like Mr Scaruffi question China's ability to truly innovate. ""Every Chinese city wants to build its own Silicon Valley. It tends to be more driven from the top. Silicon Valley had a big advantage, that it was very far away from the political power,"" says Mr Scaruffi. He believes that China's technological success lies in the implementation of technology rather than its creation.""If your metric is how many people use smart phones to go shopping then China wins big time. But if your metric is Nobel Prize winners, then China is losing badly. China of course has been very successful in implementing technology in a way that dramatically alters society,"" he says. ",19 November 2019,business
