Coronavirus: What's it like to be laid off over Zoom?,"When travel start-up Pana held a meeting for all of its employees over Zoom, they explained that some staff would be laid off, and that there would be two further calls that morning - one at 09:00 for those who would be laid off, and one at 09:45 for those who would not.Employees would know which meeting they were attending by the invites they would have received by email.Sales executive Ruthie Townsend was invited to join the 09:00 call but, due to the shock of the news, she could not remember which call was for those about to be laid off, and which was for those being retained.""Because it was such a highly stressful situation, it was hard to process what was going on so I got mixed up. I joined the 09:00 call as that was the invite I had, and once I realised that I was being laid off, I quickly turned off my video,"" she says. Ms Townsend was on the call with 15 of her colleagues, and executives from the company then walked these employees through the benefits, the severance package and the next steps.The company, based in Denver, Colorado, had been hit by the collapse in travel due to the coronavirus outbreak.But there had been a feeling that redundancies would be a last resort, and Ms Townsend had no idea what was coming that morning. That kind of shock is unfortunately commonplace at the moment, as companies are slashing staff numbers to cope with the economic fallout from the coronavirus.Before the crisis managers would usually have met staff face-to-face, to give them the bad news.Now video-conferencing tools, such as Zoom and Microsoft Teams (MS Teams), are being used to replicate the formality of the meeting.Chris Malone, an audio visual technician at events company Sparq in the UK, feared for his role when it was explained to him that a HR representative would be on his next MS Teams call along with his line manager. His instincts proved correct, as he was told he was going to be laid off.For him, the use of a video call made the meeting formal, but more awkward than an in-person meeting or telephone call. ""I think if you were doing it over the phone, it would mean you don't have to look at someone but when you have the video call, you get dressed up to make it feel formal and to look presentable. ""Even though it is a video call, the pressure is there - and as you're not in the room with them there isn't a natural chemistry, connection or body language you can read off, and there's a little bit of a delay, you're waiting for someone else to say something,"" he says.However, Mr Malone believes that a one-to-one video call is still the best way a business can break the unfortunate news to an employee in the current circumstances. For Ms Townsend, there were pros and cons to having more than 15 people on the same call as her.""I don't think any way of making someone redundant over video conference is going to be ideal. If it's one-on-one, it's still going to be really hard and then your boss is going to see all of your emotions. I liked the group setting because I turned off my video, and I didn't have to say anything,"" she says. However, she believes that the group setting prevented her from asking important questions at the time. More Technology of BusinessSarah Evans, partner at law firm JMW, explains that communication prior to any announcement is key for employers. ""What many big businesses can do is conduct large meetings on Zoom, to make an announcement to the same people at the same time, so there's no miscommunication going around,"" she says.This would make it clear that redundancies or the furlough scheme are being considered for employees, and would also make clear what this means for the business, and how they intend to follow-up with individuals.It is key for employers to provide employees with time to absorb the information, ask questions and give people the opportunity to voluntarily be made redundant or furloughed. ""In redundancy cases, that would be at least a couple of meetings to go through opportunities to avoid redundancy and consider alternatives, and there's no reason why all of this can't be done on Zoom,"" she says.The use of video, phone call or in-person, is not a legal matter; it's merely a matter of etiquette. However, the group call, which Ruthie Townsend had experienced in the US, would not be allowed in the UK.""That wouldn't cut it in UK law, as you have a right to individual consultation. There's nothing wrong with a group call to announce potential redundancies but you shouldn't be making people redundant in the same video call,"" Ms Evans says. If this were the way a UK employer had acted, the employee might then have a case for unfair dismissal. The option to record video calls could also prove problematic in these cases. Peter Binning, a partner at law firm Corker Binning, explains that, generally speaking, anyone should ask for consent before recording a call of any kind. However, regardless of whether consent was asked for, given or not given, a recorded conversation could still be admissible in an unfair dismissal case. ""Whoever wants to use the evidence has to be able to prove that it had been properly recorded and was genuine but it would be a matter for the court or tribunal to decide whether that evidence should be admitted,"" Mr Binning says.And those wanting to snoop on people by deliberately joining a Zoom call where someone else is being made redundant would most definitely be breaking the law - as there are a number of criminal offences about intercepting communications in the regulations.While video may create new problems, it is the best replacement for a meeting in person. ""It will feel more uncomfortable to look someone in the eye, and the level of emotional frustration and anger will be more visible, but it is essential to delivering the message in an open, fair and transparent way to another person,"" says Stuart Duff, an expert on the psychology of leadership at business psychology consultancy Pearn Kandola.",2 June 2020,business
Carly Fiorina's journey from secretary to CEO,"The BBC's weekly The Boss series profiles different business leaders from around the world. This week we speak to Carly Fiorina, US business leader, political figure and philanthropist.It should give hope to any young person striving to reach the top, knowing that Carly Fiorina started her business career as a humble secretary.""I spent my time greeting visitors, answering phones, typing memos,"" she says. ""But I was really committed to the job, arriving early, and leaving late.""Mrs Fiorina, 65, is looking back on her 21-year-old self, who in 1976 got her first full-time job at a small property company in Palo Alto, California.From that modest start she went on to become the first female chief executive of a Fortune 50 company (the 50 largest firms in the US). This happened in 1999 when, aged 44, she was appointed to the top job at computer group Hewlett-Packard.Fortune magazine subsequently named her the most powerful woman in US business five years in a row, with the publication declaring that ""Carly Fiorina didn't just break the glass ceiling, she obliterated it"".However, her time at HP was not universally regarded as a success, with much criticism of her decision to merge the business with rival Compaq in 2001. And in 2005 she resigned after a disagreement with her fellow board members.Mrs Fiorina subsequently entered the political arena, first as an adviser to the late John McCain's 2008 presidential campaign. McCain went on to lose the election to Barack Obama.Eight years later, she herself ran to become the Republican Party candidate for the 2016 presidential election. She dropped out after nine months, due to low polling numbers, with Donald Trump going on to win both the candidacy and, of course, the presidency. She said at the time that she was ""horrified"" by Trump.Born in 1954 in Austin, Texas, her family moved around a lot, due to her father's job. Her dad, Joseph Sneed, was a law professor who went on to become US deputy attorney general. Her mother was a painter.She got a degree in philosophy and medieval history from Stanford University in California, before gaining a Master of Business Administration from the University of Maryland.In 1980 she entered the technology sector when she joined US giant AT&T as a management trainee. Her rise at the company was meteoric. By 1990 she was the firm's first female vice president, and by 1995 she was a senior director at AT&T spinoff Lucent Technologies. It was also while at AT&T that she met her husband Frank, and they were married in 1985.Mrs Fiorina's success at the telecoms giant caught the attention of HP, who were looking for a fresh start after missing nine quarterly profit targets in a row. She was appointed to the top job at the company in July 1999.""When I arrived at HP I purposely brought no-one new in at the beginning,"" she says. ""I did that for a very explicit reason, which was to send a very clear message to the organisation that we could, and we would, figure out what the problem was, and we would fix it.""[However], I was brought in by the board to transform the company. Those were the words they used.""Under Mrs Fiorina's leadership, costs were reduced, and eventually 30,000 jobs were removed from the combined 145,000 HP and Compaq workforce. A further 80,000 employees took pay cuts at a business which at its peak was worth $87bn (£71bn). ""Of course it is incredibly difficult to have to fire people, to have to lay people off,"" she says. ""In that very difficult circumstance, the best I could do was to fully explain why.""Why are we having to lay people off? Because if we don't, we will go out of business like many of our peers.""When the merger between HP and Compaq went ahead in 2002, it was the biggest ever in the technology sector at the time, and created the world's largest seller of personal computers.Whether the merger was a success, however, is still hotly contested. Tech website ZDNet said in 2016 that HP and Compaq's coming together was ""the worst merger ever"". By contrast, the Huffington Post called it ""the merger that worked"".What is certain is that the HP board were unhappy with the profits and share price of the combined business, and Mrs Fiorina was asked to resign in 2005. Her severance package was reportedly worth $21m.""We did, in fact, restore a great company,"" she says. ""[But] we had a dysfunctional board. It was dysfunctional when I arrived. It was dysfunctional when I left.""If leading HP wasn't enough of a battle, Mrs Fiorina jumped into politics for a decade from 2006. After working for John McCain, she went on to stand as the Republican candidate in the 2010 US Senate election in California, but lost out to the Democratic Party incumbent.Mrs Fiorina then worked for the American Conservative Union, a right-wing lobbying organisation, before running to be the 2016 Republican presidential candidate. Looking back on this campaign, she says that ""the process itself is insane"".She adds: ""Meaning, when you think about the process the  candidates go through, does it really help someone to be a better leader? Does it help us to decide a better leader? I don't think so.""It is a really crazy process that goes on for far too long. It is far too driven by a media spectacle.""But with another US presidential election due to be held this autumn, what does she think of President Trump after his four years in office? She declines to comment.More The Boss features:While the worlds of politics and business can be tough, Mrs Fiorina's biggest fight came in 2009 when she was diagnosed with breast cancer, and subsequently required a double mastectomy.She says the experience taught her a great deal. ""While I hope to never go through cancer again, it was a very important part of my journey, and for that I'm grateful.""I learned and grew so much during this time - learned about love and friendship, grew in my faith, and valued the kindness of strangers.""Technology firm boss Mihai Ivascu says that Mrs Fiorina is an ""inspirational leader"". ""She does not limit herself to what she is expected to do,"" says Mr Ivascu, who runs London-based M3 Holdings, and was included on a ""Forbes 30 Under 30"" list of leading young entrepreneurs. ""And as she has said, leadership is about changing the status quo when it needs changing.""In recent years Mrs Fiorina, who lives with her husband in Washington DC, has dedicated most of her time to her charity work. This includes being the chair of Good360, which helps companies give their surplus merchandise to various charities, and running Unlocking Potential, which helps the bosses of charities improve their leadership skills.Looking back on the start of her career, and her days as a secretary, she says: ""I was going to be the best secretary out there. I had no idea where it would lead.""",1 June 2020,business
What Trump wants from global trade,"President Donald Trump's approach to international trade is driven to a large extent by his belief that the United States is being unfairly treated by other countries.His main supporting evidence is the trade deficit - the US buys more than it sells internationally. He has referred to the deficit as losing money. In one tweet he wrote about losing $500bn (£388bn) a year as a result of crazy trade with China. No more, he promised.  We have lost 500 Billion Dollars a year, for many years, on Crazy Trade with China. NO MORE!End of Twitter post  by @realDonaldTrumpOne of his central economic objectives has been to reduce it. In November 2017, his first year in office, he referred to the total deficit with all trade partners of almost $800bn a year as unacceptable. He said: ""We are going to start whittling that down, and as fast as possible"". Rivals is a season of in-depth coverage on BBC News about the contest for supremacy between the US and China across trade, tech, defence and soft power.Read more here.But it hasn't come down. The figure that President Trump referred to was for trade in goods alone. It has increased in both of the full years since he took office. It was $750bn in the final year under President Barack Obama, $887bn in 2018, and the increase has continued. We have figures for the first nine months of this year, showing the deficit was larger, though only slightly, than in the same period of 2018. Mr Trump focuses on bilateral deficits, often suggesting they are evidence of the unfair actions of the other country concerned.The deficit with China is by far the largest. It rose in Mr Trump's first two years, but for the first nine months of 2019 it is lower. Both imports and exports have fallen, imports by more. That is hardly surprising as the two countries have applied increased tariffs to large swathes of one another's goods. So a success for President Trump?  Only if you think bilateral trade balances really matter. And most economists think they don't. Getting one bilateral deficit down does not guarantee you reduce the overall deficit. The deficit with China may be down, but others have increased - Vietnam, Mexico and Taiwan for example. More from the BBC's series taking an international perspective on trade:Part of the underlying story is the fact that the trade balance with the rest of the world is mainly driven not by barriers that countries put in the way of one another's goods.Instead, it's about whether countries buy more goods and services than they produce. Prof Greg Mankiw of Harvard University (who used to be a supporter of the Republican Party) puts it like this: ""If you really want to reduce a trade deficit, the way to do it is to bring down spending relative to production, not to demonise trading partners around the world.""President Trump has, if anything, done just the opposite. His tax cuts have given a boost to the US economy, though that may now be fading. But it's not really surprising that the trade deficit should rise as Americans - families and businesses - have had more to spend, and some of that money goes on imported goods. There is an idea in economics known as the ""twin deficits hypothesis"", that there is a link between a government budget deficit and a trade deficit - or strictly speaking, a current account deficit that includes some financial transactions in addition to trade in goods and services. It is by no means a settled debate, but the idea that tax cuts can in some circumstances lead to a larger trade deficit is entirely credible.  So there is a coherent story here that President Trump has taken steps - tax cuts - that make it harder to achieve something else he wants - a reduction in the trade deficit.  That's not to say that President Trump isn't on to something, in the sense that his views on trade may reflect real economic damage in some communities. The Nobel Prize winner Esther Duflo says there is among economists an ""instinctive view on trade, that it should be good for everyone"". But it's not true she says.Although trade boosts growth overall, it does produce concentrated pockets of job losses, she says. That's not a new view, and it doesn't mean you can turn the clock back or reverse the losses by putting up new trade barriers. ",28 November 2019,business
The garlic farmers who love Trump's tariffs,"US garlic growers say they have finally started to win their 25-year battle with Chinese imports - thanks to President Donald Trump.The president slapped a second round of tariffs on garlic from China this year, boosting demand for the US-grown crop.""It is untrue that there are no winners in a trade war,"" says Ken Christopher, executive vice president of California-based Christopher Ranch, the nation's latest garlic producer.""When President Trump's tariffs for garlic kicked in, it was at that point that California garlic truly became competitive.""US garlic growers have complained since the early 1990s that China was flooding the US with the pungent vegetable, selling it at below the cost of production. This is a trade practice known as ""dumping"".The US government investigated, and back in 1994 agreed that some Chinese firms were indeed selling their garlic in the US ""at less than fair value"".As a result, any Chinese company found guilty of the practice was hit by a whopping 377% duty. However, Chinese firms soon found ways around these case-by-case penalties, such as by simply setting up new shell businesses.Mr Christopher likened it to ""playing whack-a-mole"", and cheap Chinese garlic continued to flood into the US. As a result of this, of the 12 US commercial garlic farms that existed in the 1990s, only three of the largest producers survived.Today the remaining US garlic farmers say that Trump's tariffs on Chinese garlic are working because they apply across the board and straight away - there is now no way for the importers to get around them.US tariffs on Chinese garlic were first set at 10% in September 2018, before rising to 25% from May of this year.""Trump's tariffs are all assessed and billed up front,"" says Mr Christopher. ""So it is impossible for dumpers from China to evade them.""Christopher Ranch was one of the three US garlic producers that made it through the 1990s. Today it harvests more than 100 million pounds (45 million kg) of the bulbs every year, supplying almost one third of all fresh garlic consumed in the US.Mr Christopher says that the family-owned business has seen sales soar since the tariffs on Chinese imports were first put in place.""We're seeing growth year-over-year of between 6 to 23% every week on our fresh garlic,"" he says. ""It may not seem like a lot, but when measured in millions of pounds [in weight of sales] it makes a huge difference to our bottom line.""To access the impact of the tariffs, the BBC looked at daily prices measured by the US Department of Agriculture.For white garlic sold in Boston in August, 2018, a 30lb (13.6kg) box from China cost between $25 and $30 (£19 and £23). A container of Californian garlic of the same size was $68.Following the tariffs, the cost of the same box of Chinese garlic has risen to between $52 and $55, while the Californian garlic is now between $70 and $74. So while the Chinese garlic is still cheaper, the difference in price has markedly narrowed.Fourth generation Californian farmer Jack Vessey is, however, missing out on the renewed demand for US garlic - his family business Vessey & Company stopped growing the crop a number of years ago, as they couldn't make it profitable in the face of the Chinese imports.""Stepping away from the garlic business was a very difficult decision for me,"" he says.""There were three generations before me who dedicated much of their lives to garlic. [But] I decided that if there was a chance for our business to survive into a fifth generation we had to divest our garlic holdings.""For almost 100 years his family had grown garlic together with other vegetables, such as cabbage and cauliflower.Rivals is a season of in-depth coverage on BBC News about the contest for supremacy between the US and China across trade, tech, defence and soft power.Read more here.""Garlic, for many years, accounted for more than 50% of our receipts,"" adds Mr Vessey. ""But once the Chinese began dumping product in the US market, we started to cut back on our acreage and build other sectors of our business.""Frank Lavin, a former Under Secretary for International Trade at the Department of Commerce, explains that the problem with the levy introduced in 1994 was that the Chinese importers were too fast on their feet.""They would be discovered and sanctioned, and then they would simply set up another dummy structure,"" he says.""The fact is they were more nimble, occasionally, in setting up these entities than US Customs could be in discovering them.""Mr Christopher says that - by contrast - President Trump's tariffs ""are very easy to enforce because garlic can't even enter the country now before the tariff is billed to them. That's what's tactically changing the game.""He adds that the media is wrong to attack the president's strident tariff policy - the US has now put in place tariffs on $200bn of Chinese goods.""It's been a difficult thing to talk about, as the media continually simplifies the tariffs as injuring farmers, whereas it actually benefits the domestic garlic industry,"" says Mr Christopher.More from the BBC's series taking an international perspective on trade:However, trade experts caution that higher costs are likely to be passed onto consumers.""If you are a domestic firm that is being sheltered from foreign competition by tariff walls, then you tend to like tariffs because it keeps out foreign competition,"" says Deborah Elms, head of the Temasek Foundation Centre for Trade and Negotiations.""But what that does is keep out foreign competition and allow domestic competitors to potentially provide goods that are less competitive in the longer run.""Mr Christopher says that while he understands that it is ""not in the long-term macroeconomic interest of the US to engage in trade wars, our industry needed immediate relief"".",21 November 2019,business
