UK borrowing at record high as virus cost soars in April,"Government borrowing surged to £62bn in April, the highest monthly figure on record, after heavy spending to ease the coronavirus crisis.It means the deficit - the difference between spending and tax income - was larger last month than forecast for the whole year at the time of the Budget. The data from the Office for National Statistics revealed the soaring cost of support, such as furlough schemes.But Chancellor Rishi Sunak said things would be worse without government aid.The government's independent forecaster, the Office for Budget Responsibility (OBR), has predicted that borrowing for the whole year could reach £298bn, more than five times the estimate at the time of the March Budget.Jonathan Athow, deputy national statistician at the ONS, described April's figure as ""pretty much unprecedented"". It said the cost of furlough schemes alone was £14bn in April.""Borrowing now is about six times what it was [in April] last year, so we are talking about some really significant changes in the government finances,"" Mr Athow told the BBC.He added it was impossible to forecast the current year's public finances because of the ""high amounts of uncertainty"". Tax receipts have fallen heavily, as the Treasury has allowed companies to defer some payments. The amount received from VAT in April was negative, with the government collecting less than was handed back in repayments.Meanwhile, borrowing by the state in March 2020 has been revised up by £11.7bn to £14.7bn, the ONS said.It said this was driven by a reduction in previous estimates of tax receipts and National Insurance contributions.The surge in borrowing comes after Chancellor Rishi Sunak stepped up financial support for businesses and employees after vast areas of the economy were forced to halt due to the coronavirus lockdown.After publication of the figures, Mr Sunak said that if the government had not provided financial support, the cost to the economy and people's livelihoods would be much worse.""Our top priority is to support people, jobs and businesses through this crisis and ensure our economic recovery is as strong and as swift as possible,"" he said.""That's why we've taken unprecedented steps to provide lifelines to people and businesses with our furlough scheme, grants, loans and tax cuts.""For the past decade, the government had been trying to practise strict financial housekeeping, aiming for position where it could cover day-to-day spending with the money form our taxes and eliminate the deficit. But then the crisis hit - and as the chancellor claims, the schemes put in place have provided a lifeline to tide millions over, to prevent an even bigger economic disaster. It was worth ripping up the rulebook for, he said.However the bills are mounting, just as the amount received from taxpayers slumped.  This year's deficit could be the equivalent of the biggest slice of our income since the Second World War - and that hole needs pluggingFor the moment, the government has increased its borrowing on financial markets, through bonds, effectively IOUs - but there is a limit to how much it can  do so. Ultimately, economists say taxes will have to rise, or spending cut - the emergency raft will have a price tag which we can't escapeBut the chancellor will have to impose those carefully to avoid jeopardising a recovery. And if he opts for tax hikes, he'll risk breaking some election promisesThe scale of the economic consequences was underlined on Friday in separate retail sales data from the ONS. These showed that High Street sales crashed last month as shops closed for the lockdown.It was also announced on Friday that a mortgage payment holiday scheme for homeowners in financial difficulty during the pandemic has been extended for another three months.As a result of the jump in borrowing, total public sector debt rose to £1,888bn at the end of April - £118.4bn higher than April 2019.Former chancellor George Osborne told the BBC: ""We have to come to terms with the fact that Britain is poorer and the economy is smaller than it would have been.""Asked if the economy would bounce back, he said: ""Bounce is the wrong word, but it will recover."" Ruth Gregory, an economist at Capital Economics, described April's borrowing as ""alarmingly high"", but added that a small easing of the lockdown from 13 May probably meant the government would not have to borrow as much this month.And despite the pressure on public finances, Charlie McCurdy, a researcher at the Resolution Foundation, said there were no signs the government was struggling to raise money on the financial markets.""Record low interest rates mean the UK's higher debt burden should remain more than manageable,"" he said. ",22 May 2020,business
Coronavirus: US workers seeking jobless aid near 40 million,"A further 2.4 million Americans sought unemployment benefits last week, despite hopes that easing lockdown restrictions would help restart the US economy.The new filings brought the total since mid-March to roughly 38.6 million - almost a quarter of the workforce.The weekly figures have declined since peaking at almost 6.9 million at the end of March but remain high.The number of people remaining on benefits also continues to grow.Treasury Secretary Steven Mnuchin warned this week that the US risked ""permanent damage"" if the lockdowns continued.All 50 states in the US have started to reopen but it is not clear whether simply easing restrictions will prompt activity to rebound.In the week ending 16 May, about 2.2 million people sought unemployment benefits under the government's pandemic relief programme, which expanded eligibility to people such as gig economy workers. Their numbers, which are reported separately from the regular figures, are likely to grow as more states implement the programme.""This is so tragic it is almost unfathomable,"" Diane Swonk, chief economist at Grant Thornton, wrote on Twitter.Employers in the US cut more than 20 million jobs last month, sending the official unemployment rate to 14.7%, a sharp rise from 50-year lows of about 3.5% seen as recently as February. Economists have warned that the rate is likely to worsen and remain elevated for several years.While many of the unemployed said they believed their layoffs were temporary, a recent study estimated that more than 40% of recent pandemic job cuts are likely to be permanent.Companies such as Uber are among the firms that have announced significant job cuts in recent weeks, as they prepare for a prolonged slowdown. Retailers have also unveiled scores of permanent shop closures, with Victoria's Secret this week saying it would close some 250 locations in North America, with more expected.""Overall there is little evidence that the reopening of the economy has, as yet, led to any sudden snap back in employment,"" said Paul Ashworth, chief US economist at Capital Economics.Nearly half of US households have lost income since the pandemic lockdowns came into effect two months ago, according to a survey published Wednesday by the US Census. About 37% expect to lose income in the next month.The effect on spending - which powers the US economy - has already been felt, with retail sales falling a record 16.4% in April, the Commerce Department reported last week.",21 May 2020,business
Coronavirus: Retail sales crash in April as lockdown hits shops,"British retail sales plummeted by a record amount in April as many stores closed amid the coronavirus outbreak.The Office for National Statistics (ONS) said that the amount of goods sold fell by 18.1% last month.Clothing sales also halved as many High Street shops were shut under the lockdown measures introduced by the government in March.Online shopping as a proportion of all retail reached a record high of 30.7%, the ONS said.All types of shop, other than those selling clothing or household goods, saw record amounts being spent with them online.But the pick-up in online shopping failed to offset the collapse in spending on the High Street. ""The effects of Covid-19 have contributed to a record monthly fall in retail sales of nearly a fifth,"" ONS deputy national statistician for economic statistics Jonathan Athow said.He added that ""online shopping has again surged as people purchased goods from their homes"" amid lockdown.Richard Lim, chief executive of Retail Economics, said that the shift to online had benefitted ""those retailers with the slickest e-commerce operations and who managed to cope with the shift in demand.""Online grocery retailers were one of the major beneficiaries as they worked at an incredible pace to boost capacity.""In April, the proportion of online spending on food increased from 5.7% to 9.3%, according to the ONS.Elsewhere, off-licence sales also continued to increase, seeing a slight uptick after a 23.9% jump in March.Mr Lim added that that the impact of lockdown had ""paralysed"" the industry.""Clothing retailers were the hardest hit as the absence of social interaction, whether that's going to work, seeing friends or heading off on holiday, decimated demand for new outfits,"" he said.The fall in non-food sales in April resulted in the lowest levels of clothing and shoe sales seen since the ONS starting collecting the data.Separate figures from retail research firm Springboard show that the number of shoppers visiting UK High Streets, retail parks and shopping centres fell by 80% in April amid the lockdown.That was almost double the level of March's downturn when there was a 41.3% drop in visits to shopping locations.Several fashion firms have been struggling as customers stay at home.Clothing giant Primark, for example, said last month it had gone from making £650m in sales a month to nothing after the coronavirus outbreak forced it to close its stores in Europe and the US.Despite the gloomy news, Samuel Tombs, chief UK economist at Pantheon Macroeconomics, said: ""Retail sales should recover some of April's lost ground in May.""He said that was despite the fact that lockdown measures on store closures in England have not changed significantly since they were introduced.This point was echoed by Lisa Hooker, consumer markets leader at PwC: ""However bad April's figures are, we believe that retail has reached a turning point in the Covid-19 crisis. ""In the short term, May has already seen a loosening of lockdown restrictions across all the home nations.""Since the start of lockdown, garden centres have been allowed to open again in England. Other retailers classified as essential, such as DIY stores Homebase and B&Q, re-opened some sites around the end of April. ",22 May 2020,business
How bad are China's economic woes?,"While economists say China's economic data can't always be trusted, they now have a new dilemma - there is no data.On Friday, China said it wouldn't be setting a target for economic growth for this year. That's unprecedented - the Chinese government hasn't done this since it began publishing such goals in 1990. Abandoning the growth target is an acknowledgement of just how difficult a recovery in China will be in a post pandemic era. And while recent figures have shown that China is on the way out of its slowdown: it's an uneven recovery. First, the good news. For the first time since the pandemic hit China - factories are making goods again.Industrial output in April grew by a better-than-expected 3.9% - a marked difference from the collapse of 13.5% in the first two months of this year as massive lockdowns were imposed. There's also a swathe of other data that has been surprisingly strong - pointing to what economists like to call a V-shaped recovery - a sharp, drastic initial fall - followed by a quick rebound in economic activity. Coal consumption by six major power generators surged back to historical norms after May's ""Golden week"" holidays, according to investment bank JP Morgan. It currently stands 1.5% above the historical average, suggesting that power demand has returned to normal.And the pollution-free Chinese skies that we saw in the aftermath of the lockdowns there - well, they've disappeared as economic activity has picked up. China's air pollution levels recently surpassed concentrations over the same period last year for the first time since the coronavirus crisis began, driven by industrial emissions. All of this shows that China is slowly getting back to business. But it's not business as usual, and this shows just how difficult it will be for the rest of us to get our economies going again. Recent retail sales figures show just how difficult it is going to be to get people into shops and buying things.Sales were down 7.5% in April - better than March - but nowhere near where they need to be for the economy to be running on full cylinders. Many Chinese people are still worried about a second wave of infection, and they're not spending as much as they used to.  It's no wonder China has abandoned it's growth target this year - the government knows it will be hard to forecast just how deep this crisis has become. Compounding all of that -  are the all-important unemployment figures - which officially came in slightly higher in April than in March, at 6%, edging closer to historical highs. But most economists say the real number is much worse. The ""true level of unemployment is likely double this"", given that around a fifth of migrant workers haven't returned to the cities, says the think tank Capital Economics. Even China's hard-line Communist mouthpiece the Global Times - typically the Chinese economy's biggest cheerleader - has pointed out how dire the employment picture is.It is saying that this year ""it will be nearly impossible for Chinese employees in the private sector to earn as much salary as they did in 2019,"" as small businesses have had to fire employees or cut staff.  It's going to get worse before it gets better. Some 85% of private enterprises will struggle to survive over the next three months, writes Prof Justin Yifu Lin of Peking University, citing a Tsinghua University survey in March. ""Bankruptcy of enterprises will lead to an increase in unemployment,"" he adds. Granted, many Chinese people are employed by state-owned enterprises, and China's economic system is able to absorb the ranks of the unemployed better than the US. Chinese people have more savings, better family support, and many migrant workers also have land back home that they can rely on for basic needs and even sustenance in the very worst of circumstances.""You will see a great transition of migrant workers going back to their villages where they have their own piece of land,"" Wang Huiyao of the Centre for China and Globalisation tells me. ""Yes, there will be some hardships, but people outside of China probably don't understand how we view hardships and difficulties - which Chinese people just experienced not too long ago when China was very poor. ""The Communist Party has always stated a growth target to achieve as a way of signalling how well China is doing.But clearly this time it's different: no target - so there's no getting away from the fact that the current economic environment is the most challenging China has faced in recent years. Indeed, China has been through difficult economic periods before - the 1990s, for instance, saw huge numbers of people laid off. The economy at the time was dominated by state-owned enterprises - they provided jobs for the bulk of the working population. As the economy slowed down, they shed millions of workers - and unemployment rose rapidly, by one percentage point every year according to the National Bureau of Economic Research. State-owned enterprises went from employing 60% of the working population in 1995 to 30% in 2002. But China recovered, and the private sector stepped in to hire young people.This time, it's different and the private sector is also under pressure, says economist George Magnus, associate at the China Centre, Oxford University. ""No one was talking about trade wars at that time. The great offshoring of manufacturing to China was underway. ""Now, the rest of the world is an economic funk - so there's no consumer demand, and nothing in terms of foreign trade. All of the headwinds that China was facing before the pandemic have been compounded by the coronavirus.""For the last 40 years, China's Communist Party has been able to promise a simple contract to its citizens: we'll keep your quality of life improving and you fall in line so that we can keep China on the right path. It is the social contract that China's leader Xi Jinping crystallised as the ""Chinese dream"" when he announced it in 2012. 2020 was meant to be a pivotal part of that grand plan - the year China would eliminate absolute poverty, raising the quality and standard of life for millions of people. But the coronavirus could be putting that social contract at risk. Arguably more than any other economic crisis in the Chinese Communist Party's history, this health crisis has become a major threat for social stability in the country. Millions of young people may not be guaranteed the same degree of success that their parents' generation has seen. Keeping that contract of wealth, employment and stability is key to the Chinese Communist Party's legitimacy. Which is why economic recovery for China is so critical - and not having a growth target gives the government much needed flexibility to work out a plan. ",22 May 2020,business
Coronavirus: Flexible working will be a new normal after virus,"Facebook and New Zealand's Prime Minister are the latest supporters of flexible working as companies mull back-to-office strategies.On Thursday, Facebook said it plans to shift towards a more remote workforce as a long-term trend.New Zealand's PM Jacinda Ardern this week suggested a four-day working week, partly to boost tourism in the country.As offices gradually re-open after coronavirus lockdown, more employers are looking at new ways of working.Facebook founder and chief executive Mark Zuckerberg told staff it was ""aggressively opening up remote hiring"" in July. He expects half of its workforce to do their jobs outside Facebook's offices over the next five to 10 years.It follows moves by other tech firms in Silicon Valley, including Twitter, which said employees can work from home ""forever"" if they wish.  Flexible working policies suit staff who are anxious about returning to offices while giving breathing space to companies as they introduce new social distancing measures.Ms Ardern has suggested a four-day working week to help boost the economy and address work-life balancing. ""I hear lots of people suggesting we should have a four-day work week. Ultimately that really sits between employers and employees. But as I've said there's just so much we've learnt about Covid and that flexibility of people working from home, the productivity that can be driven out of that,"" Ardern said in a Facebook live video.Tech giant Microsoft trialled a four-day working week last year in Japan which was deemed successful in terms of employee feedback and productivity. It says it now has a ""hybrid workplace strategy as worksites slowly start to open"". ""Working from home remains optional through October for most employees,"" said a Microsoft spokesperson.Both working from home and shorter working weeks have been applauded by human resources experts as an alternative to a mass return to offices.""It would also give better work-life balance for the people who need it such as part-time students, new mothers, parents who want more time with kids [or] looking after the elderly,"" said Alin Abraham, a Singapore-based consultant.""If after Covid-19 employers learn how to employ flexible workers that would be a huge battle won for human resource management,"" she added. A shift towards more remote working also allows companies to rethink their expensive office space. Mastercard said it is currently looking at consolidating some of its offices while Facebook has plans for working ""hubs"" across the US.""Post Covid-19, you can imagine many companies shrinking down their real estate and employees can just work from home. It will be an interesting proposition to see how employers can cater to different crowds,"" said Adrian Tan, of workplace IT firm PeopleStrong.A growing list of business leaders are adding their weight to working from home and more flexible working arrangements, aided by technology and video-conferencing platforms such as Zoom and Google Meet.""As we start to return to workplaces and find a new normal, alternative working patterns will also help reduce commuter traffic and with social distancing measures,"" said HR consultant Emily Draycott-Jones. ""Covid has made employers move away from traditional thinking that productivity is contingent upon set hours within an office environment,"" she added.The big tech giants dominate when it comes to extending flexible work arrangements over a longer term:",22 May 2020,business
UK borrowing at record high as virus cost soars in April,"Government borrowing surged to £62bn in April, the highest monthly figure on record, after heavy spending to ease the coronavirus crisis.It means the deficit - the difference between spending and tax income - was larger last month than forecast for the whole year at the time of the Budget. The data from the Office for National Statistics revealed the soaring cost of support, such as furlough schemes.But Chancellor Rishi Sunak said things would be worse without government aid.The government's independent forecaster, the Office for Budget Responsibility (OBR), has predicted that borrowing for the whole year could reach £298bn, more than five times the estimate at the time of the March Budget.Jonathan Athow, deputy national statistician at the ONS, described April's figure as ""pretty much unprecedented"". It said the cost of furlough schemes alone was £14bn in April.""Borrowing now is about six times what it was [in April] last year, so we are talking about some really significant changes in the government finances,"" Mr Athow told the BBC.He added it was impossible to forecast the current year's public finances because of the ""high amounts of uncertainty"". Tax receipts have fallen heavily, as the Treasury has allowed companies to defer some payments. The amount received from VAT in April was negative, with the government collecting less than was handed back in repayments.Meanwhile, borrowing by the state in March 2020 has been revised up by £11.7bn to £14.7bn, the ONS said.It said this was driven by a reduction in previous estimates of tax receipts and National Insurance contributions.The surge in borrowing comes after Chancellor Rishi Sunak stepped up financial support for businesses and employees after vast areas of the economy were forced to halt due to the coronavirus lockdown.After publication of the figures, Mr Sunak said that if the government had not provided financial support, the cost to the economy and people's livelihoods would be much worse.""Our top priority is to support people, jobs and businesses through this crisis and ensure our economic recovery is as strong and as swift as possible,"" he said.""That's why we've taken unprecedented steps to provide lifelines to people and businesses with our furlough scheme, grants, loans and tax cuts.""For the past decade, the government had been trying to practise strict financial housekeeping, aiming for position where it could cover day-to-day spending with the money form our taxes and eliminate the deficit. But then the crisis hit - and as the chancellor claims, the schemes put in place have provided a lifeline to tide millions over, to prevent an even bigger economic disaster. It was worth ripping up the rulebook for, he said.However the bills are mounting, just as the amount received from taxpayers slumped.  This year's deficit could be the equivalent of the biggest slice of our income since the Second World War - and that hole needs pluggingFor the moment, the government has increased its borrowing on financial markets, through bonds, effectively IOUs - but there is a limit to how much it can  do so. Ultimately, economists say taxes will have to rise, or spending cut - the emergency raft will have a price tag which we can't escapeBut the chancellor will have to impose those carefully to avoid jeopardising a recovery. And if he opts for tax hikes, he'll risk breaking some election promisesThe scale of the economic consequences was underlined on Friday in separate retail sales data from the ONS. These showed that High Street sales crashed last month as shops closed for the lockdown.It was also announced on Friday that a mortgage payment holiday scheme for homeowners in financial difficulty during the pandemic has been extended for another three months.As a result of the jump in borrowing, total public sector debt rose to £1,888bn at the end of April - £118.4bn higher than April 2019.Former chancellor George Osborne told the BBC: ""We have to come to terms with the fact that Britain is poorer and the economy is smaller than it would have been.""Asked if the economy would bounce back, he said: ""Bounce is the wrong word, but it will recover."" Ruth Gregory, an economist at Capital Economics, described April's borrowing as ""alarmingly high"", but added that a small easing of the lockdown from 13 May probably meant the government would not have to borrow as much this month.And despite the pressure on public finances, Charlie McCurdy, a researcher at the Resolution Foundation, said there were no signs the government was struggling to raise money on the financial markets.""Record low interest rates mean the UK's higher debt burden should remain more than manageable,"" he said. ",22 May 2020,business
