Huawei calls US rules 'arbitrary and pernicious',"Huawei has said new US export rules to limit its access to key technology are ""arbitrary and pernicious"".The Chinese tech giant warned investors the restrictions would ""inevitably"" hurt its business, and could damage the global technology industry.The US had already put Huawei on a blacklist last year, calling the company a national security threat.A statement said the US was in a relentless pursuit to tighten its stranglehold on our company, But chairman Guo Ping told an analyst summit on Monday: ""Luckily we have survived so far.""The US on Friday said it would require global semiconductor-makers that use US technology and software in chip design to seek US government approval to ship to Huawei.It said the added control was necessary to close a loophole that had emerged since the US last year moved to cut off Huawei from access to US-made semiconductor chips, which form the backbone of many computer and phone systems.""Our business will inevitably be impacted,"" Guo Ping said of the new rules. ""In spite of that, as the challenges over the past year have helped us develop a thicker skin, we are confident about finding solutions soon"".Since being put on the US blacklist last year, he said Huawei had been forced to rewrite computer code, review procurement and spend thousands of hours to ensure business continuity.""Huawei is just like this plane riddled with bullet holes,"" he said. ""Over the past year, patching up the holes was our priority."" However, the firm warned that the new rules would hurt the firm's ability to serve and maintain its networks and services for billions of customers around the world. Huawei said the US campaign against the company would ultimately damage the country's credibility with international companies.""It will damage the trust and collaboration within the global semiconductor industry and could increase conflict and loss within these industries,"" it said.",18 May 2020,business
Elon Musk: Tesla raises cost of 'self-driving' cars,"Tesla is raising the price of its ""self-driving"" option on its electric vehicles worldwide starting with a $1,000 (£820) hike.Founder Elon Musk tweeted that the price ""will continue to rise"" as its technology improves.But the entrepreneur said the technology it's adding will be worth more than $100,000.Mr Musk has been in a battle with officials in California over the restarting of Tesla's US car assembly.Tesla's ""full self-driving"" (FSD) option is called Autopilot, although it isn't fully autonomous. Autopilot has a number of features including automatic lane changes, parallel parking and a summon feature, which automatically parks and retrieves the car. Its upcoming features include automatic traffic light and stop sign control.The self-driving option will cost $8,000 when the price rise kicks in on 1 July.  ""The FSD price will continue to rise as the software gets closer to full self-driving capability with regulatory approval,"" Mr Musk said in a series of tweets on Monday. ""[At] that point, the value of FSD is probably somewhere in excess of $100,000."" Tesla was investigated by regulators in the US after a driver was killed while using Autopilot in 2018. However, the investigation discovered the driver was playing a video game on his smartphone at the time of the crash.Mr Musk is well-known for his frequent tweets, many of which have landed him in trouble.Tesla Full Self-Driving option cost rises by ~$1000 worldwide on July 1st. Order a Tesla online in less than 2 minutes at https://t.co/qJm9uPBCX5End of Twitter post  by @elonmuskOne tweet earlier this month wiped $14bn off Tesla's market value after Mr Musk wrote its share price was too high.His latest tweets have also caused a little controversy online, with some questioning the $100,000 or more value he claims the self-driving software will be worth.One reply said the value Mr Musk claims the self-driving package to be worth was ""insane"". ""Elon, real talk, i love you and the mission, but FSD will never be worth that much,"" the tweet added.The best-selling Tesla Model 3 currently sells for $33,690 in the US if a driver opts for the basic package. With Autopilot this would currently cost $40,690.",19 May 2020,business
"UK unemployment increases by 50,000","UK unemployment rose by 50,000 to 1.35 million in the three months to March, as the effects of the coronavirus lockdown started to hit the economy.The unemployment rate was estimated at 3.9%, slightly up on the previous quarter, the Office for National Statistics said.Before the lockdown began, employment had hit a record high.The figures only cover the first week of the lockdown and the total is likely to worsen sharply in the coming months.Jagjit Chadha, director of the National Institute of Economic and Social Research, told the BBC: ""We can reasonably expect unemployment to rise very quickly to something over 10% - something we haven't seen since the early 1990s.""People who are at home on furlough are not counted in the jobless total.However, the total number of weekly hours worked showed its largest annual decrease in 10 years.Estimates based on returns for individual weeks suggest that this fall was mostly caused by the decrease in hours in the last week of March, with a much smaller decrease in the previous week, the ONS said. In the final week of March, the total number of hours worked was abut 25% fewer than in other weeks within the quarter. ",19 May 2020,business
Huawei calls US rules 'arbitrary and pernicious',"Huawei has said new US export rules to limit its access to key technology are ""arbitrary and pernicious"".The Chinese tech giant warned investors the restrictions would ""inevitably"" hurt its business, and could damage the global technology industry.The US had already put Huawei on a blacklist last year, calling the company a national security threat.A statement said the US was in a relentless pursuit to tighten its stranglehold on our company, But chairman Guo Ping told an analyst summit on Monday: ""Luckily we have survived so far.""The US on Friday said it would require global semiconductor-makers that use US technology and software in chip design to seek US government approval to ship to Huawei.It said the added control was necessary to close a loophole that had emerged since the US last year moved to cut off Huawei from access to US-made semiconductor chips, which form the backbone of many computer and phone systems.""Our business will inevitably be impacted,"" Guo Ping said of the new rules. ""In spite of that, as the challenges over the past year have helped us develop a thicker skin, we are confident about finding solutions soon"".Since being put on the US blacklist last year, he said Huawei had been forced to rewrite computer code, review procurement and spend thousands of hours to ensure business continuity.""Huawei is just like this plane riddled with bullet holes,"" he said. ""Over the past year, patching up the holes was our priority."" However, the firm warned that the new rules would hurt the firm's ability to serve and maintain its networks and services for billions of customers around the world. Huawei said the US campaign against the company would ultimately damage the country's credibility with international companies.""It will damage the trust and collaboration within the global semiconductor industry and could increase conflict and loss within these industries,"" it said.",18 May 2020,business
Electric bikes 'could help people return to work',"Electric bikes can slash transport emissions and offer workers a way to return to the workplace during coronavirus, a new study has found. If e-bikes took off in the same way in the UK, as in many European cities, it would reduce congestion, improve mobility, and save CO2, the study says.It said the UK government hadn’t yet realised the strategic importance of e-bikes, push-bikes with electric motors.The greatest impact would be in areas with poor public transport, it found.That's because a wider range of people would be able to use e-bikes, it said.The research comes from the publicly funded Centre for Research into Energy Demand Solutions (Creds), based in Oxford.The researchers say that in Denmark, where cycling has been strongly encouraged for decades, e-bike routes are already linking cities to towns and villages. The research comes at a time when ministers are desperate for solutions which allow people to get to work without risking their health on public transport, but also without increasing carbon emissions.So far the main emphasis has been on bringing people into city centres, where popup cycle lanes are being introduced.But the Creds paper says e-bikes can be particularly effective in economically-deprived areas where people can’t afford cars, but bus services are poor.This could be in suburban or semi-rural areas.It says the UK government should find ways to incentivise the use of e-bikes.Professor Nick Eyre from Creds told BBC News: ""E-bikes give us an exciting new opportunity to reduce energy use and carbon emissions. “They need to be part of the plan for the major investment we need in transport to get people moving safely again in ways that are economically and environmentally sustainable."" Critics could say that creating a major network of e-bike lanes would be expensive and sometimes not feasible. There will also be problems with bike theft – and of culture in places where there is little history of cycling.    Professor Eyre said: “We know cycling is culturally dependent. There’s much more cycling here in Oxford than in Leeds, for example. ""It’s partly because Leeds is bigger and hillier, but it’s partly because in Oxford cycling is just something we do.“[But] the last few weeks have shown us there’s much more capacity for people to change than we previously thought.”Some planners believe the UK is on the brink of an urban transport revolution. The government is currently consulting the public on the use of electric scooters on Britain’s streets.However, a wide range of organisations, from pedestrians to motorists, have expressed their fears about the potential dangers of e-scooters, whether on the pavement or on the road.Follow Roger on Twitter.",18 May 2020,business
Japan's economy falls into recession as virus takes its toll,"Japan has fallen into recession for the first time since 2015 as the financial toll of the coronavirus continues to escalate.The world's third biggest economy shrank at an annual pace of 3.4% in the first three months of 2020.The coronavirus is wreaking havoc on the global economy with an estimated cost of up to $8.8tn (£7.1tn).Last week, Germany slipped into recession as more major economies face the impact of sustained lockdowns.Japan did not go into full national lockdown, but issued a state of emergency in April which severely affected supply chains and businesses in the trade-reliant nation.The 3.4% fall in growth domestic product (GDP) for the first three months of 2020, follows a 6.4% decline during the last quarter of 2019, pushing Japan into a technical recession.Consumers in Japan have been hit by the dual impact of the coronavirus and a sales tax hike to 10% from 8% in October. While Japan has lifted the state of emergency in 39 out of its 47 prefectures, the economic outlook for this current quarter is equally gloomy. Analysts polled by Reuters expect the country's economy to shrink 22% during the April-to-June period, which would be its biggest decline on record. The Japanese government has already announced a record $1 trillion stimulus package, and the Bank of Japan expanded its stimulus measures for the second straight month in April. Prime Minister Shinzo Abe has pledged a second budget later this month to fund fresh spending measures to cushion the economic blow of the pandemic.Japan faces a unique challenge as its economy has been stagnant for decades, compared to the more buoyant economies of rivals the US and China.Japan also relies heavily on exporting its goods and has little control over consumer demand in other countries, which has been severely impacted by coronavirus lockdowns. Many of its biggest brands, such as car firms Toyota and Honda, have seen sales slump across the world. Tourism, which has long been a boost to the Japanese economy, has also been hit hard as the pandemic keeps foreign visitors away. Japan has had more than 16,000 confirmed coronavirus cases and around 740 deaths.Things look bleak for the Japanese economy in the short term, along with other major economies around the world. But despite being the first of the world's top three economies to officially fall into recession, the country actually appears to be doing better, or less badly, than other major economies. While economists predict Japan's economy will shrink at an annual pace of  22% in the April-to-June period, they also predict that the US could contract by more than 25%. The 3.4% annual rate of decline in the first quarter also compares favourably to the 4.8% the US suffered in the first three months of this year.This was the sharpest decline for the US economy, the world's biggest, since the Great Depression of the 1930s.China, the world's second largest economy, saw economic growth shrink 6.8% in the first three months of 2020 compared with a year earlier, its first quarterly contraction since records began.Both of those economies have not yet been confirmed as having fallen into a technical recession, which is defined as two consecutive quarters of negative growth, but most economists expect them to in the coming months.",18 May 2020,business
Ryanair says passenger numbers set to halve,"Ryanair has said it expects passenger numbers to halve in the current financial year as the coronavirus crisis continues to blight air travel.The airline said it expected numbers to fall below 80 million, down from its original target of 154 million.But it said it would weather the pandemic and emerge stronger.Chief executive Michael O'Leary said Ryanair still planned to ramp up flights in July and said UK government quarantine plans were ""idiotic"".The prediction of lower passenger numbers came as Ryanair announced profits of just over €1bn (£894m) for the financial year to the end of March.The airline's profit was 13% up on the previous year's figure of €885m.Ryanair is set to cut 3,000 jobs - 15% of its workforce - as it restructures to cope with the coronavirus crisis.Chief executive Michael O'Leary told the BBC's Today programme that Ryanair still intended to restart large numbers of flights from July, despite government plans to introduce a 14-day quarantine for people arriving in the UK, including returning holidaymakers.Mr O'Leary repeated his criticism of the quarantine plan, saying: ""It's idiotic and it's un-implementable. You don't have enough police in the UK.""He said the policy had ""no credibility"" and predicted that it would be gone by June.Ryanair said 2021 would be a ""difficult"" year as it worked hard to return to scheduled flying. But it said its balance sheet was one of the strongest in the industry, with cash reserves of more than €4bn.""Unlike many flag carrier competitors, Ryanair will not request or receive state aid,"" it added.Ryanair said it could not provide any profit guidance for the current financial year, but it expected to report a loss of more than €200m in the April-to-June period.""As we look beyond the next year, there will be significant opportunities for Ryanair's low-cost growth model as competitors shrink, fail or are acquired by government bailed-out carriers,"" it said.",18 May 2020,business
Coronavirus: Self-employed grant claims top two million,"More than two million self-employed people whose businesses are affected by coronavirus have applied for government grants, Chancellor Rishi Sunak has said.The value of the claims made so far is £6bn, he told the House of Commons.He said the money would reach claimants within six working days.The Self Employed Income Support Scheme is designed to support people in a similar way to the scheme for furloughed employees. The grants are calculated as 80% of monthly profit, averaged out over a period of up to three years and capped at £7,500.The money is paid out in a single instalment covering three months. The scheme is temporary, but is under review and could be extended.The scheme is the biggest direct financial support package for freelancers and the self-employed since lockdown started.The process is being run by HM Revenue & Customs (HMRC), which has been operating and overseeing loan schemes and the government's furlough payments.The scheme was unveiled in March after the government faced criticism for failing to provide support for self-employed and freelance workers in its earlier package of economic measures.HMRC has invited 3.5 million people to apply for the scheme by sending them notices. According to the latest figures given by the chancellor, more than half of them have put in claims.Mr Sunak has described it as ""one of the most generous schemes anywhere in the world"".However, those who started in business from early April last year will miss out, as will those who pay themselves just with dividends from a limited company.",18 May 2020,business
"The man who bought 60,000 oil and gas wells","The BBC's weekly The Boss series profiles different business leaders from around the world. This week we speak to Rusty Hutson Jr, founder and chief executive of US energy firm Diversified Gas & Oil (DGO).In the end, Rusty Hutson Jr couldn't escape the calling of the family trade.Born and raised in a blue-collar household in the oil and gas fields of West Virginia, his father, grandfather, and great-grandfather all earned their livings in the energy sector.They worked at the wells, and on the pipelines, putting in a hard shift of manual labour, day after day, year after year, to provide for their families.During his summer holidays from high school and then college, Rusty would go to work with his dad.But when he became the first Hutson to graduate from university, in 1991, he decided he wanted to do something completely different with his life.""I decided that going into oil and gas was about the last thing I wanted to do,"" he says. ""I didn't want a part of it when I got out. It's really hard work.""So armed with an accountancy degree from West Virginia's Fairmont State University he went off to have a successful banking career for the next decade, ending up in Birmingham, Alabama.But as the years progressed, Rusty says it started to nag at him that he hadn't followed his dad into the family industry.""West Virginia was a tough state when I was growing up. Still is,"" he says. ""And there were two kinds of people - you either worked in coal, or you worked in oil and gas. It was a generational thing - if your dad and grandfather did it for a living, then you did it.""And as the years progressed I increasingly felt drawn back to that world. I also had this desire to build something, to do something entrepreneurial.""So in 2001, aged 32, Rusty bought an old gas well back in West Virginia for $250,000 (£200,000). He raised the money by remortgaging his home.""It was a small old well, it had been in production for years, but it was like gold to me,"" he says. ""I spent the next four years still also working in the bank, but any spare time I had I'd fly up to West Virginia to work alongside the one well tender that I had back then.""Fast-forward to today, and Rusty's company, DGO, now owns more than 60,000 gas and oil wells across West Virginia, Pennsylvania, Ohio, Kentucky, Virginia and Tennessee, a region called the Appalachia. Employing 925 people it has annual revenues of more than $500m. Some 90% of its operation is natural gas, with 10% oil.The company's business model is a very specific one - it doesn't do any drilling to find new oil and gas reserves. Instead it buys up old oil and gas wells that bigger producers no longer want, because the initial large flow levels have fallen to low volumes.""They don't want these old wells, but the average remaining life on most of these wells is 50 years,"" he says. ""So we can come in, run them very efficiently, and make money.""Rusty says that DGO has been greatly helped by the so-called ""dash for shale"" in the US over the past decade, whereby oil and gas firms gave up traditional oil and gas wells to switch to fracking instead.In very simple terms, unlike traditional wells where oil and gas is sucked up, fracking involves first injecting a high pressure mixture of water, sand and chemicals into shale rock. This fractures the rock, and allows the removal of vast quantities of oil and gas that wasn't previously accessible.Rusty says the industry-wide move to fracking, and its higher production volumes, meant that DGO has been able to buy thousands of old, but still productive, traditional wells cheaply, and rapidly expand the business.To help raise funds for continuing expansion, in 2017 the company decided to go public and sell its shares on a stock exchange. In an unusual move for a US firm, Rusty chose the London Stock Exchange's (LSE's) Alternative Investment Market.""We weren't big enough at the time to float in the US,"" he says. ""And I didn't want to go down the private equity route because I didn't want to work for somebody else, and try to earn back some of the percentage.""More The Boss features:DGO is now in the process of moving up to the Main Market of the LSE.Energy sector analyst James McCormack of Cenkos Securities says that DGO's strategy of ""acquiring low-cost, long-life, low-decline [oil and gas] production"" is ""a virtually unique proposition"". He adds: ""Under Rusty's leadership, DGO has grown rapidly since its IPO (initial public offering) in February 2017, increasing production 20 times and reserves 23 times.""Fellow energy analyst Carlos Gomes of Edison says that DGO is now the largest conventional gas producer in the Appalachia region. ""The company possesses long-life, low operational cost, mature producing assets that generate very stable cash flows,"" he adds.The long-term plan at DGO is to keep buying wells to replace any that eventually come to the end of production, and Rusty says the firm is now looking to expand into other regions, such as down in Texas.In the more immediate term, he says that he is relaxed about the big falls in oil and gas prices since the start of the coronavirus pandemic, both because he has long-term ""hedges"" or agreements in place on what price he sells his production for, and because his business operates more efficiently than its larger rivals.He can also turn to his dad for help and advice. His father, Rusty Sr, is the supervisor for the company's northern West Virginia operation.""He's 72 and he just absolutely loves it,"" says Rusty. ""Does he try to tell me what to do? Oh, absolutely.""",18 May 2020,business
