"Coronavirus: 'I may lose it all, but there’s no help for me'","Layla Barnes is one among many thousands of small business owners left financially and emotionally devastated by more than 10 weeks of government-imposed lockdown. She was forced to close her Doncaster-based beauty therapy and training business which was profitable in February before lockdown began. Yet the government's excluded Layla, 30, and her limited company from any form of crisis-related support, forcing her on to benefits of £408 per month.She's moved out of her rented home, unable to meet her rent and bills, running up thousands of pounds in credit card debt to try and preserve her business. ""If I lose my business, I've lost everything. I'd spent all my life's savings - about £60,000 - on equipment and machines. ""I would rather lose my home than lose my business. So I moved in with mum and dad and me and my husband are now in the same box-room I moved out from aged 17.""As a result, she is under a huge amount of stress which has rekindled a previously diagnosed mental health disorder and made her feel this is ""the worst time I've been through in my life - worse than anything from before."" And she is not alone. Research published on Thursday by accountants serving 61,000 small businesses across the country supports concerns that the shutdown is taking its toll on their clients' mental health. Nearly three quarters - 73% - report that clients are struggling to sleep. 67% reported worsened mental health and 50% that their clients had shared feelings of not being able to cope, according to the SME Health Tracker published by the Association of Chartered Certified Accountants.In earlier research on 21 May, 11% of accountants reported that clients had discussed thoughts of taking their own lives. Before the shutdown in September 2019, Layla did what successive governments have created tax arrangements to encourage - branching out on her own and setting up her own business as a limited company.""I left a highly paid full-time employed job in Harley Street, training doctors and nurses in aesthetics and botox, to pursue my dream and open my own training academy. I starting doing well in February and moved into profit,"" Layla told the BBC.  ""I had paid myself £500 since September in wages as everything I earned I put back into my business.""But she had to suspend her business when the lockdown happened.""I had £20,000 of courses booked for March that I've had to refund. I've had others that I can't refund simply because the money isn't there. ""Like an estimated 710,000 other owner-managers of small businesses, Layla was excluded from financial support in a deliberate decision by the government.  She is not eligible for the Self-Employed Income Support Scheme because, after taking an accountant's advice, she had set up a limited company, paying herself a basic salary of £500 per month and any further income in the form of dividends paid to her by the Limited Company. Neither the Coronavirus Job Retention Scheme (the ""furlough scheme"") nor the Self-Employed Income Support Scheme, covers her. Her business occupied shared office space - so it was the owner of the building, rather than her firm, that was on the business rates register and therefore received the grants meant to help companies hit by the lockdown. Neither could she receive payment holidays because her landlord was commercial not residential. ""I was rejected for the Bounce Back Loan so I'm now on universal credit at £408.99 per month. It's impossible to pay rent and bills.""I've put most of the last 10 weeks on credit cards which are now almost maxed out and I have sold some business and personal belongings including my car and my engagement ring,"" Layla told the BBC.  ""I've been told there's a possibility of going back in July. However, I'm not sure the company will survive till then and the credit I have borrowed is personal credit... therefore if the company goes bust I'm still thousands in debt for something that isn't my fault."" She added: ""I'm not saying corona is anyone's fault. But I feel really bitter than I've been told I can't work - yet no one will support me. Even if I manage to survive until July it will be a long time before I can clear the vast debts I have accumulated.""Layla told me her mental health disorder had been diagnosed in 2010 but she had recovered and was ""really doing well"". But in recent weeks she has had to have crisis meetings with a community psychiatric nurse. ""People don't understand; it's so frustrating. For people on furlough, it's almost like everyone's had a three months holiday. No-one will listen. ""I've emailed [the Chancellor] Rishi Sunak seven or eight times. I don't even get an automated reply. I emailed the council - no-one's got back to me.""Mr Sunak excluded company owners paying themselves in dividends from support during shutdown. The Treasury said the reason was that it couldn't distinguish on self-assessment forms between dividends paid to owner-managers such as Layla, and dividends paid to investors. However, the Association of Chartered Certified Accountants disputes this, saying accountants could certify that dividends were being paid in lieu of salary and this could be verified by accountants and cross-checked with real-time information submitted by accountants to HMRC.Owner-managers can furlough themselves for the PAYE portion of their salaries, but for many paying themselves the typical minimum of £500 per month this would be little more than benefits. It would also make it illegal for them to do any work to conserve their business. Many small business owners have furloughed employees but have little or no income for themselves.Layla turned for support to the online campaign group ExcludedUK, a non-profit organisation whose mission is to campaign for three million UK taxpayers excluded from the government support schemes.Rachel Flower, speaking on behalf of ExcludedUK, said: ""There are a lot of women and men within our group who have been broken by what's happened.  ""They can't understand why they've been told they can't have any support when others doing the same job have been fully supported - just because they were set up as a limited company. ""Most of them say 'I just thought I was self-employed and did what I was told to do'. And after being told that no-one would be forgotten and everyone would be helped it's a real kick in the teeth.""The BBC has contacted the Treasury for a comment. ",4 June 2020,business
Coronavirus: Ex-chancellors warn of severe unemployment ahead,"As the UK begins to ease lockdown restrictions, three former UK chancellors have been quizzed by MPs on the Treasury Select Committee about the effects of coronavirus on the UK economy.Alistair Darling, George Osborne and Philip Hammond were asked about the severity of the crisis versus the 2008-2009 financial crash; what measures could revive the economy; and whether taxes should increase to help pay the UK's mounting debts. They also suggested that unemployment could reach levels not seen since the 1980s.Alistair Darling: ""They are very different and this one [coronavirus], in my view, is much more serious.""The key difference between then and now is that from day one, the government wanted to get the economy going again, and therefore we introduced a range of measures, which enabled us to do that.""The situation today is different, in that firstly, it is part of government policy right across the world, and rightly so, to actually suppress economic activity through the lockdown and other measures... Unless and until the government gets control of the virus itself and the spread of the virus, it's difficult to see how you can pull out the stops and get the economy going again.""George Osborne: ""I am more optimistic, I think, than Alistair. If you look at the history of pandemics and plagues and the like in our society, then the economic bounceback is going to be relatively rapid.""If you look at the history of banking crises throughout our history, not just the one 10 years ago, but in the 1920s and 30s and in the 19th Century and before, recoveries are very slow and protracted and painful, because the credit channels of the economy are impaired, and despite all the work that Alistair did, and I did, to try and unclog those channels, it takes a long time for the allocation of capital to get to the efficiency it has before the banking crash.""Philip Hammond: ""In terms of which is the worst, I think it is too early to say yet, because a lot is going to depend on whether over the next months it becomes clear that we are heading towards either a vaccine... and that the future trajectory is one of returning the economy to something like normal, or whether, by contrast, we are not heading towards an early development of a vaccine or a treatment, and we have to plan in terms of restarting the economy living with Covid.""Lord Darling: ""The government will need to introduce measures, firstly to deal with a wave of unemployment which I think will come once the furlough system starts being phased out, and also to make sure that people who are displaced from the workplace, who lose their jobs, that we can get them back into work as quickly as possible.""It will be necessary for the government to make sure that you don't end up with a recession becoming a depression.""Mr Osborne: ""The central challenge... is how do you withdraw some of the very necessary schemes to have kept people in work and businesses afloat during the crisis. The furlough scheme has been absolutely essential... many people on furlough are going to go back to their jobs. ""But we have to be honest and say that quite a lot of those businesses will not come back... and trapping people on a scheme that is generous to them in the short term, but actually prevents them from re-entering the labour force to get the new job they need, is potentially very damaging. ""So I think the withdrawal of the furlough is going to be important for employment in the short term, and at the same time some of these loans to businesses that are never coming back are going to become an issue.""Mr Osborne: ""There's a whole separate issue about what you do with these large stakes we're going to take in large companies like airlines, potentially, and aerospace manufacturers. ""All of us have experience on this panel of pretending that you're managing these bank holdings that we had in the last decade at arm's length, and still when Treasury questions came up we were being asked about the bonuses being paid to chief executives, why branches were being closed in the constituencies of members.""I can imagine an airline saying it wants to shut an uneconomic route to one of the further-flung parts of the UK... I think that's going to be more problematic than I think people have realised at the moment.""Lord Darling: ""We need to get ourselves into the frame of mind where we're thinking about 1980's levels of unemployment.""If it doesn't happen, that's great, but I think we need to be ready for that, and if we're not ready for that, people will ask: 'Why didn't you start thinking abut these things?'""""If you take the aviation industry, you'll notice that France and Germany are not indifferent to whether or not their national airline is surviving. Our model here is slightly different, in that the idea of a flag-carrier isn't quite what it was, but I think most people would take the view that we've got to ensure that we've got a transport industry.""Lord Darling: ""If you want stimulate the economy, the most obvious thing to do is a time limited VAT reduction.""When we get to the happy day when we're recovering... yes, we are going have very high debts, like we had at the end of the Second World War, but one of the things that a government like ours can do... you can actually carry that for some period. I would be very concerned if in the recovery phase you start clamping down on things prematurely, and you drive the country back into a recession.""Mr Hammond: ""I don't think there's any economic logic to increasing taxes in the short term. I think we all accept that the UK as a credit-worthy, mature, larger economy can carry more debt in the context of the short term crisis. ""Of course, we have to remember that debt is cumulative by its nature. We increased debt very substantially during the course of dealing with the last crisis, and we'd only just got back to the point where we were starting to see debt very slightly decline as a share of GDP. Now we're going to see it increase significantly again as a share of GDP, so eventually we have to think about how we manage the challenge of debt in the long term.""",4 June 2020,business
'I’m ready to face quarantine just to get away',"HR professional Angela Russell and her partner Steve have decided that despite coronavirus, they will be flying to Montenegro on 5 July.They're only going for a week's holiday, but the prospect of having to spend two weeks in quarantine on their return doesn't bother them.""I have become totally fed up with all the bad news and how the government is dealing with issues,"" she told the BBC. ""I'm prepared to put up with quarantine just to get away from here for a bit.""The couple will be holidaying with a friend of Angela's who has terminal cancer, accompanied by her husband. ""She had planned to do a lot of travelling this year and until now, all her plans have been kiboshed.""The four have booked to fly with Jet2, which plans to resume its flight programme on 1 July. A number of other airlines and tour operators have announced similar plans.Ryanair and Tui are also due to restart services from the beginning of July, while EasyJet is taking to the skies again from 15 June.British Airways has said it will launch ""a meaningful return to service"" in July, while Virgin Atlantic has said flights will not resume until August.However, at the moment, the UK Foreign and Commonwealth Office (FCO) is still advising against all non-essential foreign travel, with no indication of when the policy might change.A spokesperson for Jet2 said the firm always followed FCO guidelines and was ""reviewing the situation on a daily basis"".Jet2 declined to give any details of the level of bookings over the next few months, describing it as ""commercially sensitive information"". The BBC has approached other airlines and holiday firms for comment.One airline that does seem to be confident about the future is budget carrier Wizz Air, which said on Wednesday that it was still planning to take delivery of new aircraft.""Whatever we can fly, we're going to be flying, because we've seen that there is actually demand out there,"" said the airline's chief executive, Jozsef Varadi.Angela, who lives in Wales, is semi-retired and now works just one day a week, which she can easily do from home if forced to self-isolate. She points out that Montenegro is ""pretty much coronavirus-free"" .""I've spent my life assessing risk, either in work or in my daily life,"" she says. ""The only risk is that we might pick it up at the airport.""She adds: ""My fear is that Montenegro will say, 'We don't want to let people in from the UK, because you don't seem to manage it very well.'""But I feel it's imperative now that we support the travel industry. We have to take a pragmatic approach to how we do things.""Another hopeful holidaymaker is Robert Jenkins, of Bedwas in south Wales, who usually goes abroad four or five times a year with his wife Barbara. ""We're retired and travelling is very important to us,"" he told the BBC.Robert and Barbara are hedging their bets, with not one, but two trips booked between now and the end of the year.The couple are due to fly with EasyJet to Malaga in Spain on 1 July and to the Greek island of Kos on 12 September.But Robert says he is poised to cancel the Spanish trip, because ""the FCO still hasn't given the go-ahead and I don't know if I'll be insured"".He is also worried by the Spanish tourism minister's remarks this week that British coronavirus figures ""still have to improve"" before Spain can receive tourists from the UK.""I'm really hoping Greece will go ahead. We've gone to the same resort for 20 years and we are on first-name terms with the people in the village we stay at,"" he says.""But it's all up in the air. Things are changing day by day.""Anyone considering booking an overseas holiday needs to find their balance on a financial tightrope.As always, if you book on a flight which is subsequently cancelled, you should be refunded, although millions of people have already found that can be a slow, and still unresolved process.Booking a package holiday also offers financial protection if it is later cancelled owing to a second wave of the virus or current restrictions being extended.Insurance is more complex. Travelling against Foreign Office advice, which is still that anything but essential travel should be avoided, would invalidate existing insurance. That has implications for claiming the cost of accommodation, car hire and so on, but also medical care.We still do not know when that advice will be lifted. It is under review.Those buying a new insurance policy - irrespective of the travel advice - will often find that it will not cover you for coronavirus-related issues, such as having to cancel a break because you have been told to self-isolate. ",3 June 2020,business
Coronavirus: Sex workers fear for their future,"With social distancing rules in place and strip clubs and brothels closed, sex workers around the world have seen their incomes disappear almost overnight as a result of the coronavirus pandemic. Fearing for their livelihoods, as well as their health, some are offering services online to keep their business going, while others are turning to charities for help.Estelle Lucas has worked as an escort for the past 10 years in Melbourne, carefully building relationships with her clients. But the spread of Covid-19 and the need for social distancing has prompted a ban on sex work, leaving her worried those efforts will go to waste.  ""It's fair to say that if I'm not working for six months, a lot of people are going to forget me,"" she says.""I can't contact my clients and just have a conversation with them. That doesn't work in my industry. We need to build intimacy and that's just not possible in the current environment."" Before the coronavirus outbreak, Estelle says she was earning an above-average income, and had hoped to soon pay off the mortgage on her home in Melbourne's inner suburbs. Now nearly all her income has been lost. She has tried to adapt by moving her business online, but says that cannot replace physical contact.""Unfortunately, there are things that can't be translated,"" she says. ""I have made efforts to go online but not everyone is tech savvy. Some of my clients don't even really know how to use a smartphone.""While the regional government has outlined a clear roadmap to reopening restaurants and cafes, there has been no plan for the sex industry. That uncertainty, coupled with the many unknowns surrounding the virus itself, has left many sex workers with deep anxiety. ""I'm scared that all my work will come back to zero and I will just have to start hustling like I did when I first started out,"" Estelle says. She also fears for her clients' health. ""Are they even going to be there?"" she says. ""There's a lot of nervous energy going around.""Financial assistance from the Australian government is available to those who have lost their income because of the Covid-19 crisis, but to qualify for the payments workers need to be able to show they have been paying tax - something that unregistered sex workers including migrants and trans people, often won't be able to do. It's a problem facing sex workers in dozens of countries around the world, according to Teela Sanders, a criminology professor at the University of Leicester. ""Governments have been very good at providing social protection for the majority of people, particularly self-employed people, but sex workers are not included,"" she says.That's left sex worker collectives and advocacy groups calling for members of the public to donate to emergency funds. So far, an online appeal by the Las Vegas Sex Worker Collective has raised $19,300 (£15,680) while a campaign by a coalition of support groups in Italy has raised almost €21,700 (£19,500).""These have been a real lifeline to sex workers for immediate bill paying, access to food etc,"" says Prof Sanders. Some sex workers have been forced to continue working, risking hefty fines or exposure to the virus. ""In developing countries, sex workers are often the main breadwinner for the whole family, for their siblings, their children and their grandparents. So this affects the whole extended family,"" Prof Sanders says.Niki Adams from the English Collective of Prostitutes echoes that view. She told the BBC most sex workers in the UK are mothers and if they are continuing to work, it is because they are desperate for money. But some sex workers find themselves unable to keep working - even if they would choose to. In Daulatdia brothel in Bangladesh, police guard the entrance, preventing customers from entering. It is one of the world's biggest brothels, a shanty town made up of tin sheds and narrow alleyways that is home to 1,300 women and their 400 children.The brothel has been closed since March, leaving many of the women struggling to buy essential items and relying on donations from charities.  ""We cannot work now, so we don't have any income, which is scary,"" says ""Nazma"", who didn't want to give her real name. Nazma supports three children who live with her sister back in her village. She came to the brothel 30 years ago when she was just seven. Although she needs money, she worries about the dangers of working during the pandemic.""Even if we could work, people's lives are at risk from the virus. We'd be scared to go to bed with our clients anyway, as we don't know who is affected,"" she says.Daulatdia sits on the banks of the Padma River, near a major ferry terminal. It is the main transport hub that connects the Bangladeshi capital Dhaka with the country's southern districts. Prior to the coronavirus outbreak, thousands of truck drivers would pass through the area every day, delivering agricultural products and other goods to Dhaka. Many of the women and children who live in the brothel are victims of trafficking. ""A lot of them who were kidnapped as children were sold there,"" says Srabanti Huda, a lawyer and human rights activist based in Dhaka.While the Bangladeshi government and local aid organisations have delivered some emergency funds to the women, Srabanti says it hasn't been enough and some women received nothing at all. ""The amount of donations they've received from the government does not even cover a packet of powdered milk for the children,"" she says. In early May, Srabanti organised a private aid delivery, distributing packets of basic supplies for each of the 1,300 women registered at the brothel. ""There was one woman who said she has not been able to get her insulin or diabetic medications for over a month,"" Srabanti says. ""Another said she has not been able to buy her blood pressure medications since the lockdown started two months ago.""Reduced access to healthcare services is an issue facing sex workers globally, according to Prof Sanders. The problem is particularly acute in areas where there is high demand for regular antiviral drugs from those living with HIV.""There's been real issues around access,"" she says. Prof Sanders is working with a team in Nairobi to develop an ""Uber-style"" app that will enable sex workers to order medication using their phones and have it delivered. ""It's sent directly to them via a mode of transport rather than the person coming into the clinic,"" she says. Back in Daulatdia brothel, another sex worker who didn't want to be named is returning from a trip to see her daughter, who lives in a nearby home for the children of sex workers. Even when the brothel reopens, it will take a long time for the industry to recover, she says.""People are afraid if they come to us, they might get infected,"" she says. ""We are afraid too. We might get infected from them. This fear of getting infected will come up all the time.""Additional reporting by Salman Saeed.",3 June 2020,business
