Coronavirus: New York Stock Exchange trading floor reopens,"The New York Stock Exchange (NYSE) has reopened its trading floor after a two-month closure due to the coronavirus pandemic.But as new social distance rules come into effect, the exchange looks and feels very different.The NYSE is one of the few bourses to still feature floor trade - most have shifted to fully-electronic trading.New York City has been hit hard by the outbreak with some 200,000 cases and more than 20,000 deaths.Financial markets have continued to trade throughout the pandemic, but the exchange's trading floor was closed from 23 March and activity temporarily moved to fully-electronic trading to protect workers.New York Governor Andrew Cuomo was on hand to ring the bell that re-started in-person trade, a sign of the symbolic weight attached to the reopening.US shares gained on Tuesday amid investor enthusiasm about economic rebound, but the new NYSE rules are a reminder that a full return to business will take time.""It's not about returning to normal,"" NYSE president Stacey Cunningham told the BBC. ""It's about living with this global pandemic until there's a vaccine.""She added that she had faced ""no pressure"" from the Trump administration, which follows financial markets closely and has generally supported a rapid reopening. Under the NYSE changes, only a quarter of the normal number of traders will be allowed to return to work.Traders must also avoid public transport, wear masks and follow strict social distancing rules, with newly fitted transparent barriers to keep people apart.They will also be screened and have their temperatures taken as they enter the building. Anyone who fails pass the check will be barred until they test negative for coronavirus or self-quarantine in accordance with US government guidelines.To return to their jobs, floor traders also have to sign a liability waiver that prevents them from suing the NYSE if they get infected at the exchange. Some large financial companies, such as Morgan Stanley, have reportedly balked at signing, but Ms Cunningham defended the waiver as a way to ensure that traders, which are not employed by the exchange, abide by the new rules. ""We need to make sure that they're committed to following this new norm,"" she said.NYSE, which is owned by Intercontinental Exchange, is the world's largest stock exchange in terms of the total market capitalisation of listed companies.The 228-year-old exchange last closed its doors on 29 October 2012 due to Hurricane Sandy. It also shut for four sessions in the aftermath of the 9/11 terrorist attacks in 2001. But the bourse resisted closing at the start of the pandemic and the closure reignited debate about the necessity of the floor in an era dominated by electronic activity.Ms Cunningham said trading has functioned smoothly with the floor closed, but she believed reopening will further ease volatility and help smaller firms that rely on in-person trades for their business.""We are relevant we are necessary and WE ARE BACK,"" floor trader Peter Tuchman wrote on Twitter ahead of the reopening.Greatest group of people I’ve ever met & to ever walk the floors of the NYSE are returning to the greatest job on earth to do what they do best ... screw the nay sayers that NYSE has seen its last days ... 💥F-that .. we are relevant we are necessary and WE ARE BACK pic.twitter.com/SaaDT0vrmjEnd of Twitter post  by @EinsteinoWallStFor most people outside the financial world, NYSE's trading floor is a rare glimpse into the seemingly opaque workings of the global markets as well as being a colourful setting for companies to showcase their stock market debuts.The new regulations mean that the NYSE's high-profile opening bell events and stock market debut celebrations have been put on hold as visitors are banned.Media organisations that usually broadcast from the trading floor won't be allowed back until further notice.In the BBC interview, Ms Cunningham also addressed a proposal by US lawmakers to require companies that sell shares in the US to abide by American accounting rules and audits, or face de-listing. The move, which comes as US-China tensions increase, is aimed at Chinese companies. The Senate passed the measure last week and the House is expected to take up the measure before the end of the summer. Ms Cunningham in the past has said de-listing Chinese companies generally would simply shift their business elsewhere. On Tuesday, she said lawmakers should ""balance"" investor protections and investor choice, but that the exchange backs efforts that would enhance the information supplied to investors.""Any measures to enforce that are highly supported by us,"" she said.Trading - but not as we know itAnalysis by Samira Hussain, BBC reporter New YorkBefore the coronavirus, I was a regular on the floor of the New York Stock Exchange. It may be one of the great symbols of US capitalism, but it's also, just a workplace for hundreds of traders, market makers, and various bystanders such as journalists.And like so many offices and shop floors it's not somewhere that you would ever associate with social distancing, keeping two metres apart and wearing masks. Quite the reverse - face-to-face stock trading is sometimes close to a contact sport, as is reporting from the floor. So the NYSE has to take its reopening very slowly. It will be a relief for some traders to be back to work, but it's not going to look like the trading floor we're all used to seeing for quite some time.",26 May 2020,business
Find out which masks offer the most protection and why,"While paper and cloth masks may help controlling the spread of Covid-19 amongst the general public, they're certainly not up to the mark for use in intensive care.Here, where the risk of infection is at its greatest, medical staff need personal protective equipment of a far higher standard, capable of shielding them completely from the virus. The simplest form of face covering is the surgical mask, generally made of three layers of paper or cloth. They're resistant to droplets such as those caused by coughing or sneezing, but give little protection against viral particles themselves, which are only around 100 nanometres in size (a nanometre being a billionth of a metre).""A mask, which goes over your nose and mouth, but doesn't fit tightly to your face, is really there to be a barrier for any particles that you might expel,"" explains Dr Nikki McCullough, head of safety for 3M, one of the world's biggest suppliers of respiratory protection. ""The mask isn't going to prevent you from breathing in very small particles.""Respirators, on the other hand, are designed to fit tightly to the face, so that no air can leak in or out, and require a rigorous fitting process.""When you breathe in, all the air goes through the filter media, and that filter media has been tested to a performance standard,"" says Dr McCullough. ""So you can be sure that if you get a good seal to your face, the respirator is reducing the number of particles that you're going to breathe into your lungs.""Respirators come in various different forms, the simplest being mask-like filtering facepiece (FFP) respirators; some are designed to be disposable, whereas others can be disinfected and reused.More Technology of BusinessIn the US, FFP respirators are classified by the National Institute for Occupational Safety and Health (NIOSH) in terms of the percentage of particles they filter out. Thus, N95 and N99 masks filter out 95% and 99% of particles respectively, while N100 devices eliminate 99.97%. In Europe, respirators are classified slightly differently. Respirators rated FFP1 filter out at least 80% of particles; FFP2s remove at least 94%, and FFP3 devices correspond to N100 by filtering out at least 99.97%.Meanwhile, similar to an FFP3 mask in effectiveness, but certainly not in appearance, are diving helmet-style powered air purifying respirators (PAPRs).""There you have a more comprehensive solution. There's a hood face shield and a tube that would connect into a unit on the belt,"" says Brian Hovey, chief marketing officer for major respirator manufacturer Honeywell. ""That has an engine or a motor that pumps air through a filter: it's part of a white suit, so it's a more comprehensive protective solution.""At the University of Southampton, engineers have developed a PAPR that they're supplying to University Hospital Southampton - 1,000 are already in use. It's currently undergoing the official rating and approval process, so it's not yet in use in intensive care or triage, where FFP3 respirators are required. However, two firms are making them and 5,000 have been ordered for staff in other settings.The testing process involved both a smell test to see whether the wearer could detect outside smells, as well as a physical test of whether tiny particles are indeed filtered out.""We put a petri dish inside the hood and another one outside, and delivered 1,000 litres of air through the filter,"" explains Alex Dickinson, an associate professor in the university's bioengineering science research group.""We incubated them for 24 hours at 37C and then counted how many of these colony-forming units had been transmitted through the filter and hood. On our first experiment, we saw no units of bacterial growth inside the hood, but ten formed on the control plate outside.""The British Standards Institute is currently evaluating the device against European standards, after which, hopes the team, it can be used more widely at Southampton and elsewhere.""Your vision is much better, and your communication is better, as the patient can see your whole face; your efficiency is much better as you can move from patient to patient without putting on and taking off your PPE,"" says hospital consultant and professor in respiratory medicine Paul Elkington.""Once we started rolling it out, one of the healthcare assistants said to me 'I've been feeling sick with nerves about coming in, but now I feel secure'.""Until recently, the market for respirators was mainly industrial - manufacturing, construction and the like.""If we look at six months ago, with full-face respirators - FFP2s and FFP3s - demand from healthcare was very low,"" says Dr McCullough. ""They really only used them for tuberculosis, maybe a measles case. But now we see that healthcare everywhere in the world is using respirators at a much, much higher rate.""As a result, manufacturers have been working flat out to increase capacity to meet the new demand.""We've made significant investment in both ramping up capacity at our existing facilities as well as new facilities. Most notably, in the US, we've just had our first products coming off the line in our Smithfield, Rhode Island facility, and we hit 500,000 units earlier this past week,"" says Honeywell's Brian Hovey. ""Similarly, we've ramped up our build capacity and we're starting to get product out in Phoenix. These new facilities are adding about 20 million units per month, and we're evaluating potential new facilities around the globe.""Dr McCullough says that 3M is also increasing production, adding extra shifts and improving efficiency.""We can make the same products but more quickly; we are adding new lines and we are looking at some small changes to certain products, looking at new headbands, for example,"" she says. So will the global supply hold up?""In the immediate term, probably not, unfortunately - the uptick we've seen has been unprecedented and depending on how people are thinking of them as a consumer product, demand far outstrips global supply,"" says Mr Hovey.But, he adds, ""We're having a good dialogue with governments around preparing for the future, and we make sure that strategic stockpiles are adequately supplied. ""If - god forbid - another situation like this occurs, collectively we'll be able to respond quickly and effectively.""",26 May 2020,business
The man who sells 700 million sandwiches a year,"The BBC's weekly The Boss series profiles different business leaders from around the world. This week we speak to Patrick Coveney, chief executive of convenience food group Greencore.When you are the UK's largest maker of pre-packaged sandwiches the coronavirus lockdown is a significant problem.With everyone except key workers being asked to stay at home from 23 March, Greencore suddenly saw a vast drop in customer numbers.Supplying own-brand sandwiches to all the major supermarkets, and staff canteens - overnight there was hardly anybody in the UK's offices and other workplaces, to pop out in their lunch-break and buy a BLT or egg mayo.As a result, Greencore says its main ""food to go"" division, which usually sells 700 million sandwiches per year, plus salads and sushi, saw sales slump by 70% over the following month and a half.Patrick, who has led the Dublin-based and London-listed company since 2008 says it has been a ""period of unprecedented uncertainty"". And in an interview with Irish broadcaster RTE, he said it made previous worries about Brexit ""seem very trivial.In response to coronavirus, Greencore has shut three of its 16 UK facilities and furloughed 4,000 of its 11,500 employees. Patrick and his fellow board members have cut their own pay by 30%.He says he is proud of the staff that have remained in work, making sandwiches that include the ""thousands"" given for free to NHS workers across 20 UK hospitals.""Our people have been working around the clock to ensure that we can continue to provide high quality, fresh prepared food to both consumers and frontline workers during the pandemic.""Born in the Republic of Ireland in 1971, the 49-year-old is from a celebrated Irish family that is sometimes referred to as ""the Kennedys of County Cork"". Patrick's late father Hugh was a government minister in the 1990s. His brother Simon is the current tánaiste or deputy prime minister.After school Patrick gained a degree in commerce from the University College Cork. He then went to Oxford University, for a masters in management studies. He played rugby at both universities, and says the sport helped teach him ""the importance of building and working in great teams"".Oxford was followed by spending a decade at management consultants McKinsey, before he joined Greencore in 2005, as chief financial officer.Greencore had been set up in 1991 following the privatisation of the former state-owned Irish Sugar. It moved into convenience foods in 2001 before completely exiting the sugar business in 2006. In 2011 it switched its primary listing from the Irish Stock Exchange to London.While making sandwiches is the bulk of its business, it also produces a range of chilled prepared meals - everything from curries, to quiches and soups. The company says sales of these in first six weeks of the lockdown were higher than last year as people did more cooking at home. However, the rise was only as much as 5%.Although coronavirus is a challenge for Greencore, it is not the first major problem Patrick has had to deal with at the company. In 2008, only three months after he was promoted to chief executive, a £15m fraud was discovered at the company's Scottish water subsidiary Campsie.Patrick sacked three senior managers over the scandal. It was, he says, ""the most challenging moment"" of his professional life, and that it made him ""stronger and more determined as person and as a leader"".Retail analyst Nick Widdowson, founder of Shopper First, says that looking forward, a major issue facing Greencore and other makers of convenience food is how to reduce or remove the plastic packaging.""Providing ethically fresh, authentic, locally sourced product, together with sustainable packaging, will be key to any producer of convenience foods seeking to meet their consumers' changing expectations,"" he says.Patrick agrees. ""Two years ago I could make a balanced and consumer-friendly argument that packaging prolongs the life of food and produce items. [But] the world has moved on, plastic is seen as a problem, and so we need to find alternatives that are better for the environment.""More The Boss features:While Greencore's 2020 revenues and profits will inevitably be down on 2019's £1.5bn and £56.4m figures, the company says that sales of its pre-packaged sandwiches have now started to recover in recent weeks as more people have returned to work.It also said that a survey of 7,000 customers showed that many were now ""bored and frustrated"" with having to making their own lunches at home.""Greencore has an absolutely critical role to play in keeping the UK fed... and there is a powerful sense of commitment, skill, spirit, and purpose across the Greencore workforce in performing this role,"" says Patrick.",25 May 2020,business
What Trump wants from global trade,"President Donald Trump's approach to international trade is driven to a large extent by his belief that the United States is being unfairly treated by other countries.His main supporting evidence is the trade deficit - the US buys more than it sells internationally. He has referred to the deficit as losing money. In one tweet he wrote about losing $500bn (£388bn) a year as a result of crazy trade with China. No more, he promised.  One of his central economic objectives has been to reduce it. In November 2017, his first year in office, he referred to the total deficit with all trade partners of almost $800bn a year as unacceptable. He said: ""We are going to start whittling that down, and as fast as possible"". Rivals is a season of in-depth coverage on BBC News about the contest for supremacy between the US and China across trade, tech, defence and soft power.Read more here.But it hasn't come down. The figure that President Trump referred to was for trade in goods alone. It has increased in both of the full years since he took office. It was $750bn in the final year under President Barack Obama, $887bn in 2018, and the increase has continued. We have figures for the first nine months of this year, showing the deficit was larger, though only slightly, than in the same period of 2018. Mr Trump focuses on bilateral deficits, often suggesting they are evidence of the unfair actions of the other country concerned.The deficit with China is by far the largest. It rose in Mr Trump's first two years, but for the first nine months of 2019 it is lower. Both imports and exports have fallen, imports by more. That is hardly surprising as the two countries have applied increased tariffs to large swathes of one another's goods. So a success for President Trump?  Only if you think bilateral trade balances really matter. And most economists think they don't. Getting one bilateral deficit down does not guarantee you reduce the overall deficit. The deficit with China may be down, but others have increased - Vietnam, Mexico and Taiwan for example. More from the BBC's series taking an international perspective on trade:Part of the underlying story is the fact that the trade balance with the rest of the world is mainly driven not by barriers that countries put in the way of one another's goods.Instead, it's about whether countries buy more goods and services than they produce. Prof Greg Mankiw of Harvard University (who used to be a supporter of the Republican Party) puts it like this: ""If you really want to reduce a trade deficit, the way to do it is to bring down spending relative to production, not to demonise trading partners around the world.""President Trump has, if anything, done just the opposite. His tax cuts have given a boost to the US economy, though that may now be fading. But it's not really surprising that the trade deficit should rise as Americans - families and businesses - have had more to spend, and some of that money goes on imported goods. There is an idea in economics known as the ""twin deficits hypothesis"", that there is a link between a government budget deficit and a trade deficit - or strictly speaking, a current account deficit that includes some financial transactions in addition to trade in goods and services. It is by no means a settled debate, but the idea that tax cuts can in some circumstances lead to a larger trade deficit is entirely credible.  So there is a coherent story here that President Trump has taken steps - tax cuts - that make it harder to achieve something else he wants - a reduction in the trade deficit.  That's not to say that President Trump isn't on to something, in the sense that his views on trade may reflect real economic damage in some communities. The Nobel Prize winner Esther Duflo says there is among economists an ""instinctive view on trade, that it should be good for everyone"". But it's not true she says.Although trade boosts growth overall, it does produce concentrated pockets of job losses, she says. That's not a new view, and it doesn't mean you can turn the clock back or reverse the losses by putting up new trade barriers. ",28 November 2019,business
