How China plans to lead the computer chip industry,"On a university campus on the outskirts of Hong Kong a group of engineers are designing computer chips they hope will be used in the next generation of Chinese made smart phones.Patrick Yue leans back in his chair in a coffee shop on the campus, sporting a Stanford University t-shirt. He is the lead engineer and professor overseeing the project.His research team designs optical communication chips, which use light rather than electrical signals to transfer information, and are needed in 5G mobile phones and other internet-connected devices.He tells me about the challenges China faces in developing a world-beating computer chip industry.""I actually think the actual designers will be as big a bottle neck as the manufacturing. We don't have nearly as many research institutes and industry bases to train the designers,"" he says.His department is part-funded by Huawei, the Chinese communications and telecom giant at the centre of an international political storm. In May the US added Huawei to a list of companies that US firms cannot trade with unless they have a licence, blaming security concerns.Rivals is a season of in-depth coverage on BBC News about the contest for supremacy between the US and China across trade, tech, defence and soft power.Read more here.Many industry observers fear that the US-Chinese trade war, risks unravelling the global technology supply chain.In particular, China relies on overseas companies for computer chips (or semiconductors), the tiny devices used in everything from consumer electronics to military hardware. ""Politically everything can be used as a bargaining power,"" says Mr Yue.""If these companies and countries start to hold back on technology then everyone will get hurt. It's not good from a technological point of view,"" Mr Yue says.China has made no secret of its desire to become self-sufficient in technology. The nation is both the world's largest importer and consumer of semiconductors.It currently produces just 16% of the semiconductors fuelling its tech boom. But it has plans to produce 40% of all semiconductors it uses by 2020, and 70% by 2025, an ambitious plan spurred by the trade war with the US.In May 2018 China's President Xi Jinping met with the country's leading scientists and engineers, calling for specialists to work towards self-reliance in the production of core technologies.That meeting was just a month after the US government banned US firms from selling components to ZTE, China's second-largest maker of telecom network equipment.The ban highlighted to China's leaders that the nation's tech boom was dependent on foreign technology. In October this year, in its latest bid to help wean the nation's tech sector away from US technology, the Chinese government created a $29bn (£22bn) fund to support the semiconductor industry.""There is no question that China has the engineers to make chips. The question is whether they can make competitive ones,"" questions Piero Scaruffi, a Silicon Valley historian, and artificial intelligence researcher who works in Silicon Valley.More Technology of Business""Certainly, Huawei can develop its own chips and operating systems, and the government can make sure that they will be successful in China. But Huawei and other Chinese phone makers are successful also in foreign markets, and that's a totally different question: Will Huawei's chips and operating systems be as competitive as Qualcomm's and Android? Most likely not. At best, it will take years before they are,"" Mr Scaruffi adds.Mr Scaruffi estimates that China could be as many as 10 years behind the leading producers of high-end computer chips. The majority of chips made for high-end electronics are manufactured by specialist foundries like the Taiwanese Semiconductor Manufacturing Company (TSMC). It produces more than 70% of chips designed by third party companies. Just securing the best machinery needed to make high-end chips is difficult.""To start out with equipment, its very high precision equipment. You need to print very fine features.  The equipment that is needed to have this kind of technology is controlled by a few companies in the world,"" says Mr Yue. He believes that Chinese technology is three to four generations behind companies like TSMC. China lacks the industry experience to manufacture high end chips, he says. But he believes that companies like Huawei are already competitive when it comes to designing chips.Where does this leave the tech giant Huawei?Mr Yue argues that Huawei is trying to replicate the successful business models of firms like Samsung, which produces its own computer chips - rather than trying to fall into line with Beijing's industrial ambitions.""You can almost view them as an integrated company with the expertise of what Apple or Qualcomm has,"" says Mr Yue.Li Changzhu is a lifelong employee of Huawei and president of the company's handset business. He joined the company 23 years ago as a fresh graduate and has watched it grow into the international tech giant. He claims that the goal of companies like Huawei is simply to satisfy consumer needs. ""We are open to use other vendors chipsets. Every year we purchase a lot of chips from Qualcomm. We are open to that. We use the best chipsets to satisfy our customers,"" he says sitting on the side of a tech conference in Macau, a semi- autonomous southern Chinese city.Growth in the semiconductor industry is typically driven by disruptive new technologies. In the late 2000s the introduction of smartphones boosted demand for the tiny integrated circuits that control everything from memory to Bluetooth and wifi.But today China's ambition to dominate sectors such as artificial intelligence and 5G is expected to further ramp up demand for high-end chips.Industry analysts like Mr Scaruffi question China's ability to truly innovate. ""Every Chinese city wants to build its own Silicon Valley. It tends to be more driven from the top. Silicon Valley had a big advantage, that it was very far away from the political power,"" says Mr Scaruffi. He believes that China's technological success lies in the implementation of technology rather than its creation.""If your metric is how many people use smart phones to go shopping then China wins big time. But if your metric is Nobel Prize winners, then China is losing badly. China of course has been very successful in implementing technology in a way that dramatically alters society,"" he says. ",19 November 2019,business
Is China gaining an edge in artificial intelligence?,"""China is betting on AI and investing in AI and deploying AI on a scale no other country is doing,"" says Abishur Prakash, a futurist and author of books about the effect of artificial intelligence (AI) on geopolitics.As developments in AI accelerate, some in the US fear that the ability of China's powerful central government to marshal data and pour resources into the field will push it ahead. The country has announced billions in funding for start-ups, launched programmes to woo researchers from overseas and streamlined its data policies. It has announced news-reading robots and AI-powered strategy for foreign relations. Perhaps most alarming to the US are its efforts to incorporate it into its military.In the last few years, Washington has toughened oversight of Chinese investments, banned US firms from doing business with certain Chinese companies and increased criminal prosecution of alleged technology theft.""What the Trump administration is doing is a sign... the US knows that its geopolitical power will be redefined and reconfigured by this era,"" said Mr Prakash, who works at the Toronto-based Center for Innovating the Future.These developments come amid political tension between the two nations. Yet, some analysts worry the US response is counterproductive, arguing that cutting off access to US microchips, for example, could simply accelerate Chinese efforts to develop their own alternatives.The Trump administration has imposed tariffs on billions of dollars worth of Chinese goods - retaliation for ""unfair"" practices it says are aimed at giving China an advantage in the field.The White House has also pressed universities to review their relationships with Chinese partners and threatened to restrict student visas. It is even said to be looking at rules against certain US investments in China - once nearly unthinkable in free-market America.Rivals is a season of in-depth coverage on BBC News about the contest for supremacy between the US and China across trade, tech, defence and soft power.Read more here.The actions are aimed at preserving US leadership in technologies expected to determine economic and military power for generations to come.""That China will grow to be an economy as large as ours may be inevitable; that we aid their mercantilist strategy through free trade and open investment in our technology sector is a choice,"" US Department of Defense officials wrote in a widely cited 2018 report.As the US and China race to capitalise on advances in machine learning, facial recognition and other forms of artificial intelligence, Tom Mitchell has a front row seat.The professor of computer science founded the world's first research centre for artificial intelligence at Carnegie Mellon in the US. Since 2018, he has also served as chief scientist at Squirrel, a leading tutoring company in China. He says the US has more experience building tech companies, but China may have the advantage when it comes to AI applications relying on big data sets - and points to the medical field as an example.""In the US we've had electronic medical records for over 20 years but we still have not put together all the records in the country to run machine-learning algorithms on those."" He says the US has been inhibited by privacy concerns, as well as a fractured, for-profit industry. ""In China, it's a different situation. If the government decides that it's going to have country-wide electronic medical records... then it's going to happen.""Prof Mitchell, who is working on using AI to improve education, says working in both the US and China puts him in the best position to invent and apply cutting-edge technology.But that kind of cross-border collaboration is facing increasing scrutiny, given rising political tensions.Last year, Chinese investment in the US dropped to $4.8bn (£3.7bn) - its lowest level since 2011 - while US investment in China dipped from $14bn to $13bn, according to the Rhodium Group's annual report.High-profile Chinese firms, like insurance giant Anbang and Kai-Fu Lee's Sinovation Ventures, have reportedly sold or scaled back US operations, while China's Huawei and ZTE have suffered serious losses after being subject to US bans. In US academic circles, universities are rethinking their ties to China, while US firms doing business in China have also grown more cautious.Mr Prakash, who works with start-ups, tech firms and governments on questions of artificial intelligence, says while many western firms continue to pursue opportunities in China, current tensions have changed the discussions.""Geopolitics is now front and centre for all of them,"" he says. ""They're forced to say, hey, we're based in Silicon Valley, we're selling to part of Asia and now as this tech war unfolds we need to understand what's possible, what can we do, what are our options.""More Technology of BusinessProf Mitchell says policymakers need to distinguish between AI applications that are win-win and those that are truly competitive, such as those for the military.In the meantime, he says Washington's increasingly nationalist tone risks alienating America's foreign students and researchers - many of them Chinese - who have played a critical role in US tech leadership to date.""To start thinking about putting up export control walls around the US could be as damaging to the US research enterprise as anything that a foreign adversary might try to do to us. I hope we will act rationally and not just out of fear.""While US concerns about technology theft have merit, ""I feel like we're over-reacting,"" says Prof Mitchell.""The fact that China or the UK or anybody decides they want to be a leader in AI - it would be surprising if they did not. It's not something to be reviled,"" he says.American national plans have also called for boosting investment, reforming the immigration system and improving education, but those are much more difficult to achieve, says William Carter, deputy director of technology policy at Washington's Center for Strategic and International Studies.""Being hard on China is an easy political sell,"" he says, but warns that, ""I think we're shooting ourselves in the foot in a lot of ways"".The race between the US and China is now moving to other countries, which are being pushed to take sides as tech firms from the two compete for turf. The US has pressed its allies to stop using equipment from China's Huawei, for example, citing concerns that Beijing could use the firm's equipment for hacking. It has also raised human rights concerns.At a recent conference, a US official argued that Chinese tech companies are ""de facto tools"" of the state's Communist Party, saying they ""have become deeply enmeshed in Beijing's system of oppression at home and its increasingly assertive strategic ambitions globally.""As artificial intelligence technologies drive debates over values like surveillance and privacy, free speech and censorship, conflicts between the two countries are likely to increase, says Nicholas Wright, a fellow at the New America think tank in Washington, who has worked with the US and UK governments.""To some extent, this is just a generic challenge, where you have a new set of technologies and whomever manages to implement them first and best will gain an advantage... but then there's also another set of issues which is to do with the specifics of these new digital technologies,"" he says.For now, it may take artificial intelligence to know how the race will end. ",12 November 2019,business
Coronavirus: Big sales expected when clothes stores reopen next month,"Clothes stores are ramping up plans to reopen - and big discounts could be on offer.Some non-essential retailers will be able to begin reopening next month.One of the UK's biggest fashion retailers, M&S, said: ""We are working towards reopening more space from June."" But analyst Richard Lin of Retail Economics said stores ""will have to discount heavily"" to sell excess stock that may now be out of season.""Many clothing retailers have been sitting there with stores full of stock which they haven't be able to shift,"" he said.""One of the most pressing issues for retailers is working capital and there is a huge overhang of inventory at fashion stores.""Fashion retailers have been badly hit by the coronavirus crisis. Even those with robust online offerings have reported huge drops in sales.Next, for instance, saw online sales decline by 32% in the three months to the end of April. Like others, it is keen to re-open stores, as soon as it is deemed safe to do so.Next said: ""We have plans in place for the re-purposing of our stores ready to reopen in a socially-distanced world.""Its measures include installing screens at tills, placing sanitisation stations in stores and managing the number of customers that are allowed to enter its shops.M&S has kept its food stores open during the crisis, including almost 300 shops that sell fashion as well, although these areas have been blocked off.But it says they're ready to be reopened as soon as the government gives it the green light.""Our 290 stores that sell both clothing and food are led by a single manager - so it means they already have a brilliant working knowledge of the necessary hygiene measures, how to manage social distancing and the flow of our customers in and out of their store,"" M&S said.Last week the government said its strategy was to ""open non-essential retail when and where it is safe to do so"", and subject to those retailers being able to follow new guidelines.It said the intention was for this to happen in phases from 1 June, although it added that it would issue further guidance on which businesses will be allowed to open and when.That guidance can't come soon enough, according to Helen Dickinson, chief executive of the British Retail Consortium (BRC).""Retailers desperately need clarity in the rules regarding when and how they can open - details that are still lacking,"" she said.She warned that safety must be the primary concern in the decisions, rather than size or type of shop. The retail experience is going to be turned on its head when clothes stores reopen,"" predicted Mr Lin from Retail Economics.""Retailers are having to reinterpret government guidelines and have to invest heavily to make sure they can create a safe environment.""He said consumers will remain incredibly anxious and cautious about returning to fashion retailers.Changing rooms are expected to remain closed while customers will be encouraged to avoid touching merchandise.""Staff will potentially have to walk around spraying shelves,"" Mr Lin said.There are likely to be one-way systems through stores with clear floor markings and signage, while customer entry will be limited and consumers will be encouraged to shop alone.Next said it will ""prioritise the opening of our larger out-of-town stores first"".Their bigger size makes them easier to adapt and they have large car parks and outside spaces to manage queues, it said.""Retailers have started to plan how they can open stores and follow safety guidelines, with some hinting at sales when they do open their doors, such as Next,"" said Dan Plant, savings expert at UKHotDeals.""Other popular stores, like Primark, lack online sales space, so we'd expect to see plenty of fashion offers when retailers reopen.""But while fashion stores may reopen with deep discounts to clear old stock, most online retailers have already been offering sales to encourage shoppers.M&S, for instance, launched its ""rainbow sale"" on Friday with up to 50% off and 10% of takings going to NHS charities.Boohoo, Fat Face, French Connection, Gap, JD Sports , Next, Superdry and Topshop have offered similar 50%-off deals.The likes of Asos, Clarks, Dune, Debenhams, John Lewis, Karen Millen, New Look, Office and Quiz have also been offering cut-price deals. ",19 May 2020,business
"Coronavirus: 6,000 jobs at risk at Cafe Rouge and Bella Italia owner","The owner of High Street restaurant chains Cafe Rouge and Bella Italia has filed intent to appoint administrators at the High Court.Owner Casual Dining Group, whose brands also include the Las Iguanas chain, employs about 6,000 people.The company said the move would give it ten days' breathing space to consider ""all options"" for restructuring.Restaurants have been hit hard after shutting their doors in March as part of Britain's virus lockdown.Earlier on Monday, Casual Dining Group said that it is working with advisers from corporate finance firm AlixPartners over a potential restructuring programme.A Casual Dining Group spokeswoman said: ""As is widely acknowledged, this is an unprecedented situation for our industry and, like many other companies across the UK, the directors of Casual Dining Group are working closely with our advisers as we consider our next steps.""These notifications are a prudent measure in light of the company's position and the wider situation.""The firm said the move would protect it from any threatened legal action from landlords.The notice of intent to appoint administrators gives the firm ten days to put a restructuring plan into place.After that ten days is up, the firm could let the notice lapse, if there is a viable restructuring  plan.But if there is no feasible restructuring plan, the firm must either ask for another ten days to come up with one, or it could appoint administrators for the business.The restructuring plan could involve so-called ""company voluntary arrangements"" (CVAs), which allow a firm to keep trading while reducing rents. It could also see one or more of the firm's brands put into administration.The UK's casual dining chains had a tough few years even before the coronavirus pandemic arrived. Many struggled with a raft of increasing costs, including upwards-only rent reviews, business rates, a rising minimum wage and the apprenticeship levy.A rise in the cost of imported food following the sharp drop in the value of the pound amid Brexit uncertainty was another pressure point. Some well-known names, including Jamie Oliver's restaurant empire, the burger chain Byron, and the Chiquito and Frankie & Benny's owner have either closed sites or had to put in place emergency financial measures.",18 May 2020,business
Huawei calls US rules 'arbitrary and pernicious',"Huawei has said new US export rules to limit its access to key technology are ""arbitrary and pernicious"".The Chinese tech giant warned investors the restrictions would ""inevitably"" hurt its business, and could damage the global technology industry.The US had already put Huawei on a blacklist last year, calling the company a national security threat.A statement said the US was in a relentless pursuit to tighten its stranglehold on our company, But chairman Guo Ping told an analyst summit on Monday: ""Luckily we have survived so far.""The US on Friday said it would require global semiconductor-makers that use US technology and software in chip design to seek US government approval to ship to Huawei.It said the added control was necessary to close a loophole that had emerged since the US last year moved to cut off Huawei from access to US-made semiconductor chips, which form the backbone of many computer and phone systems.""Our business will inevitably be impacted,"" Guo Ping said of the new rules. ""In spite of that, as the challenges over the past year have helped us develop a thicker skin, we are confident about finding solutions soon"".Since being put on the US blacklist last year, he said Huawei had been forced to rewrite computer code, review procurement and spend thousands of hours to ensure business continuity.""Huawei is just like this plane riddled with bullet holes,"" he said. ""Over the past year, patching up the holes was our priority."" However, the firm warned that the new rules would hurt the firm's ability to serve and maintain its networks and services for billions of customers around the world. Huawei said the US campaign against the company would ultimately damage the country's credibility with international companies.""It will damage the trust and collaboration within the global semiconductor industry and could increase conflict and loss within these industries,"" it said.",18 May 2020,business
Coronavirus: Shopping centre giant Intu warns of debt default risk,"Shopping centre operator Intu has warned that it risks defaulting on its debts unless its lenders give the firm significant breathing space.The coronavirus pandemic has hit rental income and Intu said there was no certainty how quickly the market would recover once the lockdown is lifted.It also said it was unable to sell any of its shopping centres to raise funds.The owner of Manchester's Trafford Centre is now asking lenders for a grace period of up to December 2021.The firm said its shopping centres would remain ""semi-closed"" until at least 1 June. Intu, which also controls Lakeside in Essex, was already struggling under £4.6bn worth of debt prior to the Covid-19 crisis. Earlier this year, it planned to tap investors for £1.3bn but was forced to abandon the fund raising attempt.It is now seeking a so-called standstill agreement with its lenders, which would delay both debt repayments and tests on whether Intu has breached the covenants on its borrowings.The company said that once the current crisis had passed, it would then be in a better position to explore ""solutions"" as well as possible disposals of its shopping centres to ""ultimately fix the balance sheet"".Intu recently appointed David Hargrave, a former partner at accountancy firms PwC and EY, as its chief restructuring officer.A number of retailers including Debenhams have sought rent holidays from landlords, while others such as Primark and Burger King stopped paying rent in March.The government has also introduced measures to protect tenants from landlords using aggressive methods, such as winding up petitions, to collect rent.",18 May 2020,business
