Ozone layer: Concern grows over threat from replacement chemicals,"Substances used for air conditioning in almost all new cars are building up in the environment and may pose a threat to human health, researchers say.These ""ozone friendly"" chemicals have been introduced to replace products that were damaging the ozone layer.Now widely used across industry, these alternatives do not break down in the environment.Scientists have now found increasing levels of these chemicals in Arctic ice samples dating back to the 1990s. The Montreal Protocol is regarded as one of the most successful environmental treaties ever adopted.Signed back in 1987, it committed countries to regulate their use of chlorofluorocarbon chemicals (CFCs) that had recently been found to be depleting the ozone layer. A growing hole in the ozone over Antarctica had been detected in the mid-1980s and there was serious concern about the threat it posed to human health.CFCs were then widely used in refrigeration, in air conditioning, as solvents and in aerosol sprays.In the intervening decades, alternative products that are less harmful to the ozone layer were introduced. As a result, researchers have reported progress in reducing the size of the hole.However, there are now concerns that the solution may be inadvertently damaging the environment and threatening human health.Canadian researchers, studying ice samples from the Arctic dating back to the 1990s, have found ""dramatically"" increasing levels of ozone replacements called short chain perfluoroalkyl carboxylic acids (scPFCAs).""We're seeing much, much larger levels, on the order of 10 times higher now than we saw before the Montreal Protocol,"" said Prof Cora Young, from York University in Toronto, the study's corresponding author.""We don't know a lot about them and their potential toxicity, but we do know that we are committing the environment to a great deal of contamination.""The compounds being detected in the Arctic are in the same class as perfluoroalkyl substances, or PFAS, sometimes called the ""forever chemicals"".These long-lasting chemicals are found in everything, from furniture to clothing to food wrapping to drinking water. There is growing concern about the role of PFAS in serious health conditions including cancer, liver damage and decreased fertility.The related products, found in the Arctic ice samples, do not break down in the environment and current water filtration technology is unable to remove them.The scientists expect levels of scPFCAS to increase markedly in the future.As part of the efforts to replace CFCs, car manufacturers around the world agreed to use a different coolant in air conditioning called HFC-134a which was introduced in 1992. While HFC-134a was less damaging to the ozone layer, it was unfortunately a very powerful greenhouse gas, around 1,400 times more warming that CO2. So manufacturers in the US and Europe agreed to phase out HFC-134a and by 2017 all new cars had to use a different coolant for air conditioning called HFO-1234yf.While this chemical doesn't damage ozone, and is not a greenhouse gas, it does unfortunately break down to produce short chain PFCAs.""It has a very low global warming potential, but has a much higher propensity to form these persistent products,"" said Prof Young. ""It will be again another shift, where we see an even more dramatic increase.""According to the researchers, these chemicals can travel a long distance in the atmosphere and often end up in lakes and rivers. They cause ""irreversible contamination"" and can impact the health of freshwater creatures including crustaceans and worms. There is growing concern that these compounds may impact human health as well.""They've been found in the bodies of people in China, so it is likely to be found in the bodies of people around the world,"" said Prof Young.""We have done a good job in trying to save the ozone layer but the unintended consequences are the release of these other chemicals, which have some concerns.""""They're toxic, and then they don't get filtered out in various ways.""The study has been published in the journal Geophysical Research Letters.Follow Matt on Twitter.",14 May 2020,science
Social distancing: When extreme weather and coronavirus collide,"People being displaced by extreme weather events around the world are being forced to break Covid-19 social distancing safety guidelines, according to the International Federation of Red Cross and other humanitarian agencies.“Social distancing is no longer possible when displaced people are in evacuation centres,” Marshal Makavure, emergency operations co-ordinator of IFRC in Eastern Africa told the BBC.“People have been forced to break the Covid-19 protocol and guidelines under such circumstances.”The BBC has spoken with people living in areas affected by extreme weather events.Subrat Kumar Padhihary, a 38-year-old farmer in Odisha state on India’s east coast, is worried.Indian officials are on alert as Cyclone Amphan, due to hit West Bengal and Odisha on Wednesday, looks likely to intensify into a ""very severe"" storm.Subrat’s village is nearly 40 kilometres from the sea. The house that he shares with his wife, three daughters and mother was badly damaged by Cyclone Fani last year, so he isn’t convinced it can withstand Cyclone Amphan.But even if his house survives, he’s worried about having to leave his village if the authorities say people must evacuate.Subrat feels that might be even more dangerous.“My fear is that we will be taken to nearby schools that have already been turned into Covid-19 quarantine shelters.“There are not many centres in our village, and that means we will have to share the space with people [who may have Covid-19] which will be full of risks.”“West Bengal state has been struggling with Covid-19 cases and that is a cause of concern when it comes to cyclone preparedness,” according to Siddarth Srinivas, food and climate policy lead for Oxfam in Asia.“In the past, some states in India have rescued people by sheltering them in schools and public buildings, but this time doing that is not ideal because of the pandemic.”The Kasese district in western Uganda has been one of the worst hit by recent floods, with hundreds of people displaced.Joseline Kabugho is six months pregnant. The 23 year old has been forced to shelter with her two children in one of the school-turned-camps in the district.She’s staying at the shelter, even though her pregnancy means she is in a high-risk group when it comes to Covid-19 infection. There are nearly 200 displaced people with her at the shelter.“We are so vulnerable now,” she said from a class shared with three other families, which is now her family’s temporary home. “I can’t stay away from other people because of the limited space.“I am worried that I may get the virus, and I am worried about my kids, and my unborn baby,” she told the BBC.Joseline was sleeping next to her two children on the night of 7 May, when she heard other people in her village screaming.“I realised later on that my neighbours were actually telling me to run for my life. The entire village had been hit by a massive flood.“I grabbed my two kids and ran away, I had no time to take anything else.""She had bought some clothes for her unborn baby before the floods. “I could not even save those clothes. The floods took them all.“Whatever we had was swept away.""Her husband works in another district and he has been unable to travel due to Covid-19 restrictions. “I have nowhere to go and I don’t know what to do next.”Relief workers with the Red Cross say thousands of people are now sheltering in churches and schools in flood-hit East Africa with limited access to water and soap.Hundreds have died and tens of thousands have been displaced because of the floods in more than a half a dozen countries.More than 2,700 Covid-19 deaths and nearly 82,000 confirmed cases have been recorded in Africa, according to John Hopkins University.Among the flood affected countries in East Africa, Somalia has the highest death figure of 55, followed by 50 in Kenya and 21 in Tanzania.Tropical cyclone Harold hit Pacific island countries more than a month ago.Some affected countries had to lift Covid-19 restrictions to allow people to take refuge in evacuation centres. Some people are still in evacuation centres now because the pandemic is affecting aid efforts.The worst-hit country, Vanuatu, has extended the state of emergency as more than 92,000 people have been affected, according to Unicef.In Fiji, about 10 evacuation centres are operating because recovery has been very slow and many houses are yet to be rebuilt.“Access to water is still a big challenge as the cyclone has destroyed water supply infrastructures,” said Vani Catanasiga, director of Fiji Council of Social Services.“Without adequate water supply, following Covid-19 hygiene guidelines is very difficult, although the Fijian government has been successful in flattening the Covid-19 infection curve.”Humanitarian agencies say relief operations can help in enforcing Covid-19 guidelines.Red Cross relief worker Irene Nakasiits is distributing water and soap as essentials to the flood-displaced communities in western Uganda.“Although it is challenging to do so, we can still remind affected communities to follow the guidelines,” according to Marshal Mukuvare of the IFRC.“We can have messages written on food and other relief materials, which we distribute in affected places.“This helps people do what they can, even in such adverse conditions.”It’s uncharted territory, according to Siddarth Srinivas, Food and Climate policy lead for Oxfam in Asia. “When it comes to how to deal with extreme weather and a pandemic like Covid-19, the debate has just started.“It needs much more thinking before we come up with solid measures.”  ",20 May 2020,science
Meet the baby orangutans learning to climb trees,"While much of the world is in lockdown, youngsters in one very unusual classroom are still having lessons.At a forest school in Borneo, baby orangutans learn tree-climbing skills from their human surrogate parents.The orphans spend 12 hours a day in the forest, preparing for a new life in the wild.The orangutans were filmed and photographed before coronavirus struck, for the TV series Primates, on BBC One.With human contact routinely kept to a minimum, life goes on much as before for the animals, says Dr Signe Preuschoft, leader of ape programmes for the charity Four Paws, which runs the rehabilitation centre in East Kalimantan.As a precaution, the staff now have temperature checks, wear facemasks and change into uniforms on site.The pandemic has disrupted many conservation programmes around the world but Dr Preuschoft says it also offers an opportunity to bring positive change.""There are great opportunities here to protect wildlife better from illegal wildlife trade and from (consumption of) bushmeat,"" she says. ""It's very much about education.""The young orphaned apes climb high into the treetops with their caregivers to help them acquire the skills they would have learned from their mothers in the wild.They would otherwise spend more time on the ground than is natural for a species that feeds, lives and sleeps in the canopies of trees.Baby orangutans have a huge advantage when it comes to climbing, as they can hold on ""like an octopus"", says Dr Preuschoft.""I think the orangutans were really completely thrilled when they realised that they could actually be in a canopy together with one of their moms,"" she adds. As soon as the rescued orangutans have moved out of quarantine, they spend long hours in the forest in as natural an environment as possible. They are taught essential forest survival skills in a large forested area between the cities of Balikpapan and Samarinda.The aim is to provide sanctuary to illegally captured or directly threatened orangutans, as well as to rehabilitate orphaned orangutans, with the goal of releasing them back into the wild. Only about 50,000 Bornean orangutans are left in the world, with numbers plummeting over the last 70 years. Loss of rainforest to oil palm plantations or coal mining leads orangutans into conflict with humans. Orphans are snatched from their dead mothers and are sold or held illegally as pets. The third and last episode of Primates airs this Sunday at 20.15 BST on BBC One and on BBC iPlayer.Follow Helen on Twitter.",17 May 2020,science
Mars: Mud flows on Red Planet behave like 'boiling toothpaste',"Scientists have made a surprising discovery about Mars by playing with muck in the laboratory. An international team of researchers wondered how volcanoes that spew mud instead of molten rock might look on the Red Planet compared with their counterparts here on Earth. In chamber experiments, simulated Martian mud flows were seen to behave a bit like boiling toothpaste. Under certain conditions, the fluid even began to bounce.The mucky gunge resembled a certain type of lava referred to as ""pahoehoe"", which is observed at Hawaii's famous Kīlauea volcano.The research results could now complicate some investigations at the Red Planet, believes study lead Dr Petr Brož from the Czech Academy of Sciences' Institute of Geophysics.""You'll look at some features [from space] and you won't know for sure whether they are the result of lava flows or mud flows.""Without a geologist on the ground to hit them with a hammer, it will be hard to tell,"" he told BBC News.For a long time, Dr Brož had a sceptical view about mud volcanoes on Mars. The phenomena are well known here on Earth, but he'd actually spent several years trying to disprove an interpretation that large numbers of conical forms on the Red Planet might also be the same thing.Eventually, he came around to the idea, and that led him to wonder how mud - if it really does spew from the ground on Mars - would behave in the extreme cold and low-pressure conditions that persist there. This took him to Dr Manish Patel and his team at the UK's Open University. They have a special chamber that can recreate the Martian environment.It's the kind of set-up in which equipment destined to go on a space agency rover would be tested.  And although ordinarily every effort would be made to keep the chamber spotlessly clean, the researchers soon found themselves tipping experimental muddy fluids down a sandy slope.Under ""Earth conditions"", these muddy mixes behave as you would expect: they're smooth, like gravy poured on to a dinner plate. But under ""Martian conditions"", the mud progresses via a series of ropy and jagged lobes.It all comes down to how the low atmospheric pressure - less than 1% of the Earth's value - makes water rapidly evaporate, boil and ultimately freeze.""The skin on the fluid freezes, but this flow is thick enough that the inside remains fluid,"" explained Dr Patel. ""So the skin will stop the flow for a bit, but then the momentum from the fluid inside breaks through at weak points in the skin, and the flow propagates forward. It's just like pahoehoe, except that's molten rock. But again, it's a cooling skin that forms before hot material bursts through.""The team reports its initial experiments in a paper in the journal Nature Geoscience. Not captured in this publication are subsequent experiments in which the flows were repeated for a ""hot day"" on Mars. There are places where it can get as high as 20C for  short periods. In this scenario, the mud boiled vigorously in the low pressure; ""it was jumping over the surface as if levitating,"" said Dr Brož.The team's work should be a reminder to scientists that when they look at planetary bodies, physical processes can sometimes produce unexpected outcomes, he added.Jonathan.Amos-INTERNET@bbc.co.uk and follow me on Twitter: @BBCAmos",18 May 2020,science
Pollution: Birds 'ingesting hundreds of bits of plastic a day',"Birds living on river banks are ingesting plastic at the rate of hundreds of tiny fragments a day, according to a new study.Scientists say this is the first clear evidence that plastic pollutants in rivers are finding their way into wildlife and moving up the food chain.Pieces of plastic 5mm or smaller (microplastics), including polyester, polypropylene and nylon, are known to pollute rivers. The impacts on wildlife are unclear. Researchers at Cardiff University looked at plastic pollutants found in a bird known as a dipper, which wades or dives into rivers in search of underwater insects.""These iconic birds, the dippers, are ingesting hundreds of pieces of plastic every day,"" said Prof Steve Ormerod of Cardiff University's Water Research Institute. ""They're also feeding this material to their chicks.""Previous research has shown that half of the insects in the rivers of south Wales contain microplastic fragments.""The fact that so many river insects are contaminated makes it inevitable that fish, birds and other predators will pick up these polluted prey - but this is the first time that this type of transfer through food webs has been shown clearly in free-living river animals,"" said co-researcher Dr Joseph D'Souza.The research team examined droppings and regurgitated pellets from dippers living near rivers running from the Brecon Beacons down to the Severn Estuary.They found microplastic fragments in roughly half of 166 samples taken from adults and nestlings, at 14 of 15 sites studied, with the greatest concentrations in urban locations. Most were fibres from textiles or building materials.Calculations suggest dippers are ingesting around 200 tiny fragments of plastic a day from the insects they consume.Previous studies have shown that microplastics are present even in the depths of the ocean and are ending up in the bodies of living organisms, from seals to crabs to seabirds.Rivers are a major route between land and sea for microplastics such as synthetic clothing fibres, tyre dust and other fragmenting plastic waste. The research, published in the journal Global Change Biology, was carried out in collaboration with the Greenpeace Research Laboratories at the University of Exeter.Follow Helen on Twitter.",22 May 2020,science
Covid recovery could 'tip the balance' for nature,"Environmental scientists have called for the conservation of nature to be at the centre of the economic recovery from the coronavirus pandemic.With countries still ensnared by the crisis, scientists have urged governments to make plans that ""safeguard biodiversity and human health"" as they rebuild. The researchers published an open letter in the journal Science.""How we emerge from lockdowns,"" they say, ""will drive a new world economy."" This is likely to have lasting effects on global biodiversity, the Australian authors argue.The right long-term plans, from governments and international organisations, could ""tip the balance"" in favour of nature. There are some striking examples of upheavals that have had unintended benefits for nature. The catastrophic nuclear accident at Chernobyl in Ukraine, and the resulting exclusion zone around the plant, created an unplanned wilderness that has since been designated an ecological reserve. ""The Colombia Conflict, for example, created unofficial protected areas,"" explained Dr Ryan Pearson from Griffith University in Queensland, Australia. ""This slowed environmental degradation because people were fearful of entering remote areas occupied by rebels.""The more recent ""post-conflict"" increase in deforestation there shows the need for longer-term strategies that can maintain the positive side effects of crises.""There have been many reports of wild animals increasing in numbers and turning up in places they haven't been seen i a long time,"" Dr Pearson told BBC News. "" This carries implications that certain species may be benefiting from the absence of human influence during lockdowns or possibly because of reduced pollution, especially in waterways.""We can't be sure how long such effects will last unless long-term strategies are implemented to encourage them.""There is, the scientists say, a concern that the rush to re-stabilise and grow economies may come ""at the expense of the environment"".This group of environmental scientists are adding their voices to a call for a greener focus as the world rebuilds. Dr Pearson added: ""We hope our letter will encourage positive strategies to support biodiversity into legislation, and the behaviour of people in their choices - in their consumption, investment, and travel.""Follow Victoria on Twitter.",21 May 2020,science
Nature: Bumblebees' 'clever trick' fools plants into flowering,"Scientists have discovered a new behaviour among bumblebees that tricks plants into flowering early. Researchers found that when deprived of pollen, bumblebees will nibble on the leaves of flowerless plants. The damage done seems to fool the plant into flowering, sometimes up to 30 days earlier than normal. Writing in the journal Science, the scientists say they have struggled to replicate the bees' trick in the laboratory.With their fuzzy appearance and distinctive drone, bumblebees are hard to miss in gardens all over the world. Their dense, hairy bodies make them excellent pollinators for crops like tomatoes and blueberries.They are among the first bees to emerge each year and work a long season. Some colonies remain active through the winter in southern and urban areas of the UK.But despite their key role, bumblebees, like many other pollinators have seen their numbers tumble in recent decades.One recent study pointed to climate change, reporting that an increasing number of hot days in Europe and North America was boosting local extinction rates. But researchers have now made a discovery about bumblebees that could have relevance to their long-term survival.Scientists in Switzerland found that when the bees were deprived of pollen, they started to nibble on the leaves of plants that hadn't yet flowered.The bees used their proboscises and mandibles (mouthparts) to cut distinctively-shaped holes in the leaves.But the creatures didn't eat the material or use it in their nests.The damaged plants responded by blooming earlier than normal - in some cases up to 30 days ahead of schedule.""I think everything that we've found is consistent with the idea that the bees are damaging the plants and that that's an adaptation that brings flowers online earlier and that benefits the bees,"" said Dr Mark Mescher, one of the authors from ETH Zurich, told BBC News.When the researchers tried to emulate the damage done to the plants by the bumblebees they weren't able to achieve the same results. The bee-damaged plants flowered 30 days earlier than undamaged plants and 25 days earlier than ones damaged by the scientists. The research team believes there may be something else going on here apart from nibbles.""We really tried to replicate with the best of our ability,"" said Prof Consuelo De Moraes, also from ETH Zurich.""It's possible that the bees also have some cue that they are providing to the plants that is specific to the bee.""""And that could be secretions that we don't know about but it's something that we plan to investigate.""The researchers say the damage has a particular pattern that the scientists have learned to recognise, even in the most unlikely places. ""You see these semi-circular sort of incisions, often in the leaf,"" said Dr Mescher. ""One of the students was saying that they were eating a salad the other day, and they saw that kind of damage on the leaf that was probably from a bumblebee.""The researchers say that when pollen is available the bees don't damage plants. They've also found this behaviour is in wild bees.However the team are keeping an open mind on whether the plants might be the ones in the driving seat. It is vital for plants that depend on pollination to have their flowers on display when the pollinators are buzzing around. It could be that some plants have evolved a strategy to push out their flowers when they recognise the bee doing damage to their leaves. Ultimately, though, knowing more about the relationship between bumblebees and flowering might have implications for the resilience of these creatures in the face of a changing environment.""I think it's fascinating how much we still don't know about organisms that we think we know really well,"" said Prof De Moraes.""It absolutely increases our sense of wonder at the cleverness of nature in all its many forms.""Follow Matt on Twitter.",21 May 2020,science
