Nasa SpaceX launch: Astronauts get to work ahead of historic flight,"Nasa astronauts Doug Hurley and Bob Behnken have flown into the Kennedy Space Center in Florida to prepare for their historic mission next week.The pair's trip to the International Space Station (ISS) will be made in a rocket and capsule system provided by a commercial company, SpaceX. Nasa has traditionally always owned and operated its space vehicles.But that is a capability it gave up in 2011 when it retired the last of the space shuttles.The agency now intends to contract out all future crew transportation to low-Earth orbit.  Hurley and Behnken flew into Florida from the agency's human spaceflight headquarters in Texas where they have been in quarantine. They'll continue protecting their health at Kennedy as they get ready for next Wednesday's planned lift-off.Thursday will see teams from SpaceX and Nasa hold a flight readiness review to confirm all preparation activities are good to proceed.The astronauts' rocket, a Falcon-9, and capsule, known as Dragon, will be wheeled out to the spaceport's famous launch pad - complex 39A - shortly for its static fire test. This will see the Falcon ignite briefly all nine of its first-stage engines to check they are fit to go. Hurley and Behnken, together with ground-support staff, will also conduct a ""crew dry dress"" rehearsal.This will involve the men suiting up, riding out to the pad and even climbing into their capsule as a dummy run to ensure everyone understands their role.Of the Dragon, Hurley said: ""It's just an amazing vehicle. It's definitely not the space shuttle. It's much smaller; it's a capsule. It's state-of-the-art from a technology standpoint, and we are so excited to be in a real spaceship and not the simulator here in just a week.""Behnken said the pair felt the weight of history. This is only the fifth time American astronauts will have flown to orbit in a brand new spacecraft design.""We certainly take inspiration from all those who've come before us. Whenever we've had a chance to speak with the astronauts who had those opportunities - the thing they've emphasised is, in the moment, being as prepared and ready for whatever may come your way as possible,"" he told reporters at Kennedy.Next week's launch is key moment in Nasa's strategy to change the way it conducts its space activity. Its commercial crew programme, initiated in 2010, selected both SpaceX and aerospace heavyweight Boeing to develop crew transportation services.The arrangement with the companies means they can also sell seats in their vehicles to other space agencies, companies or indeed wealthy individuals.""We are on the cusp of launching American astronauts on American rockets from American soil yet again,"" explained Nasa Administrator Jim Bridenstine.   ""This time we're doing it differently than we've ever done it before. We are partnering with commercial industry with the intent that they would go get customers that are not Nasa, and drive down our costs and increase the access to space.""For the moment, this model only covers flights to a few hundred kilometres above the Earth, to the ISS. But eventually the aim is to extend the concept to operations in deeper space.In April, Nasa asked three teams to develop ideas for landing its astronauts on the Moon. Again, this would be a service the agency would purchase. Lift-off for Hurley and Behnken next Wednesday is scheduled for 16:33 local time (21:33 BST/20:33 GMT).",21 May 2020,science
Covid recovery could 'tip the balance' for nature,"Environmental scientists have called for the conservation of nature to be at the centre of the economic recovery from the coronavirus pandemic.With countries still ensnared by the crisis, scientists have urged governments to make plans that ""safeguard biodiversity and human health"" as they rebuild. The researchers published an open letter in the journal Science.""How we emerge from lockdowns,"" they say, ""will drive a new world economy."" This is likely to have lasting effects on global biodiversity, the Australian authors argue.The right long-term plans, from governments and international organisations, could ""tip the balance"" in favour of nature. There are some striking examples of upheavals that have had unintended benefits for nature. The catastrophic nuclear accident at Chernobyl in Ukraine, and the resulting exclusion zone around the plant, created an unplanned wilderness that has since been designated an ecological reserve. ""The Colombia Conflict, for example, created unofficial protected areas,"" explained Dr Ryan Pearson from Griffith University in Queensland, Australia. ""This slowed environmental degradation because people were fearful of entering remote areas occupied by rebels.""The more recent ""post-conflict"" increase in deforestation there shows the need for longer-term strategies that can maintain the positive side effects of crises.""There have been many reports of wild animals increasing in numbers and turning up in places they haven't been seen i a long time,"" Dr Pearson told BBC News. "" This carries implications that certain species may be benefiting from the absence of human influence during lockdowns or possibly because of reduced pollution, especially in waterways.""We can't be sure how long such effects will last unless long-term strategies are implemented to encourage them.""There is, the scientists say, a concern that the rush to re-stabilise and grow economies may come ""at the expense of the environment"".This group of environmental scientists are adding their voices to a call for a greener focus as the world rebuilds. Dr Pearson added: ""We hope our letter will encourage positive strategies to support biodiversity into legislation, and the behaviour of people in their choices - in their consumption, investment, and travel.""Follow Victoria on Twitter.",21 May 2020,science
Climate change: Top 10 tips to reduce carbon footprint revealed,"Climate change can still be tackled  but only if people are willing to embrace major shifts in the way we live, a report says.The authors have put together a list of the best ways for people to reduce their carbon footprints.The response to the Covid-19 crisis has shown that the public is willing to accept radical change if they consider it necessary, they explain.And the report adds that government priorities must be re-ordered.Protecting the planet must become the first duty of all decision-makers, the researchers argue.The authors urge the public to contribute by adopting the carbon-cutting measures in the report, which is based on an analysis of 7,000 other studies.Top of the list is living car-free, which saves an average of 2.04 tonnes of CO2 equivalent per person annually. This is followed by driving a battery electric car - 1.95 tonnes of CO2 equivalent per person annually - and taking one less long-haul flight each year - 1.68 tonnes of CO2 equivalent per person.Switching to a vegan diet will help - but less than tackling transport, the research shows.It says popular activities such as recycling are worthwhile, but dont cut emissions by as much.The lead author, Dr Diana Ivanova from Leeds University, told BBC News: We need a complete change of mindset. We have to agree how much carbon we can each emit within the limits of what the planet can bear  then make good lives within those boundaries.The top 10 options are available to us now, without the need for controversial and expensive new technologies. Dr Ivanova said the coronavirus lockdown has shown that many people could live without cars if public transport, walking and cycling were improved.Her research highlights rich people who typically take more flights, drive bigger cars and consume the most. She said: All the world suffers from climate change, but its not the average person who flies regularly  its a small group, yet aviation is under-taxed. Its a moral issue.In her league table, buying renewable power and using public transport rank fourth and fifth.Sixth is insulating your home well, which saves 0.895 tonnes of CO2 equivalent.Seventh is switching to a vegan diet, which saves 0.8 tonnes. Other top actions are using heat pumps; switching from polluting cookstoves (in developing countries) to better methods of cooking, and heating buildings with renewable energy. Dr Ivanova said that if people implemented the measures, it would save around nine tonnes of carbon dioxide equivalent (CO2e) per person per year.Current annual household emissions are around 10 tonnes in the UK, and 17 in the US.The study, out soon in the journal Environmental Research Letters, says the following are worthwhile, but of lesser benefit to the climate: green roofs; using less paper; buying more durable items; turning down the thermostat - and recycling, which saves 0.01 tonnes of CO2 equivalent per year, according to Dr Ivanova.Some of the findings will be questioned. Polls suggest some people think climate is as important as the virus, for instance, but some dont.Professor Tommy Wiedmann from the University of New South Wales in Australia, said: This is a valuable study. But it only looks at the carbon footprint and not at other impacts like water scarcity because of lithium mining for electric car batteries.Libby Peake, from the Green Alliance think tank, told BBC News: People shouldnt stop good habits like recycling, which saves some carbon while preventing waste and conserving resources.  Better design allows people to buy fewer but higher-quality things and to live in buildings with lower carbon footprints. These savings arent necessarily covered by this study. Follow Roger on Twitter.",20 May 2020,science
Climate change: Scientists fear car surge will see CO2 rebound,"Daily global emissions of CO2 fell by 17% at the peak of the shutdown because of measures taken by governments in response to Covid-19, say scientists.The most comprehensive account yet published says that almost half the record decrease was due to fewer car journeys. But the authors are worried that, as people return to work, car use will soar again.They fear CO2 emissions could soon be higher than before the crisis.They are urging politicians to grasp the moment and make real, durable changes on transport and personal mobility.In the UK, Transport Secretary Grant Shapps has pledged 250m for improvements to cycling and walking infrastructure. Other countries are also looking at similar plans.The lockdowns that most governments have implemented in response to Covid-19 have had a significant impact on the carbon-producing activities that are embedded in almost everything we do.Road transport has declined hugely, as has aviation. However, now that the UK is beginning to return to work, Mr Shapps said people should drive to work rather than use public transport, should walking or cycling not be an option.""If you can't walk or cycle but you do have access to a car, please use it rather than travelling by bus, train or tram,"" he said.Industry has temporarily closed down and demand for energy all over the world has crashed. Now in detailed analysis, researchers have shown how those changes have impacted our emissions of CO2.They've calculated the fall off in carbon based on the lockdown policies implemented in 69 countries that between them account for 97% of global emissions.During the peak of the crisis in early April, daily emissions dropped by 17% compared to the previous year, meaning around 17 million tonnes less CO2 were emitted every day.The key to the fall has been cars. Surface transport emissions have declined by 43%, the same amount as the drop from industry and power generation combined. While the aviation slowdown has grabbed headlines for the economic impact, it only accounts for 10% of the decrease during the pandemic. China has been responsible for the biggest drop, followed by the US, Europe and India.If some restrictions on economic activity stay in place worldwide until the end of the year, then global emissions will likely drop by 7%. If pre-pandemic levels of transport and economic activity return by mid-June, the annual fall would be around 4%. But the research team that carried out this work is concerned that the rebound, especially on the roads, could see a carbon surge.Lockdown has raised questions about other pollutants, too. One of the UK's leading experts, Prof Frank Kelly, from King's College London, said he knew diesel cars were emitting far more pollution than advertised - fully two years before US authorities exposed the scandal.He told Radio 4's The Life Scientific programme that his team discovered a huge mismatch between emissions declared by the car firms and real readings on the road.Prof Kelly said he reported it to the Department for Environment, Food and Rural Affairs (Defra), but they didn't publish his findings. He said work undertaken subsequently in the US led to legal action against car makers that had installed ""defeat devices"" to fool regulators.The government didn't deny the account. A spokesperson said: ""We are taking urgent action to improve air quality and our Clean Air Strategy has been commended by the World Health Organization as an 'example for the rest of the world to follow'"".Meanwhile, on the Covid-19 crisis, he said levels of the pollutant NO2 had fallen by up to 60% in London since the fall in traffic under lockdown.Levels of another pollutant, sooty particles, remained at harmful concentrations.""A big worry that people will naturally want to go back to their cars to go to work, and that could rebound the emissions to the same level or even higher than before, once everybody goes back,"" said Prof Corinne Le Qur from the University of East Anglia, who led the analysis.The researchers say that fundamental, systemic change is needed if the emissions curve is to be flattened in a way that would limit the very worst impacts of climate change. When it comes to transportation, there are huge opportunities, according to Prof Le Qur. She says that after the global financial crisis in 2008, some governments like China, US and Germany made significant investments in wind and solar energy and this drove down the prices of these renewables. ""Here now in 2020 we're very close to the same situation in electric mobility,"" she told BBC News.""Battery prices have come down, we have lots of models and governments are going to try to boost their economies.""""So if these two things can align, then it could make a huge difference to the transportation of tomorrow.""Grabbing the opportunity that the virus has presented is also at the forefront of corporate thinking on climate change. A letter signed by 155 major companies, representing $2.4 trillion (1.96 trillion) in market capitalisation, calls for a net-zero emissions response to the covid crisis. Corporations including Carlsberg, Iberdrola, EDF and Coca Cola Europe say they want governments to ""prioritise a faster and fairer transition from a grey to a green economy"".The authors of the latest analysis on carbon emissions agree that now is the moment for action. They point to the fact that while emissions of CO2 may be temporarily reduced, all the while CO2 concentrations are lingering in the atmosphere, warming the planet.It will take a a dramatic shift to change that. ""I think very much that we are at a crossroads. And at this point, like the UK prime minister Boris Johnson said, it could go either way.""""He was talking about his own health, but here we're talking about the health of the planet.""""It could go either way.""The study has been published in the journal Nature Climate Change.Follow Matt on Twitter.",19 May 2020,science
Antarctic algal blooms: 'Green snow' mapped from space,"UK scientists have created the first wide-area maps of microscopic algae growing in coastal Antarctica.Satellite observations were used to count nearly 1,700 patches where large blooms had turned snow cover green.The team says the photosynthesising organisms are an important ""sink"" for pulling carbon dioxide out of the atmosphere.They are also key actors in the cycling of nutrients in what is one the most remote regions on Earth.""These are primary producers at the bottom of a food chain. If there are changes in the algae, it obviously has knock-on effects further up the food chain,"" explained study leader Dr Matt Davey from Cambridge University.""And even though the numbers we're talking about are small on a global scale, on an Antarctic scale they're substantially important,"" the ecologist, who has since joined the Scottish Association for Marine Science in Oban, told BBC News.Detecting the green algae from space was a tricky task. While it's easy to spot the organisms' discolouration when walking in the snow on the ground, from orbit it becomes much harder to tease out the blooms' signal against what is a highly reflective surface.Fortunately for the team, the European Union's Sentinel-2 spacecraft have high-fidelity detectors that are sensitive in just the right part of the light spectrum to make the observation. The study mapped the Antarctic Peninsula, the finger of land which points up from the White Continent towards South America. The blooms are seen predominantly to be on the western side of this feature. Two-thirds were on the many islands that dot the coastline. Totalled, the microscopic algae covered an area of almost 2 sq km. It means they're tying up roughly 500 tonnes of carbon a year. This is equivalent to the amount of carbon that would be emitted by about 875,000 average petrol car journeys in the UK, the team calculates.These numbers are an underestimate because the Sentinel-2 system is only picking up green algae and missing their red and orange counterparts - an issue of the satellite camera detectors' spectral bands not being sensitive at just the right wavelengths for those particular blooms.""It's frustrating because we've shown how to do it on the WorldView-3 spacecraft but its imagery is just too expensive. Sentinel is free,"" explained Dr Andrew Gray, who is affiliated to both Cambridge and the NERC Field Spectroscopy Facility in Edinburgh.The problem would be resolved in time as more open-data satellites were launched, the remote-sensing specialist added. Algal blooms in the Antarctic were first described by expeditions in the 1950s and 1960s. They can look spectacular when they tinge slopes with a broad swathe of colour to contrast the surrounding white. This makes them a popular subject for cruise ship tourists and their cameras.To flourish, the organisms need an available supply of liquid water and that's to be found in snowy areas just above freezing, as opposed to those places of deep cold and ice.The blooms' distribution is also heavily influenced by the proximity of seals, penguins and other Antarctic birds, such as skuas and kelp gulls. The ""poop"" from these creatures is a source of essential nitrogen and other elements. The interesting question is what happens to the blooms as the Antarctic warms. Temperatures on the peninsula rose rapidly in the latter half of the 20th Century, and climate models expect this trend to continue in coming decades.Many of the algal fields on low-lying islands could simply disappear if their snows are completely removed. On the other hand, new opportunities are likely to open up on the mainland, further to the south and at higher elevations.""There are probably many different species of algae, all with quite different niches. Some will live right at the top of the snow surface, others quite a bit deeper - and their numbers will change depending on the temperature,"" observed Prof Alison Smith, a biologist at Cambridge.       ""But we don't know yet whether their numbers will increase or decrease. And if you don't monitor the situation, you'll never know,"" she told BBC News.The study, published in the journal Nature Communications, involved additional team-members from the British Antarctic Survey and Edinburgh University.Jonathan.Amos-INTERNET@bbc.co.uk and follow me on Twitter: @BBCAmos",20 May 2020,science
Climate change: Future floods will delay emergency response,"Future increases in rainfall in England could significantly impact emergency responses, according to a new study.Researchers say that flood conditions could see just 9% of some rural populations reached by an ambulance within the 7-15 minute mandatory timeframe.Older people living in rural areas would be worst affected, the authors say.They say there should be a rethink on ambulance locations in flooding events.Flooding is one of the most devastating impacts of climate change. According to studies, it is likely to increase in the future. The Met Office has indicated that an extended period of extreme rainfall in winter, similar to what was seen in parts of England between 2013 and 2014 is now about seven times more likely because of human-induced climate change. To find out how this changing rainfall might impact on ambulance and fire and rescue services, researchers projected the impacts of floods that might occur once in 30 years, once in 100 years and once in 1,000 years.In England, emergency responders must reach urgent cases within mandatory timeframes, regardless of the weather conditions. In normal conditions, around 84% of England's population can be reached by ambulance in around seven minutes. The researchers found that when a once in 30-year flood event struck, this dropped to 67%. With a once in a 100-year flood, just over half the population would be reachable in seven minutes, while in a once in a 1,000-year flood, only 27% of the total population would see an ambulance inside that time limit.Different locations had different outcomes according to the study. East Riding and Berkshire would see their coverage reduce to 9% and 12% respectively. ""Even the small magnitude floods affect the emergency response,"" said lead author Prof Dapeng Yu from Loughborough University.""Ambulance services have been centralised in recent decades, so in villages or small towns there's no ambulance service, therefore when an incident happens in rural areas, it takes a lot longer for them to reach.""As well as rural areas, large urban centres including London, Birmingham, Liverpool and Newcastle, would also see a reduction in response time under a 30-year flood.Care homes, sheltered accommodation, nurseries and schools would be among the most vulnerable locations with older people in rural areas likely worst-hit, according to the study. The authors say that the day of the Brexit referendum on 23 June in 2016 is a good example of what can happen to the emergency services during surface flooding events. Referendum day was memorable for large-scale surface flooding in many parts of London after torrential rain.Around 450 flooding incidents were attended by the London Fire and Rescue Service, which was three times the number from the previous day.The London fire service target timeframe for reaching incidents is six minutes and on June 23, 59% of journeys were outside that target. ""You don't know when it's going to hit and you don't know how hard it is going to hit,"" said Prof Dapeng Yu.""But when it happens, like in London during the referendum day, it is really striking.""""It really shows the impacts, you will receive three times more calls than normal and your ability to reach them in six minutes is massively compromised.""The authors say that their study shows that the emergency services are particularly sensitive to the expected impacts of future increases in rainfall. The impacts would be greater with surface flooding events rather than with river or coastal flooding.Preventing unnecessary delays in the future will require planners to identify hotspots of vulnerability and to re-think the distribution of ambulances and fire stations. ""With climate change, flooding will likely become more frequent and more intense,""said Prof Dapeng Yu.""So certainly, when the authorities consider the strategic plan for new ambulance stations or fire stations, they need to consider this factor.""The study has been published in the journal Nature Sustainability.Follow Matt on Twitter.",18 May 2020,science
