Nasa SpaceX crew mission cleared to launch,"Key officials at the American space agency (Nasa) and private launch firm SpaceX have signed off next week's historic mission to the space station.Astronauts Doug Hurley and Bob Behnken will ride to orbit from Florida - the first time in nine years that humans have left Earth from US territory.A review panel has found no technical reason to delay the mission.SpaceX's Falcon-9 rocket with its Dragon capsule is set to lift off at 16:33 EDT (21:33 BST) on Wednesday.The decision of the Flight Readiness Review (FRR) panel opens the way for final launch preparations to proceed.""We did a thorough review of all the systems and all the risks, and it was unanimous on the board that we are 'go for launch',"" said Stephen Jurczyk, Nasa's associate administrator, who chaired the FRR.Already, the Falcon has been rolled out to the Kennedy Space Center's Launch Complex 39A, and lifted into the vertical.The transfer on Thursday allowed SpaceX engineers to conduct a static fire on Friday. This saw the vehicle ignite briefly all nine of its engines to confirm their operational status.Clamps held the booster to prevent it moving in the test.Another important pre-launch moment occurs on Saturday with the ""Crew Dry Dress"". This involves Hurley and Behnken getting into their spacesuits and rehearsing all the actions they must take next Wednesday, including strapping themselves into the Dragon capsule. The attention to detail is all about making this mission as safe as possible.""Our teams are scouring and thinking of every single risk that's out there, and we've worked our butt off to buy down the ones we know of. And we'll continue to look and continue to buy them down until we bring [Hurley and Behnken] home,"" said Kathy Lueders, who manages Nasa's Commercial Crew Program. There is huge focus on this mission. Not since the retirement of the space shuttles in 2011 has America been able to launch its own astronauts to the space station - a task that has rested solely with Russia and its Soyuz rocket and capsule system.Nasa's Commercial Crew Program, initiated just prior to the end days of the famous winged orbiters, sought to incentivise a new human transportation industry in the US.The agency proposed to purchase launch services off private companies and gave them seed money to help develop their hardware.SpaceX, run by the tech entrepreneur Elon Musk, is the first of the commercial operators to deliver a working system. The aerospace giant Boeing is some way behind in its progress, but should eventually match the SpaceX milestones.For Nasa, this approach of contracting out astronaut transportation to low-Earth orbit has saved it many billions of dollars. The old way of doing things, which required the agency to purchase, own and operate its space vehicles, proved to be very expensive.From now on, Nasa will simply buy seats in what are essentially private taxi services. Cash that's freed up can then be diverted to more complex endeavours such as preparing to take astronauts back to the Moon and on to Mars.   ""It's been estimated that this programme overall will have saved Nasa maybe $30bn-40bn at least,"" observed Benji Reed, director of crew mission management at SpaceX.  ""Firm, fixed-price contracts and the kind of truly open partnership where we work together allows that kind of saving to happen and that kind of ability to allow Nasa to invest in more things and do other programmes.""Jonathan.Amos-INTERNET@bbc.co.uk and follow me on Twitter: @BBCAmos",22 May 2020,science
Nasa SpaceX launch: Who are the astronauts?,"On 27 May, two US astronauts will achieve a world first when they launch to the International Space Station (ISS) aboard a spacecraft built by Elon Musk's SpaceX. Here, BBC News profiles the astronauts who will make the historic journey.Doug Hurley and Bob Behnken are about to break a nine-year hiatus for Nasa, becoming the first astronauts to launch from US soil since the retirement of the space shuttle in 2011. In the intervening years, Nasa bought seats for its astronauts - at a cost of tens of millions of dollars per flight - on the Russian Soyuz.But officials have also worked with Elon Musk's company SpaceX and aerospace giant Boeing to develop new, American spacecraft capable of ferrying humans to and from the ISS - under the space agency's Commercial Crew Program.Musk's vehicle will be first to fly; on Wednesday, Hurley and Behnken will travel to the ISS in the sleek Crew Dragon spacecraft.""It's well past time to be launching an American rocket from the Florida coast to the International Space Station and I am certainly honoured to be a part of it,"" Hurley, 53, said earlier this month.Behnken, 49, added: ""On my first flight... I didn't have a son, so I'm really excited to share the mission with him.""Nasa has chosen two of its most experienced astronauts to help California-based SpaceX ready the Crew Dragon for launch. The two are also longstanding friends.""Being lucky enough to fly with your best friend... I think there's a lot of people who wish they could do that,"" says Hurley.When they blast off atop a Falcon 9 rocket, their spouses will know exactly what they are going through. That's because they're astronauts too.Marine Colonel Hurley's wife Karen Nyberg flew into space twice - aboard the shuttle and the Soyuz - retiring from Nasa this year. They have a 10-year-old son, Jack, whose formative years were shaped by space travel.Nyberg began training for a six-month space station mission just a few months after Jack's birth. In the meantime, Hurley was preparing for his own flight - piloting the last ever shuttle mission. Sometimes, Nyberg took Jack to Russia, at other times he stayed at home in Texas.""Literally from the time Jack was old enough to comprehend things, he was either going to Russia or Skyping with mommy. That's just the way it was,"" Hurley told the Houston Chronicle in 2013.Air Force Colonel Behnken is married to Megan McArthur, who flew on the last mission to service the Hubble Space Telescope in 2009. As an active member of the astronaut corps, she is a potential candidate to be the first woman on the Moon when Nasa returns in 2024. Their son, Theo, is six.Hurley, Behnken, Nyberg and McArthur all graduated from the same astronaut class (2000) and attended each other's weddings. The men are so used to each other's company, they now have a spooky rapport.They ""can predict - almost by body language - what the person's opinion is or what their next action is going to be,"" Behnken told CNN earlier this month. ""We've just been doing this so long that it's kind of like having a second set of hands.""Hurley says of Behnken: ""I know instantaneously when I've not done something correctly - just put it that way. He doesn't have a good poker face."" But Behnken admits Hurley is the more organised of the two.The older of the two men was raised in the hamlet of Apalachin, in upstate New York. ""It was just a great small town existence... we didn't get a stoplight until I was, I think, in college,"" Hurley said in 2009.Behnken hails from  St Ann, a suburb of St Louis, Missouri. In 2010, he described it as ""a blue collar kind of a neighbourhood"", adding: ""I guess, in my bag of tricks... I'm more of a working class sort of a person.""He took jobs in construction before deciding that working outdoors in the summer heat wasn't for him. Both men went to college on military scholarships and gained undergraduate degrees in engineering. While Behnken went on to complete a PhD at Caltech - the elite institute featured in the Big Bang Theory television show - Hurley became an officer in the Marines.They both subsequently trained as military test pilots - at different training schools. It's been the archetypal background for Nasa's astronauts since the days of its first intake - the Mercury Seven.""When I showed up [at Nasa] it was like: 'Well, I have a PhD and an MD,' and I'm sitting there going, 'Mmm, wow! Maybe I was a bit of a slacker',"" said Hurley. ""But you know, your professional development as a pilot and the thousands of hours you get as a pilot... brings something to the table.""Hurley and Behnken were selected as astronaut candidates three years before the shuttle Columbia broke up on re-entry, killing seven crew members. After the disaster, Nasa decided it would retire the shuttle, handing over space station transport to private firms.Thus, when the two men were finally assigned their flights, the shuttle programme was in its final phase. Their missions focused on fulfilling Nasa's prior commitments to complete construction of the ISS, including the delivery of crew compartments designed to fit in the shuttle's payload bay.When the spaceplane was retired, the pair were assigned to the Commercial Crew Program. In August 2018, Hurley and Behnken were announced as the prime crew for Demo-2, the first flight of SpaceX's vehicle with humans onboard.""Bob and I, the last two years, have essentially been living in California, working hand-in-hand with the folks at SpaceX to get us to this point,"" Hurley said this month.They've had to get used to the Crew Dragon's touchscreen controls after previously working with the chunky buttons on shuttle instrument panels.Hurley says a background in evaluating military aircraft as test pilots proved crucial in their work with SpaceX.""That, in and of itself, helped both of us tremendously, because all along the process that you see in the military, there are delays, there are technical challenges, there are things that you don't expect and you have to work through them,"" he explained.Setbacks - including two spectacular explosions that destroyed a rocket and one of the Crew Dragon capsules - have seen the mission slip by nearly four years from its original date of October 2016. ""We were well-prepared for that part of it, when I think it caused some frustration within Nasa as launch dates weren't made,"" explained Hurley.Despite bumps in the road, Behnken's enthusiasm remains undimmed: ""It's probably the dream of every test pilot school student to have the opportunity to fly on a brand new spaceship.""Hurley told CNN: ""From a first flight standpoint, certainly, there might be some greater quantifiable risk to some degree.""But probably no different to any other spaceflight we've flown humans on before.""Follow Paul on Twitter.",24 May 2020,science
Pollution: Birds 'ingesting hundreds of bits of plastic a day',"Birds living on river banks are ingesting plastic at the rate of hundreds of tiny fragments a day, according to a new study.Scientists say this is the first clear evidence that plastic pollutants in rivers are finding their way into wildlife and moving up the food chain.Pieces of plastic 5mm or smaller (microplastics), including polyester, polypropylene and nylon, are known to pollute rivers. The impacts on wildlife are unclear. Researchers at Cardiff University looked at plastic pollutants found in a bird known as a dipper, which wades or dives into rivers in search of underwater insects.""These iconic birds, the dippers, are ingesting hundreds of pieces of plastic every day,"" said Prof Steve Ormerod of Cardiff University's Water Research Institute. ""They're also feeding this material to their chicks.""Previous research has shown that half of the insects in the rivers of south Wales contain microplastic fragments.""The fact that so many river insects are contaminated makes it inevitable that fish, birds and other predators will pick up these polluted prey - but this is the first time that this type of transfer through food webs has been shown clearly in free-living river animals,"" said co-researcher Dr Joseph D'Souza.The research team examined droppings and regurgitated pellets from dippers living near rivers running from the Brecon Beacons down to the Severn Estuary.They found microplastic fragments in roughly half of 166 samples taken from adults and nestlings, at 14 of 15 sites studied, with the greatest concentrations in urban locations. Most were fibres from textiles or building materials.Calculations suggest dippers are ingesting around 200 tiny fragments of plastic a day from the insects they consume.Previous studies have shown that microplastics are present even in the depths of the ocean and are ending up in the bodies of living organisms, from seals to crabs to seabirds.Rivers are a major route between land and sea for microplastics such as synthetic clothing fibres, tyre dust and other fragmenting plastic waste. The research, published in the journal Global Change Biology, was carried out in collaboration with the Greenpeace Research Laboratories at the University of Exeter.Follow Helen on Twitter.",22 May 2020,science
Pollution: Birds 'ingesting hundreds of bits of plastic a day',"Birds living on river banks are ingesting plastic at the rate of hundreds of tiny fragments a day, according to a new study.Scientists say this is the first clear evidence that plastic pollutants in rivers are finding their way into wildlife and moving up the food chain.Pieces of plastic 5mm or smaller (microplastics), including polyester, polypropylene and nylon, are known to pollute rivers. The impacts on wildlife are unclear. Researchers at Cardiff University looked at plastic pollutants found in a bird known as a dipper, which wades or dives into rivers in search of underwater insects.""These iconic birds, the dippers, are ingesting hundreds of pieces of plastic every day,"" said Prof Steve Ormerod of Cardiff University's Water Research Institute. ""They're also feeding this material to their chicks.""Previous research has shown that half of the insects in the rivers of south Wales contain microplastic fragments.""The fact that so many river insects are contaminated makes it inevitable that fish, birds and other predators will pick up these polluted prey - but this is the first time that this type of transfer through food webs has been shown clearly in free-living river animals,"" said co-researcher Dr Joseph D'Souza.The research team examined droppings and regurgitated pellets from dippers living near rivers running from the Brecon Beacons down to the Severn Estuary.They found microplastic fragments in roughly half of 166 samples taken from adults and nestlings, at 14 of 15 sites studied, with the greatest concentrations in urban locations. Most were fibres from textiles or building materials.Calculations suggest dippers are ingesting around 200 tiny fragments of plastic a day from the insects they consume.Previous studies have shown that microplastics are present even in the depths of the ocean and are ending up in the bodies of living organisms, from seals to crabs to seabirds.Rivers are a major route between land and sea for microplastics such as synthetic clothing fibres, tyre dust and other fragmenting plastic waste. The research, published in the journal Global Change Biology, was carried out in collaboration with the Greenpeace Research Laboratories at the University of Exeter.Follow Helen on Twitter.",22 May 2020,science
Nasa SpaceX launch: 10 questions about the mission,"Elon Musk's company SpaceX is about to launch its space vehicle - the Crew Dragon - with astronauts onboard for the first time. Here, we answer some common questions about the mission.Nasa has been planning to hand over the transport of crew to the International Space Station (ISS) since the early 2000s. After the Columbia space shuttle broke up during its return to Earth in 2003, the space agency focused on developing a replacement spaceship that could travel to the Moon. Involving private firms in the transfer of crew and cargo to the ISS was a necessary step to afford that programme. In 2014, entrepreneur Elon Musk's company SpaceX and aerospace giant Boeing were announced as winners of a Nasa contract for crew transport services. SpaceX is launching its spacecraft first; the Crew Dragon spacecraft will lift off on Wednesday atop a Falcon 9 rocket from Florida's Kennedy Space Center.SpaceX is an American company that provides commercial and government launch services on its Falcon 9 and Falcon Heavy rockets. Entrepreneur Elon Musk founded the company in 2002, with the goal of reducing space transportation costs, enabling the colonisation of Mars. SpaceX was the first private company to routinely return rocket stages to Earth under propulsive power so they could be re-flown rather than being discarded. It has been conducting regular flights of cargo to the ISS, and will now aim to begin launching astronauts. Musk's company is also developing a bigger spacecraft to carry humans - called Starship - which could begin the process of settling Mars.Born in South Africa, Elon Musk made more than $160m from the sale of online payment service PayPal to eBay. His desire to see humanity become a true space-faring civilisation was a driving factor behind the founding of SpaceX. But he has also been involved in founding a variety of other companies such as the electric car manufacturer Tesla. He also conceived a project called Hyperloop, a high-speed transportation system using pods that travel through a system of tubes. His colourful personality and lifestyle made him the inspiration for Robert Downey Jr's interpretation of Marvel Comics character Tony Stark. Musk is no stranger to controversy: his tweets have triggered lawsuits and led to him being forced out as the chairman of Tesla (though he remained as CEO).Since the retirement of the space shuttle in 2011, Nasa has been paying Russia tens of millions of dollars to launch its astronauts on the Soyuz spacecraft. The Crew Dragon launch from Florida marks the first launch of humans from US soil in nine years. As such, it is seen as crucial for restoring American prestige in human spaceflight. This will also be the first time a private company has launched astronauts into orbit.The Crew Dragon is the spacecraft that will transport astronauts to the ISS on Wednesday. It is a sleek evolution of the Dragon spacecraft which was built to ferry cargo to the orbiting outpost. The Crew Dragon is designed to carry a maximum of seven passengers, but Nasa flights will carry four, with the rest of the space taken up by supplies. It is equipped with thrusters that enable it to manoeuvre in space and will dock - or attach - to the space station under autonomous control. Unlike previous spacecraft designed for humans, the crew cabin features touchscreen controls in place of physical buttons.Bob Behnken and Doug Hurley are Nasa astronauts. They were selected in 2000 and have each flown to space twice on the space shuttle. They are among the most experienced members of Nasa's astronaut corps and both trained as test pilots - which has been critical for putting the new spacecraft through its paces. Hurley has spent a total of 28 days and 11 hours in space, while Behnken has accumulated a total of 29 days and 12 hours, including 37 hours of spacewalking time. Both men are also married to astronauts.Spacecraft designed to carry astronauts have to go through a process that ensures they can operate safely. This launch is essentially the final step in that validation process. Once in orbit, Behnken and Hurley will test the Crew Dragon's environmental control system, the displays and controls and the manoeuvring thrusters. They will monitor the autonomous docking system during the approach to the space station and will become members of the ISS crew. At the orbiting outpost, they will continue performing tests on the Crew Dragon along with other tasks related to the space station. When it's time to return to Earth, the Crew Dragon will parachute down into the Atlantic Ocean. The capsule and crew will then be recovered by a ship called Go Navigator.The Crew Dragon has a built-in abort system, designed to save the lives of its crew in the event of an emergency. If there's a problem during lift-off, such as a rocket engine cut-off, the Crew Dragon will fire engines to propel the vehicle and its occupants free of the rocket. The capsule will then parachute down to safety. SpaceX successfully conducted a test of its in-flight abort system on 19 January 2020.The flight suits that Behnken and Hurley will wear in the capsule look very different to previous designs. In stark contrast to the bulky pumpkin-coloured suits and round helmets familiar from the space shuttle era, SpaceX's suits are slimline, white, one-piece numbers with sleek, 3D-printed helmets. Each one is custom made for the astronaut. If they look like something from a science fiction movie, that's probably because their look was devised by Hollywood costume designer Jose Fernandez, who has worked on the Batman, X-Men and Thor movies. But the suits also have to be practical; they're designed to keep the crew alive in the event of a cabin depressurisation - where the air is lost from the inside of the spacecraft.If the Crew Dragon Demo-2 mission is successful, SpaceX will proceed with the six ""operational"" missions to the ISS they are required to fly under their $2.6bn contract with Nasa. Boeing holds a similar deal, worth $4.2bn, to transport crew to the space station using its CST-100 Starliner vehicle.Follow Paul on Twitter.",23 May 2020,science
Nasa SpaceX launch: What's the mission plan?,"On Wednesday, the California company SpaceX will launch a mission to the International Space Station (ISS). It's something the firm has done many times before, taking cargo to the sky-high laboratory. But on this occasion, the firm will be transporting people.It's one of those seminal moments in the history of spaceflight.When Nasa astronauts Doug Hurley and Bob Behnken lift off atop their Falcon-9 rocket, inside their Crew Dragon capsule, it will mark the first time humans have left US territory to reach low-Earth orbit in almost nine years. But more than that, it sees a shift to the commercialisation of human space transportation - of companies selling ""taxi"" rides to government and anyone else who wants to purchase the service.  This page details the key phases in the mission sequence.Launch will occur from the Kennedy Space Center's Complex 39A. This is the famous Florida pad from where the Apollo 11 moonwalkers and the very first shuttle, Columbia, also began their missions.Timing is precise. The Falcon must leave the ground at 16:33 EDT (20:33 GMT / 21:33 BST), or the astronauts won't be able to catch the ISS which passes overhead at 27,000km/h (17,000mph). Falcon-9 is a two-stage rocket. Its lower-segment will fire for 2.5 minutes before shutting down and separating. This will leave the second stage to burn for a further six minutes to get Dragon into orbit. Once detached, the capsule will then make the rest of the journey to the ISS using its own thrusters.The second stage of the rocket will be commanded to burn up in the atmosphere. The lower-segment of the booster aims to touch down on a drone ship in the Atlantic. This is a SpaceX speciality that sets its Falcon apart from all other orbital rockets in use today.It seems remarkable but Nasa astronauts have not had the use of a brand new spaceship design for 39 years. Not since John Young and Bob Crippen climbed aboard the Columbia orbiter. Their shuttle had dials, switches and a control stick. Dragon is all touchscreen. It's an automated vessel so it plots a path to ISS by itself, but Hurley and Behnken must practise manual flying in case there is some sort of anomaly.Dragon Capsule was conceived to handle every imagined scenario, including a failure of the rocket on the pad or in flight. If this happens, the ship will use a powerful in-built propulsion system to push itself to a safe distance. SpaceX has rehearsed this possibility both on the ground and in mid-air.This mission should see Dragon reach the ISS after about 19 hours of flight. The capsule will line itself up with the bow of the space station and approach at a relative speed of just a few centimetres per second. Once attached, hooks make an airtight seal.The length of Hurley's and Behnken's stay aboard the 420km-high ISS is not yet fixed. It should be more than a couple of months but is unlikely to be longer than 120 days. Engineers say the solar cells on the Dragon degrade in orbit and so Nasa is sure to bring the crewmen home well before the hardware's performance is compromised.The descent to Earth won't be rushed. The astronauts plan a two-day free flight to further test onboard systems and procedures. When the de-orbit burn is eventually called, Dragon will be protected in its fall through the atmosphere by a heat shield. Four big parachutes will slow the spacecraft to a gentle splashdown in the Atlantic, just off the American coastline.SpaceX teams have gone over the process of retrieving the capsule many times.Jonathan.Amos-INTERNET@bbc.co.uk and follow me on Twitter: @BBCAmos",24 May 2020,science
