Nasa SpaceX crew mission cleared to launch,"Key officials at the American space agency (Nasa) and private launch firm SpaceX have signed off next week's historic mission to the space station.Astronauts Doug Hurley and Bob Behnken will ride to orbit from Florida - the first time in nine years that humans have left Earth from US territory.A review panel has found no technical reason to delay the mission.SpaceX's Falcon-9 rocket with its Dragon capsule is set to lift off at 16:33 EDT (21:33 BST) on Wednesday.The decision of the Flight Readiness Review (FRR) panel opens the way for final launch preparations to proceed.""We did a thorough review of all the systems and all the risks, and it was unanimous on the board that we are 'go for launch',"" said Stephen Jurczyk, Nasa's associate administrator, who chaired the FRR.Already, the Falcon has been rolled out to the Kennedy Space Center's Launch Complex 39A, and lifted into the vertical.The transfer on Thursday allowed SpaceX engineers to conduct a static fire on Friday. This saw the vehicle ignite briefly all nine of its engines to confirm their operational status.Clamps held the booster to prevent it moving in the test.Another important pre-launch moment occurs on Saturday with the ""Crew Dry Dress"". This involves Hurley and Behnken getting into their spacesuits and rehearsing all the actions they must take next Wednesday, including strapping themselves into the Dragon capsule. The attention to detail is all about making this mission as safe as possible.""Our teams are scouring and thinking of every single risk that's out there, and we've worked our butt off to buy down the ones we know of. And we'll continue to look and continue to buy them down until we bring [Hurley and Behnken] home,"" said Kathy Lueders, who manages Nasa's Commercial Crew Program. There is huge focus on this mission. Not since the retirement of the space shuttles in 2011 has America been able to launch its own astronauts to the space station - a task that has rested solely with Russia and its Soyuz rocket and capsule system.Nasa's Commercial Crew Program, initiated just prior to the end days of the famous winged orbiters, sought to incentivise a new human transportation industry in the US.The agency proposed to purchase launch services off private companies and gave them seed money to help develop their hardware.SpaceX, run by the tech entrepreneur Elon Musk, is the first of the commercial operators to deliver a working system. The aerospace giant Boeing is some way behind in its progress, but should eventually match the SpaceX milestones.For Nasa, this approach of contracting out astronaut transportation to low-Earth orbit has saved it many billions of dollars. The old way of doing things, which required the agency to purchase, own and operate its space vehicles, proved to be very expensive.From now on, Nasa will simply buy seats in what are essentially private taxi services. Cash that's freed up can then be diverted to more complex endeavours such as preparing to take astronauts back to the Moon and on to Mars.   ""It's been estimated that this programme overall will have saved Nasa maybe $30bn-40bn at least,"" observed Benji Reed, director of crew mission management at SpaceX.  ""Firm, fixed-price contracts and the kind of truly open partnership where we work together allows that kind of saving to happen and that kind of ability to allow Nasa to invest in more things and do other programmes.""Jonathan.Amos-INTERNET@bbc.co.uk and follow me on Twitter: @BBCAmos",22 May 2020,science
Nasa SpaceX launch: Who are the astronauts?,"On 27 May, two US astronauts will achieve a world first when they launch to the International Space Station (ISS) aboard a spacecraft built by Elon Musk's SpaceX. Here, BBC News profiles the astronauts who will make the historic journey.Doug Hurley and Bob Behnken are about to break a nine-year hiatus for Nasa, becoming the first astronauts to launch from US soil since the retirement of the space shuttle in 2011. In the intervening years, Nasa bought seats for its astronauts - at a cost of tens of millions of dollars per flight - on the Russian Soyuz.But officials have also worked with Elon Musk's company SpaceX and aerospace giant Boeing to develop new, American spacecraft capable of ferrying humans to and from the ISS - under the space agency's Commercial Crew Program.Musk's vehicle will be first to fly; on Wednesday, Hurley and Behnken will travel to the ISS in the sleek Crew Dragon spacecraft.""It's well past time to be launching an American rocket from the Florida coast to the International Space Station and I am certainly honoured to be a part of it,"" Hurley, 53, said earlier this month.Behnken, 49, added: ""On my first flight... I didn't have a son, so I'm really excited to share the mission with him.""Nasa has chosen two of its most experienced astronauts to help California-based SpaceX ready the Crew Dragon for launch. The two are also longstanding friends.""Being lucky enough to fly with your best friend... I think there's a lot of people who wish they could do that,"" says Hurley.When they blast off atop a Falcon 9 rocket, their spouses will know exactly what they are going through. That's because they're astronauts too.Marine Colonel Hurley's wife Karen Nyberg flew into space twice - aboard the shuttle and the Soyuz - retiring from Nasa this year. They have a 10-year-old son, Jack, whose formative years were shaped by space travel.Nyberg began training for a six-month space station mission just a few months after Jack's birth. In the meantime, Hurley was preparing for his own flight - piloting the last ever shuttle mission. Sometimes, Nyberg took Jack to Russia, at other times he stayed at home in Texas.""Literally from the time Jack was old enough to comprehend things, he was either going to Russia or Skyping with mommy. That's just the way it was,"" Hurley told the Houston Chronicle in 2013.Air Force Colonel Behnken is married to Megan McArthur, who flew on the last mission to service the Hubble Space Telescope in 2009. As an active member of the astronaut corps, she is a potential candidate to be the first woman on the Moon when Nasa returns in 2024. Their son, Theo, is six.Hurley, Behnken, Nyberg and McArthur all graduated from the same astronaut class (2000) and attended each other's weddings. The men are so used to each other's company, they now have a spooky rapport.They ""can predict - almost by body language - what the person's opinion is or what their next action is going to be,"" Behnken told CNN earlier this month. ""We've just been doing this so long that it's kind of like having a second set of hands.""Hurley says of Behnken: ""I know instantaneously when I've not done something correctly - just put it that way. He doesn't have a good poker face."" But Behnken admits Hurley is the more organised of the two.The older of the two men was raised in the hamlet of Apalachin, in upstate New York. ""It was just a great small town existence... we didn't get a stoplight until I was, I think, in college,"" Hurley said in 2009.Behnken hails from  St Ann, a suburb of St Louis, Missouri. In 2010, he described it as ""a blue collar kind of a neighbourhood"", adding: ""I guess, in my bag of tricks... I'm more of a working class sort of a person.""He took jobs in construction before deciding that working outdoors in the summer heat wasn't for him. Both men went to college on military scholarships and gained undergraduate degrees in engineering. While Behnken went on to complete a PhD at Caltech - the elite institute featured in the Big Bang Theory television show - Hurley became an officer in the Marines.They both subsequently trained as military test pilots - at different training schools. It's been the archetypal background for Nasa's astronauts since the days of its first intake - the Mercury Seven.""When I showed up [at Nasa] it was like: 'Well, I have a PhD and an MD,' and I'm sitting there going, 'Mmm, wow! Maybe I was a bit of a slacker',"" said Hurley. ""But you know, your professional development as a pilot and the thousands of hours you get as a pilot... brings something to the table.""Hurley and Behnken were selected as astronaut candidates three years before the shuttle Columbia broke up on re-entry, killing seven crew members. After the disaster, Nasa decided it would retire the shuttle, handing over space station transport to private firms.Thus, when the two men were finally assigned their flights, the shuttle programme was in its final phase. Their missions focused on fulfilling Nasa's prior commitments to complete construction of the ISS, including the delivery of crew compartments designed to fit in the shuttle's payload bay.When the spaceplane was retired, the pair were assigned to the Commercial Crew Program. In August 2018, Hurley and Behnken were announced as the prime crew for Demo-2, the first flight of SpaceX's vehicle with humans onboard.""Bob and I, the last two years, have essentially been living in California, working hand-in-hand with the folks at SpaceX to get us to this point,"" Hurley said this month.They've had to get used to the Crew Dragon's touchscreen controls after previously working with the chunky buttons on shuttle instrument panels.Hurley says a background in evaluating military aircraft as test pilots proved crucial in their work with SpaceX.""That, in and of itself, helped both of us tremendously, because all along the process that you see in the military, there are delays, there are technical challenges, there are things that you don't expect and you have to work through them,"" he explained.Setbacks - including two spectacular explosions that destroyed a rocket and one of the Crew Dragon capsules - have seen the mission slip by nearly four years from its original date of October 2016. ""We were well-prepared for that part of it, when I think it caused some frustration within Nasa as launch dates weren't made,"" explained Hurley.Despite bumps in the road, Behnken's enthusiasm remains undimmed: ""It's probably the dream of every test pilot school student to have the opportunity to fly on a brand new spaceship.""Hurley told CNN: ""From a first flight standpoint, certainly, there might be some greater quantifiable risk to some degree.""But probably no different to any other spaceflight we've flown humans on before.""Follow Paul on Twitter.",24 May 2020,science
Pollution: Birds 'ingesting hundreds of bits of plastic a day',"Birds living on river banks are ingesting plastic at the rate of hundreds of tiny fragments a day, according to a new study.Scientists say this is the first clear evidence that plastic pollutants in rivers are finding their way into wildlife and moving up the food chain.Pieces of plastic 5mm or smaller (microplastics), including polyester, polypropylene and nylon, are known to pollute rivers. The impacts on wildlife are unclear. Researchers at Cardiff University looked at plastic pollutants found in a bird known as a dipper, which wades or dives into rivers in search of underwater insects.""These iconic birds, the dippers, are ingesting hundreds of pieces of plastic every day,"" said Prof Steve Ormerod of Cardiff University's Water Research Institute. ""They're also feeding this material to their chicks.""Previous research has shown that half of the insects in the rivers of south Wales contain microplastic fragments.""The fact that so many river insects are contaminated makes it inevitable that fish, birds and other predators will pick up these polluted prey - but this is the first time that this type of transfer through food webs has been shown clearly in free-living river animals,"" said co-researcher Dr Joseph D'Souza.The research team examined droppings and regurgitated pellets from dippers living near rivers running from the Brecon Beacons down to the Severn Estuary.They found microplastic fragments in roughly half of 166 samples taken from adults and nestlings, at 14 of 15 sites studied, with the greatest concentrations in urban locations. Most were fibres from textiles or building materials.Calculations suggest dippers are ingesting around 200 tiny fragments of plastic a day from the insects they consume.Previous studies have shown that microplastics are present even in the depths of the ocean and are ending up in the bodies of living organisms, from seals to crabs to seabirds.Rivers are a major route between land and sea for microplastics such as synthetic clothing fibres, tyre dust and other fragmenting plastic waste. The research, published in the journal Global Change Biology, was carried out in collaboration with the Greenpeace Research Laboratories at the University of Exeter.Follow Helen on Twitter.",22 May 2020,science
Nasa SpaceX launch: Astronauts complete rehearsal for historic mission,"Nasa astronauts Doug Hurley and Bob Behnken have completed their dress rehearsal for Wednesday's flight to the International Space Station.The mission, the first crewed outing from American soil in nine years, will see the pair ride to orbit in a SpaceX Falcon rocket and Crew Dragon capsule.It's a demonstration of the new ""taxi"" service the US space agency will be buying from the Californian firm.Lift-off on Wednesday is timed for 16:33 EDT (20:33 GMT / 21:33 BST).The weather around the Kennedy Space Center in Florida may have other ideas, however. A forecast released on Saturday by the US Air Force 45th Weather Squadron predicted just a 40% chance of favourable conditions come launch time.There is a strong possibility the Kennedy complex could see thick cloud, rain and even thunder.If controllers are forced to scrub, everyone will come back on Saturday for a second try.Hurley and Behnken are now all but done with their preparations. The weekend ""Dry Dress"" rehearsal saw the pair don their made-to-measure spacesuits, walk out to a Tesla, and then make a 6km drive down to Kennedy's famous Launch Complex 39A.Their SpaceX Falcon-9 rocket has been sitting erect on the pad since Thursday.The men then got in the service tower lift to go up to the access arm gantry and climb into the capsule.The run-through gave all launch personnel - not just Hurley and Behnken - the opportunity to remind themselves of what's to come.There is huge focus on this mission. Not since the space shuttles were retired in 2011 has America been able to launch its own astronauts. Getting crews to the ISS these past nine years has been a task entrusted solely to Russia and its Soyuz rocket and capsule system.Nasa has contracted both SpaceX and aerospace giant Boeing to pick up where the shuttles left off.The difference this time is that the agency will not own and operate the vehicles. It will merely be buying ""tickets to ride"". SpaceX and Boeing will be free to sell their services to other space agencies, other companies and even individuals.Hurley and Behnken have named their Dragon in the tradition of all previous American crewships. They'll reveal that name on Wednesday.Jonathan.Amos-INTERNET@bbc.co.uk and follow me on Twitter: @BBCAmos",24 May 2020,science
Nasa SpaceX crew mission cleared to launch,"Key officials at the American space agency (Nasa) and private launch firm SpaceX have signed off next week's historic mission to the space station.Astronauts Doug Hurley and Bob Behnken will ride to orbit from Florida - the first time in nine years that humans have left Earth from US territory.A review panel has found no technical reason to delay the mission.SpaceX's Falcon-9 rocket with its Dragon capsule is set to lift off at 16:33 EDT (21:33 BST) on Wednesday.The decision of the Flight Readiness Review (FRR) panel opens the way for final launch preparations to proceed.""We did a thorough review of all the systems and all the risks, and it was unanimous on the board that we are 'go for launch',"" said Stephen Jurczyk, Nasa's associate administrator, who chaired the FRR.Already, the Falcon has been rolled out to the Kennedy Space Center's Launch Complex 39A, and lifted into the vertical.The transfer on Thursday allowed SpaceX engineers to conduct a static fire on Friday. This saw the vehicle ignite briefly all nine of its engines to confirm their operational status.Clamps held the booster to prevent it moving in the test.Another important pre-launch moment occurs on Saturday with the ""Crew Dry Dress"". This involves Hurley and Behnken getting into their spacesuits and rehearsing all the actions they must take next Wednesday, including strapping themselves into the Dragon capsule. The attention to detail is all about making this mission as safe as possible.""Our teams are scouring and thinking of every single risk that's out there, and we've worked our butt off to buy down the ones we know of. And we'll continue to look and continue to buy them down until we bring [Hurley and Behnken] home,"" said Kathy Lueders, who manages Nasa's Commercial Crew Program. There is huge focus on this mission. Not since the retirement of the space shuttles in 2011 has America been able to launch its own astronauts to the space station - a task that has rested solely with Russia and its Soyuz rocket and capsule system.Nasa's Commercial Crew Program, initiated just prior to the end days of the famous winged orbiters, sought to incentivise a new human transportation industry in the US.The agency proposed to purchase launch services off private companies and gave them seed money to help develop their hardware.SpaceX, run by the tech entrepreneur Elon Musk, is the first of the commercial operators to deliver a working system. The aerospace giant Boeing is some way behind in its progress, but should eventually match the SpaceX milestones.For Nasa, this approach of contracting out astronaut transportation to low-Earth orbit has saved it many billions of dollars. The old way of doing things, which required the agency to purchase, own and operate its space vehicles, proved to be very expensive.From now on, Nasa will simply buy seats in what are essentially private taxi services. Cash that's freed up can then be diverted to more complex endeavours such as preparing to take astronauts back to the Moon and on to Mars.   ""It's been estimated that this programme overall will have saved Nasa maybe $30bn-40bn at least,"" observed Benji Reed, director of crew mission management at SpaceX.  ""Firm, fixed-price contracts and the kind of truly open partnership where we work together allows that kind of saving to happen and that kind of ability to allow Nasa to invest in more things and do other programmes.""Jonathan.Amos-INTERNET@bbc.co.uk and follow me on Twitter: @BBCAmos",22 May 2020,science
Nasa SpaceX launch: Who are the astronauts?,"On 27 May, two US astronauts will achieve a world first when they launch to the International Space Station (ISS) aboard a spacecraft built by Elon Musk's SpaceX. Here, BBC News profiles the astronauts who will make the historic journey.Doug Hurley and Bob Behnken are about to break a nine-year hiatus for Nasa, becoming the first astronauts to launch from US soil since the retirement of the space shuttle in 2011. In the intervening years, Nasa bought seats for its astronauts - at a cost of tens of millions of dollars per flight - on the Russian Soyuz.But officials have also worked with Elon Musk's company SpaceX and aerospace giant Boeing to develop new, American spacecraft capable of ferrying humans to and from the ISS - under the space agency's Commercial Crew Program.Musk's vehicle will be first to fly; on Wednesday, Hurley and Behnken will travel to the ISS in the sleek Crew Dragon spacecraft.""It's well past time to be launching an American rocket from the Florida coast to the International Space Station and I am certainly honoured to be a part of it,"" Hurley, 53, said earlier this month.Behnken, 49, added: ""On my first flight... I didn't have a son, so I'm really excited to share the mission with him.""Nasa has chosen two of its most experienced astronauts to help California-based SpaceX ready the Crew Dragon for launch. The two are also longstanding friends.""Being lucky enough to fly with your best friend... I think there's a lot of people who wish they could do that,"" says Hurley.When they blast off atop a Falcon 9 rocket, their spouses will know exactly what they are going through. That's because they're astronauts too.Marine Colonel Hurley's wife Karen Nyberg flew into space twice - aboard the shuttle and the Soyuz - retiring from Nasa this year. They have a 10-year-old son, Jack, whose formative years were shaped by space travel.Nyberg began training for a six-month space station mission just a few months after Jack's birth. In the meantime, Hurley was preparing for his own flight - piloting the last ever shuttle mission. Sometimes, Nyberg took Jack to Russia, at other times he stayed at home in Texas.""Literally from the time Jack was old enough to comprehend things, he was either going to Russia or Skyping with mommy. That's just the way it was,"" Hurley told the Houston Chronicle in 2013.Air Force Colonel Behnken is married to Megan McArthur, who flew on the last mission to service the Hubble Space Telescope in 2009. As an active member of the astronaut corps, she is a potential candidate to be the first woman on the Moon when Nasa returns in 2024. Their son, Theo, is six.Hurley, Behnken, Nyberg and McArthur all graduated from the same astronaut class (2000) and attended each other's weddings. The men are so used to each other's company, they now have a spooky rapport.They ""can predict - almost by body language - what the person's opinion is or what their next action is going to be,"" Behnken told CNN earlier this month. ""We've just been doing this so long that it's kind of like having a second set of hands.""Hurley says of Behnken: ""I know instantaneously when I've not done something correctly - just put it that way. He doesn't have a good poker face."" But Behnken admits Hurley is the more organised of the two.The older of the two men was raised in the hamlet of Apalachin, in upstate New York. ""It was just a great small town existence... we didn't get a stoplight until I was, I think, in college,"" Hurley said in 2009.Behnken hails from  St Ann, a suburb of St Louis, Missouri. In 2010, he described it as ""a blue collar kind of a neighbourhood"", adding: ""I guess, in my bag of tricks... I'm more of a working class sort of a person.""He took jobs in construction before deciding that working outdoors in the summer heat wasn't for him. Both men went to college on military scholarships and gained undergraduate degrees in engineering. While Behnken went on to complete a PhD at Caltech - the elite institute featured in the Big Bang Theory television show - Hurley became an officer in the Marines.They both subsequently trained as military test pilots - at different training schools. It's been the archetypal background for Nasa's astronauts since the days of its first intake - the Mercury Seven.""When I showed up [at Nasa] it was like: 'Well, I have a PhD and an MD,' and I'm sitting there going, 'Mmm, wow! Maybe I was a bit of a slacker',"" said Hurley. ""But you know, your professional development as a pilot and the thousands of hours you get as a pilot... brings something to the table.""Hurley and Behnken were selected as astronaut candidates three years before the shuttle Columbia broke up on re-entry, killing seven crew members. After the disaster, Nasa decided it would retire the shuttle, handing over space station transport to private firms.Thus, when the two men were finally assigned their flights, the shuttle programme was in its final phase. Their missions focused on fulfilling Nasa's prior commitments to complete construction of the ISS, including the delivery of crew compartments designed to fit in the shuttle's payload bay.When the spaceplane was retired, the pair were assigned to the Commercial Crew Program. In August 2018, Hurley and Behnken were announced as the prime crew for Demo-2, the first flight of SpaceX's vehicle with humans onboard.""Bob and I, the last two years, have essentially been living in California, working hand-in-hand with the folks at SpaceX to get us to this point,"" Hurley said this month.They've had to get used to the Crew Dragon's touchscreen controls after previously working with the chunky buttons on shuttle instrument panels.Hurley says a background in evaluating military aircraft as test pilots proved crucial in their work with SpaceX.""That, in and of itself, helped both of us tremendously, because all along the process that you see in the military, there are delays, there are technical challenges, there are things that you don't expect and you have to work through them,"" he explained.Setbacks - including two spectacular explosions that destroyed a rocket and one of the Crew Dragon capsules - have seen the mission slip by nearly four years from its original date of October 2016. ""We were well-prepared for that part of it, when I think it caused some frustration within Nasa as launch dates weren't made,"" explained Hurley.Despite bumps in the road, Behnken's enthusiasm remains undimmed: ""It's probably the dream of every test pilot school student to have the opportunity to fly on a brand new spaceship.""Hurley told CNN: ""From a first flight standpoint, certainly, there might be some greater quantifiable risk to some degree.""But probably no different to any other spaceflight we've flown humans on before.""Follow Paul on Twitter.",24 May 2020,science
