World's deepest octopus captured on camera,"The deepest ever sighting of an octopus has been made by cameras on the Indian Ocean floor. The animal was spotted 7,000m down in the Java Trench - almost 2km deeper than the previous reliable recording. Researchers, who report the discovery in the journal Marine Biology, say it's a species of ""Dumbo"" octopus.The name is a nod to the prominent ear-like fins just above these animals' eyes that make them look like the 1940s Disney cartoon character.The scientist behind the identification is Dr Alan Jamieson.He's pioneered the exploration of the deep using what are called ""landers"".These are instrumented frames dropped overboard from research ships. They settle on the seabed and record what passes by.Dr Jamieson's equipment filmed two octopuses - one on a drop to 5,760m and a second to 6,957m. The individual animals were 43cm and 35cm in length.They've been placed in the Grimpoteuthis family - the group commonly known as Dumbo.Octopus fragments and eggs have been found at very great depths, but until this discovery, the previous deepest reliable sighting was at 5,145m down. That was a black and white photo of an animal taken 50 years ago off Barbados. The significance of the Indian Ocean observations is that we now know that octopuses can find potentially suitable habitat across at least 99% of the global seafloor. But those animals that do live at depth will clearly need some special adaptations, says Dr Jamieson. ""They'd have to do something clever inside their cells. If you imagine a cell is like a balloon - it's going to want to collapse under pressure. So, it will need some smart biochemistry to make sure it retains that sphere,"" the scientist explained. ""All the adaptations you need to live at pressure are at the cellular level.""    Dr Jamieson recorded the new octopus while working as chief scientist on the Five Deeps Expedition. This was the project that saw Texan financier Victor Vescovo take a submersible to the deepest sectors of the five major oceans on Earth.While Mr Vescovo was setting human dive records, Dr Jamieson was conducting the tandem science investigations.He hopes his findings can help dispel some of the misunderstandings about the deepest parts of the ocean. ""The laws of marine ecology and marine biology are actually much the same. And we need the Dumbo octopus out there to blur that line between the depths we think we care about and the depths we don't. This idea that only animals in a kind Victorian freak show live at depth isn't right.""Dr Jamieson is currently the CEO of Armatus Oceanic, a deep-sea consultancy. He's also affiliated to Newcastle University. Jonathan.Amos-INTERNET@bbc.co.uk and follow me on Twitter: @BBCAmos",29 May 2020,science
Climate change: How a green new deal really could go global,"Good news is in short supply at the moment, so brace yourself for a rare burst of optimism about climate change. World leaders know their countries face one of the most severe recessions in history thanks to the coronavirus restrictions.That presents a unique challenge, but also a massive opportunity.Politicians know they are going to need to spend huge amounts of money to kick-start economic activity as the threat of coronavirus finally recedes.It is a one-off, never-to-be-repeated chance to transform their economies. So the question is, what will they spend it on?This week the European Union put its cards on the table. On Wednesday it unveiled what it is billing as the biggest ""green"" stimulus package in history. ""This is about all of us and it is way bigger than any one of us,"" announced Ursula von der Leyen, the European Commission president, when she told European Parliament members what was planned.  ""This is Europe's moment,"" she said.As well as being a big step towards federalism, the recovery package puts fighting climate change at the heart of the bloc's recovery from the pandemic. The scale of what is being proposed is mind-boggling. The headline figure is €750bn, but add in spending from future budgets and the total financial firepower the European Commission says it will be wielding is almost €2tn ($2.2tn).There will be tens of billions of euros to make homes more energy efficient, to decarbonise electricity and phase out petrol and diesel vehicles. The idea is to turbo-charge the European effort to reduce carbon emissions to net zero by 2050.""If we do not do it we will be taking much more risk,"" Teresa Ribera, the deputy Prime Minister of Spain told me.""The recovery should be green or it will not be a recovery, it will just be a short-cut into the kind of problems we are facing right now.""If you are thinking this is just something that sandal-wearing European liberals might get behind, think again.Donald Trump may be an avowed supporter of fossil fuels, but his Democratic opponent in the November presidential election is not.Joe Biden is reckoned to be planning a similarly huge green stimulus package for the US.The model is the vast investment projects of the New Deal that helped lift America out of the Great Depression in the 1930s.That was the defining policy of President Franklin Delano Roosevelt.Biden is reportedly preparing for his own ""FDR-size presidency"", according to New York magazine.""He knows he needs youth enthusiasm, he knows he needs the left, he knows he needs the core democratic base, and he knows climate is probably the best issue to get that,"" explains energy and climate analyst David Roberts of the US website Vox.""Climate polls the best across all those groups, climate even polls pretty well among wavering Trump voters,"" he says.This is not just about rallying voters. There are sound economic reasons why politicians see green technology as a prudent investment.First off, renewables are now often cheaper than fossil fuels in large parts of the world.The technologies are proven and can be built at scale today.And most importantly, their cost follows the logic of all manufacturing - the more you produce, the cheaper it gets.The same logic applies to hydrogen and to electric vehicles. But it does not apply to fossil fuels, whose cost ultimately relies on mining ever more difficult and dwindling resources.And that contains the seductive promise that a huge government push to scale up solar and wind will make them even more affordable compared with coal, oil and gas - not just in the US, but globally.So the argument goes that renewables provide a pathway for clean growth in the future.Develop innovative new electric vehicles, wind turbines, ways of making homes energy-efficient, energy storage technologies or even new ways of configuring electricity grids and you are likely to find ready markets around the world in coming years.Equally importantly, renewable technologies offer something else that will be needed in the years to come: the potential to create huge numbers of new jobs.The Covid-19 crisis has driven joblessness to near Great Depression levels around the world - worse even than in the wake of the 2008 financial crisis.Around 40 million Americans are unemployed.Worldwide, 1.6 billion people are reckoned to be in immediate danger of losing their livelihoods, according to the International Labour Organisation.That means governments need to find ways to employ lots and lots of people.Renewable technologies offer precisely the kind of ""shovel-ready"", large-scale and labour-intensive infrastructure projects politicians are looking for.There is the obvious stuff - building wind turbines, solar farms and the foundations of a hydrogen economy - but think also about installing networks of charging points for electric vehicles, the need to insulate homes or revamp urban transport systems.Just like the road and dam building of the American New Deal, projects like these could employ tens of thousands of people in high-skilled and - crucially - local jobs.But here's the rub. China currently looks set to take a very different route to recovery.It remains the biggest piece of the climate change puzzle. China produces almost a third of the world's emissions, as much as the US and the EU combined.Last week, the country's top legislative body, the annual National People's Congress, was in full session.The country already has a big expansion of coal-fired electricity generation underway. There was no suggestion this would be reversed.After the financial crisis in 2008, China ramped up coal-fired power stations as a key part of its stimulus package. But there is still a lot to play for this time round, says Li Shuo, an energy expert with Greenpeace East Asia in Beijing.Few details of the Covid recovery plan were announced at the NPC, and he says much will depend on what American voters decide in November.""The US position looms very large in China's political calculus,"" explains Mr Li.He believes President Trump's energy policies are one of the major barriers to China raising its climate ambitions.""I think there is a feeling here in China that it is unfair for Beijing to move forward with its climate agenda at the same time as the US is moving backwards.""That said, the Chinese public certainly seems to support measures to decarbonise the economy.Eighty-seven percent of Chinese people see climate change as serious a threat as Covid-19, according to a poll conducted in 14 countries by Ipsos MORI in April. Even in America, where support was lowest, 59% of people agreed that the risks of climate change matched those of the coronavirus in the long term.Nearly two-thirds of all respondents and 57% of Americans said it was important that government actions aimed at economic recovery prioritised action on climate change.And once big economies like Europe and the US adopt policies like these, there is good reason to think other countries will follow suit.One of the most striking - and controversial - aspects of the European plan is that it will be funded in large part by debt raised by the European Commission itself.That represents a significant deepening or European integration that some member states have already signalled they will resist. Under the proposal the hundreds of billions of euros of debt would be serviced by new EU-wide taxes.One option being discussed is a carbon tax that would include levies on imported goods with a high carbon footprint.Think about what that means.Countries that want to sell into the largest economy in the world would now face penalties unless they make efforts to clean up their energy systems.Now imagine that America embarks on a Green New Deal. It might choose to introduce a similar tariff.But I opened this piece offering optimism, so let me present an alternative path. The countries that decarbonise first could lead by example. Remember, the more renewables you produce, the cheaper they get.As low carbon technologies increasingly undercut the fossil fuel alternatives, you won't need a stick to beat other countries into changing their ways - they will just follow the money.You see where this is headed.? Maybe we are not as far away from widespread coordinated action on climate change as many people fear.As I said at the start, a rare opportunity for optimism amongst the gloom of this present crisis.You can hear a radio programme Justin made with producer Laurence Knight about how plans for gigantic government investments to decarbonise the world economy are gaining traction on the World Service's Business Daily. Click here.",31 May 2020,science
Climate change: 'Stunning' seafloor ridges record Antarctic retreat,"Scientists are learning just how fast the ice margin of Antarctica can retreat in a warming world.They've identified features on the seafloor that indicate the ice edge was reversing at rates of up to 50m a day at the end of the last ice age.That's roughly 10 times faster than what's observed by satellites today.The discovery is important because it puts realistic constraints on the computer simulations that are used to project future change in the region.""In numerical models, you play with the parameters - and they can do very strange things,"" said Prof Julian Dowdeswell. ""But what these data are saying is that actually rates considerably higher than we get even in the satellite record today were possible in the not-far-distant geological past.""The director of the Scott Polar Research Institute (SPRI) in Cambridge, UK, led an expedition last year to the Larsen region of the Antarctic Peninsula.His team deployed autonomous underwater vehicles (AUVs) with high-resolution mapping capability to examine the sediments at the bottom of the western Weddell Sea.What the robots saw was a delicate pattern of ridges that looked like a series of ladders where each rung was about 1.5m high and spaced roughly 20-25m apart.The scientists interpret these ridges to be features that are generated at the ice grounding zone. This zone is the point where the ice flowing off Antarctica into the ocean becomes buoyant and starts to float. The rungs are created as the ice at this location repeatedly pats the sediments as the tides rise and fall.For the pattern to have been produced and preserved, the ice must have been in retreat (advancing ice would destroy the ridges). And the tidal ""clock"" therefore gives a rate for this reversal.Prof Dowdeswell explained: ""We have a maximum of 90 of these rungs with a spacing of 20-25m - that gives us, if extrapolated, a rate of 40-50m per day. Again, if extrapolated - that's a rate in excess of 10km per year of retreat. And the really interesting thing about that is it's a rate that's pretty much an order of magnitude higher than even the most rapid retreat of the grounding lines in the Pine Island-Thwaites system today.""Pine Island and Thwaites glaciers are two of Antarctica's fastest-changing ice bodies whose ice margins are being melted by warm ocean water getting underneath them.The ridges seen by the AUVs are some 40km from the cliffs that front the ice edge in the Larsen sector today. The marks are considered to be around 12,000 years old. Back then, the ice sheet would have been far more extensive than it is today, but like today would have been experiencing rapid change as the global climate emerged from the deepest of freezes.Dr Alistair Graham from the University of South Florida, US, works with AUV data. He was not involved in this research.He said he found the interpretation compelling but that there would likely be some scepticism in the community that the rungs really did form daily with the tides.""The data in the paper are absolutely stunning,"" he told BBC News.  ""The ability to map at a sub-metre resolution from an AUV really lifts a veil on the seafloor structure and composition. We have been able to get snapshots of these sorts of images before, by sending an AUV under Pine Island Glacier, for example, but these imagery from the Dowdeswell team are the best yet from anywhere around Antarctica. ""What this paper also emphasises to me is that there are still big lessons to learn from looking at the past history of ice sheets at the poles. For somewhere like Thwaites Glacier, where we are desperate to understand its future trajectory, understanding what it did in the centuries and millennia leading up to the observations we are making today will be a critical part of determining how much ice is lost and how fast going forwards. ""We do have similar high-resolution imagery from an AUV deployed at Thwaites Glacier last year that we are currently working on, and which will hopefully tackle some of these pressing questions."" The new research is published in the journal Science. The Weddell Sea Expedition 2019 was an international effort led from the SPRI and funded in part by the Flotilla Foundation and Marine Archaeology Consultants Switzerland.The AUVs were operated by the US-UK Ocean Infinity company. Jonathan.Amos-INTERNET@bbc.co.uk and follow me on Twitter: @BBCAmos",29 May 2020,science
World's deepest octopus captured on camera,"The deepest ever sighting of an octopus has been made by cameras on the Indian Ocean floor. The animal was spotted 7,000m down in the Java Trench - almost 2km deeper than the previous reliable recording. Researchers, who report the discovery in the journal Marine Biology, say it's a species of ""Dumbo"" octopus.The name is a nod to the prominent ear-like fins just above these animals' eyes that make them look like the 1940s Disney cartoon character.The scientist behind the identification is Dr Alan Jamieson.He's pioneered the exploration of the deep using what are called ""landers"".These are instrumented frames dropped overboard from research ships. They settle on the seabed and record what passes by.Dr Jamieson's equipment filmed two octopuses - one on a drop to 5,760m and a second to 6,957m. The individual animals were 43cm and 35cm in length.They've been placed in the Grimpoteuthis family - the group commonly known as Dumbo.Octopus fragments and eggs have been found at very great depths, but until this discovery, the previous deepest reliable sighting was at 5,145m down. That was a black and white photo of an animal taken 50 years ago off Barbados. The significance of the Indian Ocean observations is that we now know that octopuses can find potentially suitable habitat across at least 99% of the global seafloor. But those animals that do live at depth will clearly need some special adaptations, says Dr Jamieson. ""They'd have to do something clever inside their cells. If you imagine a cell is like a balloon - it's going to want to collapse under pressure. So, it will need some smart biochemistry to make sure it retains that sphere,"" the scientist explained. ""All the adaptations you need to live at pressure are at the cellular level.""    Dr Jamieson recorded the new octopus while working as chief scientist on the Five Deeps Expedition. This was the project that saw Texan financier Victor Vescovo take a submersible to the deepest sectors of the five major oceans on Earth.While Mr Vescovo was setting human dive records, Dr Jamieson was conducting the tandem science investigations.He hopes his findings can help dispel some of the misunderstandings about the deepest parts of the ocean. ""The laws of marine ecology and marine biology are actually much the same. And we need the Dumbo octopus out there to blur that line between the depths we think we care about and the depths we don't. This idea that only animals in a kind Victorian freak show live at depth isn't right.""Dr Jamieson is currently the CEO of Armatus Oceanic, a deep-sea consultancy. He's also affiliated to Newcastle University. Jonathan.Amos-INTERNET@bbc.co.uk and follow me on Twitter: @BBCAmos",29 May 2020,science
Nasa SpaceX launch: How we got to this point,"Elon Musk's SpaceX is set to launch people to the space station. But why is a private company sending astronauts into space for Nasa?To understand the background to this historic launch with the Crew Dragon spacecraft, we need to go back almost 20 years to a tragic accident.On 1 February 2003, the space shuttle Columbia broke apart while re-entering the Earth's atmosphere. All seven astronauts aboard perished in the disaster.The loss of Columbia and its crew was the trigger for a dramatic shift in direction for America's human spaceflight programme.On 14 January 2004, President George W Bush announced that the space shuttle would be retired after completion of the International Space Station (ISS). In its place, America would build a new vehicle capable of returning astronauts to the Moon.The following year, Nasa chief Mike Griffin announced that the completion of the ISS would, for the first time, open up commercial opportunities for the routine transportation of cargo and astronauts to low-Earth orbit. This, Griffin reasoned, was required to free up enough funds to achieve a Moon return. Nasa established a Commercial Crew & Cargo Program Office (C3PO) to oversee the effort.The first part of this commercial vision - ferrying supplies and other cargo to the space station - would be fulfilled by SpaceX's original Dragon spacecraft and the Cygnus vehicle built by Orbital Sciences. In 2008, Barack Obama became president. His administration kicked off a review of the human spaceflight programme, which led to the cancellation of his predecessor's plan to return to the Moon (known as Constellation). However, the Obama administration favoured the continued commercialisation of space. After the space shuttle was retired, Nasa had to pay Russia tens of millions of dollars per seat to fly its astronauts to the ISS on the Soyuz vehicle, which launches from Baikonur Cosmodrome in Kazakhstan.Congress was initially sceptical about the Commercial Crew Program and did not provide sufficient funds at first. But Charles Bolden, the astronaut who took over from Griffin as Nasa chief, persisted and eventually secured the support he needed.From their initial $50m investment in the programme in 2010, the space agency whittled several competing companies down to two - SpaceX and Boeing - in 2014.Since then, they have been refining and testing their spacecraft designs. It hasn't been plain sailing for either company, though. In 2016, a Falcon 9 rocket blew up on the launch pad. Then, in 2019, a Crew Dragon capsule exploded during testing on the ground. No one was hurt in either event.These mishaps and others introduced delays to a timeline which would originally have seen SpaceX launch crew to the space station in October 2016. Boeing experienced a timing anomaly during an uncrewed test flight last year that prevented it docking with the space station.But last year, SpaceX performed a triumphant launch of the Crew Dragon without astronauts. Using automated procedures, the capsule successfully approached and docked with the space station. It was carrying a mannequin called Ripley - after Ellen Ripley, the protagonist in the Alien movies - decked out with sensors to measure the G forces experienced during flight - particularly launch and landing. That mission, together with the successful test of the crew abort system, opened the door for a historic flight from Kennedy Space Center in Florida.Follow Paul on Twitter.",27 May 2020,science
