Coronavirus: How dangerous is lifting lockdown?,"Lockdown is starting to ease. Across the UK we can meet more people, while in England some children are back in school and car showrooms and open-air markets have reopened.But some scientists, even those advising government, have been in mutinous mood - saying ministers are acting too soon. And the lifting of restrictions has been described as a ""dangerous moment"" even by England's deputy chief medical officer.Things are far better than when lockdown came in.There were an estimated 100,000 new infections every day in England on 23 March, the day when Boris Johnson announced strict curbs on our daily lives. That compares with around 8,000 daily infections at the moment. ""It's somewhere in the range of 10-fold fewer, but that's still considerable,"" Dr Adam Kurcharski from the London School of Hygiene and Tropical Medicine told the BBC.The speed at which the virus is spreading is also much slower.The R number - the average number of people each infected person passes the virus onto - was around three when lockdown came in. That meant 10 people were passing coronavirus onto 30 others. Now the R is around 0.7-0.9, meaning 10 people would be expected to pass it onto around eight others. However, a comparison by the University of Oxford suggests the UK is in one of the worst positions globally for exiting lockdown.And it is notable the government's own coronavirus alert system for England remains at ""Level 4"" rather than ""Level 3"" when social distancing restrictions would be relaxed.The chief science adviser, Sir Patrick Vallance, warns there is ""not a lot of room"" for manoeuvre and the data ""urges caution"". R is close to one - the tipping point where cases increase again and ""we are still seeing new infections every day at quite a significant rate"". Relaxing lockdown means we will come into contact with more people and that increases the opportunity for the virus to spread.The restrictions being eased are expected to have a small role in spreading coronavirus, but their precise impact is unknown. Uncertainty is a particular issue with schools. The government's evidence on reopening them could not put a figure on the impact. There is also uncertainty about how we will react to the loosening of the rules. Behavioural scientists advising the government already estimate only half of people are isolating for seven days when they become sick.Throughout the pandemic, the scientists and politicians have been following the same script.But there is now a clear, loud and public split between some of those advising government and those ""following the science"".More than a dozen Sage committee members, who advise government, have spoken out, saying we should wait until test and trace is fully working and cases have come down. ""Essentially, we're lifting the lid on a boiling pan and it's just going to bubble over,"" argued Prof Calum Semple.Major deja vu feeling to mid March. Scientists incredibly concerned, politicians ignoring this, public doesn't want life disturbed.End of Twitter post  by @devisridharThere is a significant consequence to lifting lockdown now - it may lock us into the current number of cases. There are approximately 8,000 infections a day. If easing restrictions raises the R number close to one, then we will continue to have around 8,000 infections every day. Waiting until cases fall further would make the virus easier to control and give more time to react if there was a ""second wave"". However, that requires keeping a painful lockdown for longer. There is also uncertainty about how effective contact tracing will be in the UK.The aim is to replace lockdown for all with isolation for some, by rapidly identifying and quarantining anyone who comes into close contact with someone infected.The strategy is seen as one of the key reasons some Asian countries have excelled at controlling coronavirus (South Korea has around 270 deaths compared with more than 39,000 in the UK).However, there is a danger in expecting identical results.The UK is not using GPS tracking to ensure people do as they are told, like South Korea, or taking people to quarantine centres as they do in Hong Kong.Speed is crucial in order to find contacts before they become infectious, yet there are concerns about how long home testing takes in the UK.And an analysis of South Korea's strategy, by Imperial College London, suggests mass testing when a cluster of cases appears in one area was more influential than tracing contacts. Estimates of the effectiveness of test and trace vary widely, from a 5% to a 30% reduction in infections, depending on how optimistic the number crunching.The number of people that have been infected remains low, so any immunity is also low. That means there is the potential for a second wave, but whether it happens depends on both government decisions and how we react.The plan is to gradually introduce measures and then monitor what happens.""With a cautious, piecemeal approach, I think the risk of a major increase is not particularly high; let's not call it a second wave, let's call it a second bump,"" said Prof Mark Woolhouse from the University of Edinburgh. A sudden surge in cases is considered unlikely. Dr Kucharski said: ""I don't think we'll see a huge, exponential increase in numbers in a couple of weeks.""It may take some time for that to happen if transmission is in clusters; it will be late summer or autumn or even winter, depending on what happens. It may be we're in for a long haul.""Follow James on Twitter",2 June 2020,health
Coronavirus: How dangerous is lifting lockdown?,"Lockdown is starting to ease. Across the UK we can meet more people, while in England some children are back in school and car showrooms and open-air markets have reopened.But some scientists, even those advising government, have been in mutinous mood - saying ministers are acting too soon. And the lifting of restrictions has been described as a ""dangerous moment"" even by England's deputy chief medical officer.Things are far better than when lockdown came in.There were an estimated 100,000 new infections every day in England on 23 March, the day when Boris Johnson announced strict curbs on our daily lives. That compares with around 8,000 daily infections at the moment. ""It's somewhere in the range of 10-fold fewer, but that's still considerable,"" Dr Adam Kurcharski from the London School of Hygiene and Tropical Medicine told the BBC.The speed at which the virus is spreading is also much slower.The R number - the average number of people each infected person passes the virus onto - was around three when lockdown came in. That meant 10 people were passing coronavirus onto 30 others. Now the R is around 0.7-0.9, meaning 10 people would be expected to pass it onto around eight others. However, a comparison by the University of Oxford suggests the UK is in one of the worst positions globally for exiting lockdown.And it is notable the government's own coronavirus alert system for England remains at ""Level 4"" rather than ""Level 3"" when social distancing restrictions would be relaxed.The chief science adviser, Sir Patrick Vallance, warns there is ""not a lot of room"" for manoeuvre and the data ""urges caution"". R is close to one - the tipping point where cases increase again and ""we are still seeing new infections every day at quite a significant rate"". Relaxing lockdown means we will come into contact with more people and that increases the opportunity for the virus to spread.The restrictions being eased are expected to have a small role in spreading coronavirus, but their precise impact is unknown. Uncertainty is a particular issue with schools. The government's evidence on reopening them could not put a figure on the impact. There is also uncertainty about how we will react to the loosening of the rules. Behavioural scientists advising the government already estimate only half of people are isolating for seven days when they become sick.Throughout the pandemic, the scientists and politicians have been following the same script.But there is now a clear, loud and public split between some of those advising government and those ""following the science"".More than a dozen Sage committee members, who advise government, have spoken out, saying we should wait until test and trace is fully working and cases have come down. ""Essentially, we're lifting the lid on a boiling pan and it's just going to bubble over,"" argued Prof Calum Semple.There is a significant consequence to lifting lockdown now - it may lock us into the current number of cases. There are approximately 8,000 infections a day. If easing restrictions raises the R number close to one, then we will continue to have around 8,000 infections every day. Waiting until cases fall further would make the virus easier to control and give more time to react if there was a ""second wave"". However, that requires keeping a painful lockdown for longer. There is also uncertainty about how effective contact tracing will be in the UK.The aim is to replace lockdown for all with isolation for some, by rapidly identifying and quarantining anyone who comes into close contact with someone infected.The strategy is seen as one of the key reasons some Asian countries have excelled at controlling coronavirus (South Korea has around 270 deaths compared with more than 39,000 in the UK).However, there is a danger in expecting identical results.The UK is not using GPS tracking to ensure people do as they are told, like South Korea, or taking people to quarantine centres as they do in Hong Kong.Speed is crucial in order to find contacts before they become infectious, yet there are concerns about how long home testing takes in the UK.And an analysis of South Korea's strategy, by Imperial College London, suggests mass testing when a cluster of cases appears in one area was more influential than tracing contacts. Estimates of the effectiveness of test and trace vary widely, from a 5% to a 30% reduction in infections, depending on how optimistic the number crunching.The number of people that have been infected remains low, so any immunity is also low. That means there is the potential for a second wave, but whether it happens depends on both government decisions and how we react.The plan is to gradually introduce measures and then monitor what happens.""With a cautious, piecemeal approach, I think the risk of a major increase is not particularly high; let's not call it a second wave, let's call it a second bump,"" said Prof Mark Woolhouse from the University of Edinburgh. A sudden surge in cases is considered unlikely. Dr Kucharski said: ""I don't think we'll see a huge, exponential increase in numbers in a couple of weeks.""It may take some time for that to happen if transmission is in clusters; it will be late summer or autumn or even winter, depending on what happens. It may be we're in for a long haul.""Follow James on Twitter",2 June 2020,health
Coronavirus: Some people shielding allowed outdoors from Monday,"Vulnerable people in England and Wales advised to stay home since the coronavirus lockdown began will be able to go outdoors again from Monday.The change means people will be able to go out with members of their household. Those living alone can meet with someone from another household while maintaining social distancing.Support for shielders, such as food and medicine deliveries, will continue. Shielding advice in Northern Ireland and Scotland has not yet changed.In England, those shielding will be advised that they can go outside once a day, with their household or, if they live alone, to meet one other person at a two-metre distance. In Wales, outdoor exercise for people shielding will be unlimited. Those shielding should not go out to work, to shop or visit friends in their homes.Around 2.5 million UK people were advised to stay at home as lockdown began, because they were identified as being at particularly high risk of needing hospital treatment for coronavirus symptoms.Most were notified by their GP.The list of people who should be shielding includes solid organ transplant recipients, cancer patients undergoing chemotherapy, pregnant women with heart disease and people with severe respiratory conditions such as cystic fibrosis and severe asthma.Some people shielding to be allowed outdoorsNot all elderly people were asked to shield.Some were later removed from the shielding list if they no longer met the requirements.One of the scientists advising the government, Professor Peter Openshaw, told the BBC's Andrew Marr Show that we are learning more about the virus: ""I think we're going to be able to fine-tune the advice now and actually reassure some people we feared might be susceptible, that in fact they're not as vulnerable as we thought.""Lynne Loomes, a primary school teacher from Gloucestershire, is one of those who has had to stay inside having been diagnosed with an autoimmune disease last year.She told BBC Breakfast that the easing of lockdown measures has made shielding more challenging - especially since she has had to tell her children they cannot go out for socially-distanced meet ups with friends.""I'm having to say 'no, you can't, because that increases the risk for me',"" she said.""In terms of day-to-day we've tried to get up as normal. We've tried to keep the routine as if we were going to work,"" she added.""But it has actually got harder as some of the rules have eased, because we know that it doesn't really change for us as a family.""Prime Minister Boris Johnson said that ""thousands of lives"" had been saved by those who had shielded themselves.Some scientists have expressed concerns about England's easing of lockdown rules while infection rates remain at around 8,000 per day according the Office for National Statistics.""Many of us would prefer to see the incidence down to lower levels before we relax measures,"" said Professor John Edmunds, from the London School of Tropical Hygiene and Medicine and one of the government's top advisors.""Covid-19 spreading too fast to lift lockdown in England,"" tweeted Jeremy Farrar, director of the Wellcome Trust.England's Deputy Chief Medical Officer Prof Jonathan Van-Tam said the consensus among scientists was that the new measures were not expected to push the rate of infection above the key R value of 1.0.However, he urged the public to be ""sensible and proportionate with the freedom we have wanted to give people"", saying the UK is ""at a dangerous moment"" and the easing of lockdown ""has to go slowly"". Reacting to the change, Phil Anderson from the MS Society said thousands of the more than 130,000 people with MS in the UK had been feeling ""forgotten"" after months of shielding. He said they were concerned the news had come ""out of the blue"" and extremely vulnerable people would want to hear ""a lot more about the scientific evidence showing this will be safe for them"".He also called for better mental health support for everyone who needs it. How have you been affected by the issues relating to coronavirus? Share your experiences by emailing haveyoursay@bbc.co.uk.Please include a contact number if you are willing to speak to a BBC journalist. You can also contact us in the following ways:",31 May 2020,health
Coronavirus: How dangerous is lifting lockdown?,"Lockdown is starting to ease. Across the UK we can meet more people, while in England some children are back in school and car showrooms and open-air markets have reopened.But some scientists, even those advising government, have been in mutinous mood - saying ministers are acting too soon. And the lifting of restrictions has been described as a ""dangerous moment"" even by England's deputy chief medical officer.Things are far better than when lockdown came in.There were an estimated 100,000 new infections every day in England on 23 March, the day when Boris Johnson announced strict curbs on our daily lives. That compares with around 8,000 daily infections at the moment. ""It's somewhere in the range of 10-fold fewer, but that's still considerable,"" Dr Adam Kurcharski from the London School of Hygiene and Tropical Medicine told the BBC.The speed at which the virus is spreading is also much slower.The R number - the average number of people each infected person passes the virus onto - was around three when lockdown came in. That meant 10 people were passing coronavirus onto 30 others. Now the R is around 0.7-0.9, meaning 10 people would be expected to pass it onto around eight others. However, a comparison by the University of Oxford suggests the UK is in one of the worst positions globally for exiting lockdown.And it is notable the government's own coronavirus alert system for England remains at ""Level 4"" rather than ""Level 3"" when social distancing restrictions would be relaxed.The chief science adviser, Sir Patrick Vallance, warns there is ""not a lot of room"" for manoeuvre and the data ""urges caution"". R is close to one - the tipping point where cases increase again and ""we are still seeing new infections every day at quite a significant rate"". Relaxing lockdown means we will come into contact with more people and that increases the opportunity for the virus to spread.The restrictions being eased are expected to have a small role in spreading coronavirus, but their precise impact is unknown. Uncertainty is a particular issue with schools. The government's evidence on reopening them could not put a figure on the impact. There is also uncertainty about how we will react to the loosening of the rules. Behavioural scientists advising the government already estimate only half of people are isolating for seven days when they become sick.Throughout the pandemic, the scientists and politicians have been following the same script.But there is now a clear, loud and public split between some of those advising government and those ""following the science"".More than a dozen Sage committee members, who advise government, have spoken out, saying we should wait until test and trace is fully working and cases have come down. ""Essentially, we're lifting the lid on a boiling pan and it's just going to bubble over,"" argued Prof Calum Semple.Major deja vu feeling to mid March. Scientists incredibly concerned, politicians ignoring this, public doesn't want life disturbed.End of Twitter post  by @devisridharThere is a significant consequence to lifting lockdown now - it may lock us into the current number of cases. There are approximately 8,000 infections a day. If easing restrictions raises the R number close to one, then we will continue to have around 8,000 infections every day. Waiting until cases fall further would make the virus easier to control and give more time to react if there was a ""second wave"". However, that requires keeping a painful lockdown for longer. There is also uncertainty about how effective contact tracing will be in the UK.The aim is to replace lockdown for all with isolation for some, by rapidly identifying and quarantining anyone who comes into close contact with someone infected.The strategy is seen as one of the key reasons some Asian countries have excelled at controlling coronavirus (South Korea has around 270 deaths compared with more than 39,000 in the UK).However, there is a danger in expecting identical results.The UK is not using GPS tracking to ensure people do as they are told, like South Korea, or taking people to quarantine centres as they do in Hong Kong.Speed is crucial in order to find contacts before they become infectious, yet there are concerns about how long home testing takes in the UK.And an analysis of South Korea's strategy, by Imperial College London, suggests mass testing when a cluster of cases appears in one area was more influential than tracing contacts. Estimates of the effectiveness of test and trace vary widely, from a 5% to a 30% reduction in infections, depending on how optimistic the number crunching.The number of people that have been infected remains low, so any immunity is also low. That means there is the potential for a second wave, but whether it happens depends on both government decisions and how we react.The plan is to gradually introduce measures and then monitor what happens.""With a cautious, piecemeal approach, I think the risk of a major increase is not particularly high; let's not call it a second wave, let's call it a second bump,"" said Prof Mark Woolhouse from the University of Edinburgh. A sudden surge in cases is considered unlikely. Dr Kucharski said: ""I don't think we'll see a huge, exponential increase in numbers in a couple of weeks.""It may take some time for that to happen if transmission is in clusters; it will be late summer or autumn or even winter, depending on what happens. It may be we're in for a long haul.""Follow James on Twitter",2 June 2020,health
Coronavirus: Some people shielding allowed outdoors from Monday,"Vulnerable people in England and Wales advised to stay home since the coronavirus lockdown began will be able to go outdoors again from Monday.The change means people will be able to go out with members of their household. Those living alone can meet with someone from another household while maintaining social distancing.Support for shielders, such as food and medicine deliveries, will continue. Shielding advice in Northern Ireland and Scotland has not yet changed.In England, those shielding will be advised that they can go outside once a day, with their household or, if they live alone, to meet one other person at a two-metre distance. In Wales, outdoor exercise for people shielding will be unlimited. Those shielding should not go out to work, to shop or visit friends in their homes.Around 2.5 million UK people were advised to stay at home as lockdown began, because they were identified as being at particularly high risk of needing hospital treatment for coronavirus symptoms.Most were notified by their GP.The list of people who should be shielding includes solid organ transplant recipients, cancer patients undergoing chemotherapy, pregnant women with heart disease and people with severe respiratory conditions such as cystic fibrosis and severe asthma.Some people shielding to be allowed outdoorsNot all elderly people were asked to shield.Some were later removed from the shielding list if they no longer met the requirements.One of the scientists advising the government, Professor Peter Openshaw, told the BBC's Andrew Marr Show that we are learning more about the virus: ""I think we're going to be able to fine-tune the advice now and actually reassure some people we feared might be susceptible, that in fact they're not as vulnerable as we thought.""Lynne Loomes, a primary school teacher from Gloucestershire, is one of those who has had to stay inside having been diagnosed with an autoimmune disease last year.She told BBC Breakfast that the easing of lockdown measures has made shielding more challenging - especially since she has had to tell her children they cannot go out for socially-distanced meet ups with friends.""I'm having to say 'no, you can't, because that increases the risk for me',"" she said.""In terms of day-to-day we've tried to get up as normal. We've tried to keep the routine as if we were going to work,"" she added.""But it has actually got harder as some of the rules have eased, because we know that it doesn't really change for us as a family.""Prime Minister Boris Johnson said that ""thousands of lives"" had been saved by those who had shielded themselves.Some scientists have expressed concerns about England's easing of lockdown rules while infection rates remain at around 8,000 per day according the Office for National Statistics.""Many of us would prefer to see the incidence down to lower levels before we relax measures,"" said Professor John Edmunds, from the London School of Tropical Hygiene and Medicine and one of the government's top advisors.""Covid-19 spreading too fast to lift lockdown in England,"" tweeted Jeremy Farrar, director of the Wellcome Trust.England's Deputy Chief Medical Officer Prof Jonathan Van-Tam said the consensus among scientists was that the new measures were not expected to push the rate of infection above the key R value of 1.0.However, he urged the public to be ""sensible and proportionate with the freedom we have wanted to give people"", saying the UK is ""at a dangerous moment"" and the easing of lockdown ""has to go slowly"". Reacting to the change, Phil Anderson from the MS Society said thousands of the more than 130,000 people with MS in the UK had been feeling ""forgotten"" after months of shielding. He said they were concerned the news had come ""out of the blue"" and extremely vulnerable people would want to hear ""a lot more about the scientific evidence showing this will be safe for them"".He also called for better mental health support for everyone who needs it. How have you been affected by the issues relating to coronavirus? Share your experiences by emailing haveyoursay@bbc.co.uk.Please include a contact number if you are willing to speak to a BBC journalist. You can also contact us in the following ways:",31 May 2020,health
