Coronavirus: Risk higher for pregnant BAME women,"The high proportion of pregnant women from black and ethnic minority (BAME) groups admitted to hospital with Covid-19 ""needs urgent investigation"", says a study in the British Medical Journal.Out of 427 pregnant women studied between March and April, more than half were from these backgrounds - nearly three times the expected number.Most were admitted late in pregnancy and did not become seriously ill.Although babies can be infected, the researchers said this was ""uncommon"".The findings, based on data for pregnant women with coronavirus admitted to 194 obstetric units across the UK over six weeks, show:In normal times, 20% of women giving birth are from black and ethnic minority backgrounds (BAME), lead author Prof Marian Knight, professor of maternal and child population health from the University of Oxford, says.When other factors such as obesity and age were taken into account, there was still a much higher proportion from ethnic minority groups than expected, the authors said.And this was still the case when pregnant women in hospitals in big cities were excluded from the analysis.This suggests the effect is not just down to higher infection rates in urban areas, Prof Knight said.But the explanation for why BAME pregnant women are disproportionately affected by coronavirus is not simple ""or easily solved"", she added.""We have to talk to women themselves, as well as health professionals, to give us more of a clue.""Prof Knight also said it was wrong to talk about BAME women as if they were all one group and all the same. Disparities could be linked to factors such as employment, multi-generational households, transport use and culture.""Covid is the lens showing us how important disparities are,"" Prof Knight said.She said women from certain communities might be less reluctant to seek help and advice early if they felt unwell.Karen Mannering tested positive for Covid-19 in March, six months into her pregnancy. ""I was so weak that I would pass out from tiredness and I would hurt from top to bottom,"" she explains. ""I had difficulties breathing. My taste and smell vanished and still hasn't come back.""The 39-year-old from Kent developed pneumonia in both of her lungs and was hospitalised for a week. She is now preparing to be induced several weeks early.""The fear of having coronavirus during my pregnancy is horrible"" she says. ""I have been so scared for my unborn baby. I'm constantly wondering if he is ok. Even in my dreams, I worry. It's always in the back of my mind. ""I recently visited the nurses who looked after me and they told me I am the only pregnant woman with coronavirus that they've treated so far. It shows how unlucky I was to catch it.""Most pregnant women admitted to hospital had a fever, cough or breathlessness and were discharged to recover at home.One in 10 of the pregnant women studied needed respiratory support in a critical care unit in hospital, while three women died as a direct result of complications from Covid-19.The data, from the UK Obstetric Surveillance System, showed that 12 (5%) babies born to mothers in the study tested positive for Covid-19, half of them within the first 12 hours after birth, but none was seriously unwell.Midwives said ""clear and urgent direction"" was needed from the government to tackle the issue.""Even before the pandemic, women from black, Asian or ethnic minority backgrounds were more likely to die in and around their pregnancy,"" Gill Walton from the Royal College of Midwives says.She said they were ""still at unacceptable risk"" and getting help and support to affected communities was crucial.The RCM has four important messages for women:Ms Walton added: ""The system is failing them and that has got to change quickly, because they matter, their lives matter and they deserve the best and safest care.""How have you been affected by any of the issues raised in this article? Tell us about your experience by emailing haveyoursay@bbc.co.uk.Please include a contact number if you are willing to speak to a BBC journalist. You can also contact us in the following ways:",8 June 2020,health
Coronavirus: WHO advises to wear masks in public areas,"The World Health Organization (WHO) has changed its advice on face masks, saying they should be worn in public where social distancing is not possible to help stop the spread of coronavirus.The global body said new information showed they could provide ""a barrier for potentially infectious droplets"".Some countries already recommend or mandate face coverings in public.The WHO had previously argued there was not enough evidence to say that healthy people should wear masks.However, WHO director-general Dr Tedros Adhanom Ghebreyesus said on Friday that ""in light of evolving evidence, the WHO advises that governments should encourage the general public to wear masks where there is widespread transmission and physical distancing is difficult, such as on public transport, in shops or in other confined or crowded environments"".The organisation had always advised that medical face masks should be worn by people who are sick and by those caring for them.Globally, there have been 6.7 million confirmed coronavirus cases and nearly 400,000 deaths since the outbreak began late last year, according to data compiled by Johns Hopkins University.The organisation said its new guidance had been prompted by studies over recent weeks. Dr Maria Van Kerkhove, the WHO's technical lead expert on Covid-19, told Reuters news agency the recommendation was for people to wear a ""fabric mask - that is, a non-medical mask"".Fabric masks should consist of ""at least three layers of different material"" in order to be effective, the WHO says.However, those aged over-60 and with underlying health risks should wear medical masks in areas where there is community transmission.At the same time, the WHO stressed that face masks were just one of a range of tools that could be used to reduce the risk of transmission - and that they should not give people a false sense of protection.""Masks on their own will not protect you from Covid-19,"" Dr Tedros said.This is a big shift in the WHO's guidance on when the public should cover their faces. For months, the organisation's experts stuck to the line that masks would encourage a false sense of security and would deprive medical professionals of badly needed protective equipment.Those arguments have not gone away but at the same time the WHO acknowledges that new evidence has emerged on the risks of transmission.It points to recent research that people can be highly infectious in the few days before they show symptoms and that some people catch the virus but never show symptoms at all, as I reported last weekend.So where distancing is not possible, such as on public transport and in locations as varied as shops and refugee camps, it is suggested that faces are covered with homemade masks to avoid passing on the infection.Over 60s with underlying health conditions should go further, the WHO said, and wear medical-grade masks to give themselves better protection.In Brazil, President Jair Bolsonaro threatened to pull the country out of the WHO unless it ceased to be a ""partisan political organisation"". The leader, who had initially dismissed the virus as a ""little flu"", has been critical of the lockdown policies recommended by the agency to tackle the spread of the disease.Last week, US President Donald Trump said he would end ties with the WHO, saying it had failed to hold China - where the outbreak begun - to account over coronavirus.In the UK, the government announced on Friday that hospital visitors and outpatients would be required to wear face coverings, and that hospital staff would have to wear medical masks, even if they were not in a clinical setting.The guidance will come into force on 15 June, as more businesses open up and more pupils return to school. Also on Friday the UK became the second country to record more than 40,000 coronavirus-related deaths, after the US.The court of appeal in New South Wales, Australia, overturned a ban on a Black Lives Matter protest, which was imposed due to coronavirus concerns. Thousands flooded the streets of Sydney to commemorate African American George Floyd, who died in US police custody.In other news:How have you been affected by coronavirus? Please share your experiences by emailing haveyoursay@bbc.co.uk.Please include a contact number if you are willing to speak to a BBC journalist. ",6 June 2020,health
Coronavirus: Malaria drug hydroxychloroquine 'does not save lives',"A malaria drug that has been tested as a treatment for coronavirus does not save lives, one of the world's largest trials shows.Hydroxychloroquine received global attention after being promoted by Donald Trump, and then controversy after studies on it were retracted.The drug has now been pulled from the UK's Recovery trial, which is run by the University of Oxford.The findings have been passed on to the World Health Organization.Back at the start of the pandemic, laboratory studies had suggested the malaria drug could affect the virus. Small-scale studies in China and France then hinted it might help patients.There was a huge amount of hope, as the medicine is cheap and has been safely used to treat malaria and conditions such as lupus and arthritis.However, the evidence supporting its use for coronavirus has been weak.That is why the data from the Recovery trial is crucial. It is the first to test the drug in large numbers of people in a thorough clinical trial.More than 11,000 patients with Covid-19 are taking part, with 1,542 patients given hydroxychloroquine. Due to mounting controversy about the drug, the UK's drugs regulator last night asked the Oxford researchers to review their data. The results showed 25.7% of people taking hydroxychloroquine had died after 28 days. This compared with 23.5% who were given standard hospital treatment. ""This is not a treatment for Covid,"" said Prof Martin Landray, part of the Recovery trial. The trial immediately stopped using the drug. The findings come in the wake of deep concern in academic publishing that led to an article being retracted in the Lancet - one of the world's most prestigious medical journals.It had published a study involving nearly 15,000 patients, from hundreds of hospitals, given hydroxycholoroquine or the similar drug chloroquine. It concluded the drug was not beneficial and increased the risk of irregular heart rhythms and death. That publication led to the WHO suspending its trials of the anti-malaria drug.The data had been collected from hospitals by the little-known healthcare firm Surgisphere. Concerns were raised about the data and then some of the study's authors said they could no longer stand by their publication as Surgisphere would not allow an independent review.Then the New England Journal of Medicine retracted another paper that had data based on Surgisphere. Prof Peter Horby, from the University of Oxford which runs the Recovery trial, said: ""Hydroxychloroquine and chloroquine have received a lot of attention and have been used very widely to treat Covid patients despite the absence of any good evidence. ""Although it is disappointing that this treatment has been shown to be ineffective, it does allow us to focus care and research on more promising drugs.""Follow James on Twitter.",5 June 2020,health
Vaccine summit exceeds target to raise almost £7bn,"Almost £7bn has been raised to immunise 300 million children at a virtual global vaccine summit hosted by the UK.Prime Minister Boris Johnson said up to eight million lives would be saved as a result of the funds pledged at the Gavi vaccine summit on Thursday.The money will help immunise children against diseases like polio, diphtheria and measles over five years.Mr Johnson said the triumph of humanity over disease was the ""greatest shared endeavour of our lifetimes"".The summit raised funds for Gavi, a global alliance of public and private sector organisations promoting vaccination among the world's poorest communities.Pledges by more than 50 countries and individuals like billionaire philanthropist Bill Gates saw the total surpass an initial target of $7.4bn (almost £6bn).Mr Gates donated $1.6bn (£1.3bn) from his foundation and Mr Johnson pledged £1.65bn over the next five years, making the UK the organisation's biggest donor.The summit comes as the world continues to struggle to get to grips with the coronavirus pandemic.Mr Johnson also used the conference to urge world leaders to renew their ""collective resolve"" to find a Covid-19 vaccine.""Just as we have great military alliances like Nato... where countries collaborate on building their collective military defence, so we now need that same spirit of collaboration and collective defence against the common enemy of disease,"" he said.""It will require a new international effort to co-operate on the surveillance and the sharing of information - data is king - that can underpin a global alert system, so we can rapidly identify any future outbreak. And it will mean a radical scaling-up of our global capacity to respond.""International Development Secretary Anne-Marie Trevelyan later said she believed the UK was capable of delivering a coronavirus vaccine to those who need it ""at speed"" when one becomes available.By Tulip Mazumdar, global health correspondentUS President Donald Trump made a surprise appearance at the virtual global vaccine summit.Last week, Mr Trump severed ties with the UN's health agency, the World Health Organization, stopping around $400m (£317m) in support, after accusing it and China of mishandling the outbreak.There was international criticism of the decision, particularly because it was made in the middle of a global pandemic.But at the summit, Mr Trump struck a different tone in what was a very brief and seemingly very off-the-cuff, pre-recorded message.""As the coronavirus has shown, there are no borders, it doesn't discriminate,"" he said.""It's mean, it's nasty but we're going to take care of it together.... We will work hard, we will work strong... good luck, let's get the answer.""",5 June 2020,health
Coronavirus: Risk higher for pregnant BAME women,"The high proportion of pregnant women from black and ethnic minority (BAME) groups admitted to hospital with Covid-19 ""needs urgent investigation"", says a study in the British Medical Journal.Out of 427 pregnant women studied between March and April, more than half were from these backgrounds - nearly three times the expected number.Most were admitted late in pregnancy and did not become seriously ill.Although babies can be infected, the researchers said this was ""uncommon"".The findings, based on data for pregnant women with coronavirus admitted to 194 obstetric units across the UK over six weeks, show:In normal times, 20% of women giving birth are from black and ethnic minority backgrounds (BAME), lead author Prof Marian Knight, professor of maternal and child population health from the University of Oxford, says.When other factors such as obesity and age were taken into account, there was still a much higher proportion from ethnic minority groups than expected, the authors said.And this was still the case when pregnant women in hospitals in big cities were excluded from the analysis.This suggests the effect is not just down to higher infection rates in urban areas, Prof Knight said.But the explanation for why BAME pregnant women are disproportionately affected by coronavirus is not simple ""or easily solved"", she added.""We have to talk to women themselves, as well as health professionals, to give us more of a clue.""Prof Knight also said it was wrong to talk about BAME women as if they were all one group and all the same. Disparities could be linked to factors such as employment, multi-generational households, transport use and culture.""Covid is the lens showing us how important disparities are,"" Prof Knight said.She said women from certain communities might be less reluctant to seek help and advice early if they felt unwell.Karen Mannering tested positive for Covid-19 in March, six months into her pregnancy. ""I was so weak that I would pass out from tiredness and I would hurt from top to bottom,"" she explains. ""I had difficulties breathing. My taste and smell vanished and still hasn't come back.""The 39-year-old from Kent developed pneumonia in both of her lungs and was hospitalised for a week. She is now preparing to be induced several weeks early.""The fear of having coronavirus during my pregnancy is horrible"" she says. ""I have been so scared for my unborn baby. I'm constantly wondering if he is ok. Even in my dreams, I worry. It's always in the back of my mind. ""I recently visited the nurses who looked after me and they told me I am the only pregnant woman with coronavirus that they've treated so far. It shows how unlucky I was to catch it.""Most pregnant women admitted to hospital had a fever, cough or breathlessness and were discharged to recover at home.One in 10 of the pregnant women studied needed respiratory support in a critical care unit in hospital, while three women died as a direct result of complications from Covid-19.The data, from the UK Obstetric Surveillance System, showed that 12 (5%) babies born to mothers in the study tested positive for Covid-19, half of them within the first 12 hours after birth, but none was seriously unwell.Midwives said ""clear and urgent direction"" was needed from the government to tackle the issue.""Even before the pandemic, women from black, Asian or ethnic minority backgrounds were more likely to die in and around their pregnancy,"" Gill Walton from the Royal College of Midwives says.She said they were ""still at unacceptable risk"" and getting help and support to affected communities was crucial.The RCM has four important messages for women:Ms Walton added: ""The system is failing them and that has got to change quickly, because they matter, their lives matter and they deserve the best and safest care.""How have you been affected by any of the issues raised in this article? Tell us about your experience by emailing haveyoursay@bbc.co.uk.Please include a contact number if you are willing to speak to a BBC journalist. You can also contact us in the following ways:",8 June 2020,health
Coronavirus: WHO advises to wear masks in public areas,"The World Health Organization (WHO) has changed its advice on face masks, saying they should be worn in public where social distancing is not possible to help stop the spread of coronavirus.The global body said new information showed they could provide ""a barrier for potentially infectious droplets"".Some countries already recommend or mandate face coverings in public.The WHO had previously argued there was not enough evidence to say that healthy people should wear masks.However, WHO director-general Dr Tedros Adhanom Ghebreyesus said on Friday that ""in light of evolving evidence, the WHO advises that governments should encourage the general public to wear masks where there is widespread transmission and physical distancing is difficult, such as on public transport, in shops or in other confined or crowded environments"".The organisation had always advised that medical face masks should be worn by people who are sick and by those caring for them.Globally, there have been 6.7 million confirmed coronavirus cases and nearly 400,000 deaths since the outbreak began late last year, according to data compiled by Johns Hopkins University.The organisation said its new guidance had been prompted by studies over recent weeks. Dr Maria Van Kerkhove, the WHO's technical lead expert on Covid-19, told Reuters news agency the recommendation was for people to wear a ""fabric mask - that is, a non-medical mask"".Fabric masks should consist of ""at least three layers of different material"" in order to be effective, the WHO says.However, those aged over-60 and with underlying health risks should wear medical masks in areas where there is community transmission.At the same time, the WHO stressed that face masks were just one of a range of tools that could be used to reduce the risk of transmission - and that they should not give people a false sense of protection.""Masks on their own will not protect you from Covid-19,"" Dr Tedros said.This is a big shift in the WHO's guidance on when the public should cover their faces. For months, the organisation's experts stuck to the line that masks would encourage a false sense of security and would deprive medical professionals of badly needed protective equipment.Those arguments have not gone away but at the same time the WHO acknowledges that new evidence has emerged on the risks of transmission.It points to recent research that people can be highly infectious in the few days before they show symptoms and that some people catch the virus but never show symptoms at all, as I reported last weekend.So where distancing is not possible, such as on public transport and in locations as varied as shops and refugee camps, it is suggested that faces are covered with homemade masks to avoid passing on the infection.Over 60s with underlying health conditions should go further, the WHO said, and wear medical-grade masks to give themselves better protection.In Brazil, President Jair Bolsonaro threatened to pull the country out of the WHO unless it ceased to be a ""partisan political organisation"". The leader, who had initially dismissed the virus as a ""little flu"", has been critical of the lockdown policies recommended by the agency to tackle the spread of the disease.Last week, US President Donald Trump said he would end ties with the WHO, saying it had failed to hold China - where the outbreak begun - to account over coronavirus.In the UK, the government announced on Friday that hospital visitors and outpatients would be required to wear face coverings, and that hospital staff would have to wear medical masks, even if they were not in a clinical setting.The guidance will come into force on 15 June, as more businesses open up and more pupils return to school. Also on Friday the UK became the second country to record more than 40,000 coronavirus-related deaths, after the US.The court of appeal in New South Wales, Australia, overturned a ban on a Black Lives Matter protest, which was imposed due to coronavirus concerns. Thousands flooded the streets of Sydney to commemorate African American George Floyd, who died in US police custody.In other news:How have you been affected by coronavirus? Please share your experiences by emailing haveyoursay@bbc.co.uk.Please include a contact number if you are willing to speak to a BBC journalist. ",6 June 2020,health
Coronavirus: Malaria drug hydroxychloroquine 'does not save lives',"A malaria drug that has been tested as a treatment for coronavirus does not save lives, one of the world's largest trials shows.Hydroxychloroquine received global attention after being promoted by Donald Trump, and then controversy after studies on it were retracted.The drug has now been pulled from the UK's Recovery trial, which is run by the University of Oxford.The findings have been passed on to the World Health Organization.Back at the start of the pandemic, laboratory studies had suggested the malaria drug could affect the virus. Small-scale studies in China and France then hinted it might help patients.There was a huge amount of hope, as the medicine is cheap and has been safely used to treat malaria and conditions such as lupus and arthritis.However, the evidence supporting its use for coronavirus has been weak.That is why the data from the Recovery trial is crucial. It is the first to test the drug in large numbers of people in a thorough clinical trial.More than 11,000 patients with Covid-19 are taking part, with 1,542 patients given hydroxychloroquine. Due to mounting controversy about the drug, the UK's drugs regulator last night asked the Oxford researchers to review their data. The results showed 25.7% of people taking hydroxychloroquine had died after 28 days. This compared with 23.5% who were given standard hospital treatment. ""This is not a treatment for Covid,"" said Prof Martin Landray, part of the Recovery trial. The trial immediately stopped using the drug. The findings come in the wake of deep concern in academic publishing that led to an article being retracted in the Lancet - one of the world's most prestigious medical journals.It had published a study involving nearly 15,000 patients, from hundreds of hospitals, given hydroxycholoroquine or the similar drug chloroquine. It concluded the drug was not beneficial and increased the risk of irregular heart rhythms and death. That publication led to the WHO suspending its trials of the anti-malaria drug.The data had been collected from hospitals by the little-known healthcare firm Surgisphere. Concerns were raised about the data and then some of the study's authors said they could no longer stand by their publication as Surgisphere would not allow an independent review.Then the New England Journal of Medicine retracted another paper that had data based on Surgisphere. Prof Peter Horby, from the University of Oxford which runs the Recovery trial, said: ""Hydroxychloroquine and chloroquine have received a lot of attention and have been used very widely to treat Covid patients despite the absence of any good evidence. ""Although it is disappointing that this treatment has been shown to be ineffective, it does allow us to focus care and research on more promising drugs.""Follow James on Twitter.",5 June 2020,health
