Apple Mac computers make jump to its own chips,"Apple has confirmed it will transition its Mac laptop and desktop computers to its own ARM-based processors.The move means that Macs will run on the same type of chips as the firm's iPhones and iPads, rather than Intel's.Intel had faced problems manufacturing its own designs, leading it to issue a public apology to computer-makers.Apple's challenge will be to carry off the transition smoothly and convince third-party developers to update their apps accordingly.""We expect to ship our first Mac with Apple silicon by the end of the year,"" said chief executive Tim Cook, adding that it would likely be two years before its full product line had made the jump.The firm said the move would allow it to offer new features and improved performance as well as making it easier for developers to ""write and optimise software for the entire Apple ecosystem"".The announcement was made at Apple's annual Worldwide Developers Conference (WWDC).""Apple's motivations for doing this include reducing its dependence on Intel, maximizing its silicon investment, boosting performance and giving itself more flexibility and agility when it comes to future products,"" commented Geoff Blaber from the consultancy CCS Insight.""Embracing ARM and making its hardware more consistent across the iPhone, iPad and Mac ranges is a strategic necessity, but there will be inevitable bumps along the road.""Apple said it had already developed native versions of several of its own apps, including Final Cut Pro X and Logic Pro.  iPhone and iPad apps will also be able to be run on the computers.Apple said that Microsoft was working on an optimised version of Office, and Adobe was developing a version of Photoshop.Other developers should be able to recompile their apps to get a version running ""in just a matter of days,"" said the company's software chief Craig Federighi. He added that old apps would automatically be translated at point of installation to run, although they would not work as well.To mark the significance of the move, MacOS will move to version 11. Since 2001, it had only moved from 10.0 to 10.15.Apple successfully made the switch from IBM-Motorola's PowerPC processors to Intel's x86 family in 2006.However, some software was never updated and cannot easily be run on today's Mac computers. Apple dropped support for running older software under emulation in the 2011 release of its Mac operating system.Microsoft already allows Windows 10 to be run on both Intel and ARM-based processors and looks set to continue supporting both chip architectures.Apple has not stated how long it will do the same. As a result, some people considering buying one of its laptop or desktop computers may decide to postpone a purchase until its first ARM-based computers go on sale.This could hit sales both at Apple and the development studios that make software for the platform.ARM-based chips are based on the designs of the UK-based company, which is headquartered in Cambridge. Other companies then adapt these to add capabilities of their own.Samsung, Qualcomm and Huawei are among the many other companies to do so.Apple is the fourth-largest PC vendor, according to market research firm Gartner, coming behind Lenovo, HP, and Dell.The company has said that it has more than 100 million active Mac users. Back in June 2005, when it first announced the move to Intel chips, the figure was about 12.5 million.""Apple is approximately 4.5% of the laptop market and 2.6% of the desktop market, so the financial impact to Intel will not be significant,"" commented Gartner's Jon Erensen.""However, this transition... could give momentum to Microsoft's current efforts to run Windows on Qualcomm's Snapdragon processors."" Existing Mac owners will see changes to the next MacOS operating system - called Big Sur - which Apple said marked its biggest redesign to date. Analysis by James Clayton, North America technology reporterThe best way to describe a processor is the brain of the computer. Hardly surprising then that the processor in your computer is kind of important. Changing it is no small thing - and Apple hasn't decided this lightly.The big question though - and the one that if you're reading this you're probably more interested in - is what will this do for Macs in general?The prevailing view in Silicon Valley is moving to Apple silicon will make for more powerful Macs.Bringing it in-house could create cheaper processors - so in theory you could have cheaper Macs (that's if Apple wanted to pass on savings to the consumer). But there are risks too. The first is that Apple still has Intel-based Macs yet to come out. Will people simply wait for Apple's new processor to go live before choosing to buy a new computer? And - considering how well Mac products sell there will be a nervousness about changing a formula that has worked very well for Apple for the last 15 years. Other announcements at WWDC included the ability to use an iPhone as a substitute for a car key by transmitting an NFC (near-field communication) signal to unlock doors and start the engine.This will initially be limited to some new BMWs, but the firm said it intended to expand to other models in time.Sad to say I am not changing my car to use my iPhone as a key but I am sure #BMW customers are interested in this given #Samsung got a lot of traction with it #WWDC20 pic.twitter.com/JXsWcuajZmEnd of Twitter post  by @caro_milanesiApp developers will also have to provide more information about the data they gather about users, so that Apple can display a summary to them before they install the software.By surfacing apps wanting your location or to track you, Apple is educating consumers and heightening their awareness of the situation. Creates more interest and desire for their privacy stance.End of Twitter post  by @BenBajarinOne of the biggest changes to the iPhone's iOS14 operating system will be a shake-up of the home screen.Apps can now be automatically organised into folders containing:In addition, the firm is updating its ""widgets"" - blocks that display a stripped-down, small app window - so that they can be placed among the icons for other programs. Examples included weather forecasts, news briefings, and calendar meetings. Android already has something similar.Another Android-like new feature is the introduction of App Clips, which allow part of a program to be downloaded quickly. These must be less than 10 megabytes in size and will be able to be triggered via an NFC-transmission or by scanning a QR code. Suggested uses included the ability to order a drink in a cafe or to pay for a car-parking space.Apple is also releasing a new app called Translate that carries out language translations offline, offering an alternative to Google Translate.It will support 11 languages to begin with including English, Mandarin, French, German, and Arabic.#iOS14 leverages UI ideas from past #android releases, but only in a more elegant way @Apple #WWDCEnd of Twitter post  by @waynesworldFor the first time, users will be able to set third-party email and web browser apps as the default in iOS, rather than Apple's own software.The UK and Ireland will be among countries given access to an overhauled version of its Maps app, which provides more detailed views of roads and paths than before - as well as new cycling directions and routes for electric cars that pass charging stations.And its MeMoji cartoon-like characters now feature new styling options, including the addition of protective face masks.Apple's tablet operating system iPadOS will also benefit from several enhancements to its Pencil stylus.These include:The next version of WatchOS adds sleep-tracking functionality to the firm's smartwatch - which will be based on a user's movements in bed.It also adds the ability to determine when the owner is washing their hands, in order to confirm whether they have done so for long enough to help protect against Covid-19.It wouldn't surprise me if the new hand-washing app on Apple Watch and face mask Memojis emerges as some of the big stories of WWDC. I never cease to be amazed how gimmicks like this capture the public's imagination #WWDC20 pic.twitter.com/5J2TUUjQbdEnd of Twitter post  by @benwoodI haven't been coached to wash my hands since elementary school 🧼⌚️ #wwdcEnd of Twitter post  by @vthielkeIn addition, the wearable will allow third-party ""curated"" watch faces to be shared and installed. The Activity app - which is now renamed Fitness - will track calories used for various dance styles.Apple's AirPod Pro earphones will gain spatial audio to recreate a cinema-style surround sound experience. They will also automatically switch between a user's Apple devices as the owner moves from one to another.And the firm's Apple TV set-top box will soon allow compatible third-party video doorbells to live-stream footage of visitors to television screens, while iOS 14 will make it possible to use facial recognition to identify them.This will only work with members of the owner's family and friends, who need to be tagged in advance.",22 June 2020,technology
Apple's annual developer showcase overshadowed by app row,"Apple is facing mounting pressure over how it runs its app store ahead of its major global developers' conference, which starts on Monday.The firm has been accused of creating ""hostile"" policies within its fee structure, and is dealing with two EU competition probes announced this week.But it is also embroiled in a row with some of its own developers.That has now widened into a debate involving politicians and other major technology firms. Apple's Worldwide Developers Conference often features new product announcements but is mainly an event for software developers working on Apple's platforms - some of whom are now voicing discontent about its pricing.The argument was ignited in part by an email app called Hey, created by developer David Heinemeier Hansson. It had an update rejected by the Apple app store early this week because it does not allow in-app purchases - from which Apple takes a 30% cut.Many developers do not offer in-app subscriptions to avoid that levy - or raise the price of in-app subscriptions for the end user.But not all apps are affected, Mr Hansson says. He pointed to email apps from Gmail and Microsoft's Outlook, which he says are treated differently, but which Apple would not discuss with him. Hey's annual subscription of $99 (£80) is available only directly from the company online, and the app does not tell users where to buy it - so the firm believed it was following all the rules, similar to other email apps.But Apple told him the app should never have been approved in the first place - and could be removed.""If we don't like the deal Apple is offering us - which is to either pay them 30% or get kicked out - what are we going to do about that? Where are we going to go?"" he told the BBC.""If you launch a new piece of software today, and you're not available on the iPhone, you're invisible.""The cry has now been taken up by others, including blogger John Gruber, whose blog, Daring Fireball, is widely read among Apple developers. He wrote that if Hey's issues were not a mistake, the decision was ""outrageous"".Such issues are behind an anti-competition probe announced by the EU this week, prompted by a complaint from Spotify. The Swedish firm also takes issue with Apple's approach to charging subscriptions and the cut it takes.The anti-competition probe, coinciding with the row over Hey's business model, has snowballed into a much bigger argument.Microsoft President Brad Smith entered the debate, saying that regulators on both sides of the Atlantic should have a ""focused conversation"" about app stores and the rules in place - though he did not mention Apple by name.Microsoft has itself been the subject of competition probes, hit with hefty fines over its dominant market position with Microsoft Windows and its web browser.But he said the restrictions and demands placed on developers today are far higher than anything that existed 20 years ago, at the height of Microsoft's software dominance.Facebook, meanwhile, told the New York Times that its Gaming app had been rejected from Apple's app store five times.Sources who spoke to the newspaper said it might be because the app offers simple games that do not have to be downloaded in the traditional way - through Apple's store.Even the chairman of the House antitrust committee - the group of politicians that deals with competition law in the United States - has voiced his concern.""Because of the market power that Apple has, it is charging exorbitant rents - highway robbery, basically - bullying people to pay 30% or denying access to their market,"" David Cicilline told The Verge.""It's crushing small developers who simply can't survive with those kinds of payments. If there were real competition in this marketplace, this wouldn't happen.""The committee has asked the heads of major tech companies - including Tim Cook at Apple - to attend a session about competition in the tech sector. Mr Cook, it is reported, has yet to agree to attend.But despite the international attention on Apple's policies, its head of marketing, Phil Schiller, told Techcrunch the company was not considering any changes to its rules.",19 June 2020,technology
Apple claims 'half a trillion dollars' App Store economy,"Apple has said that its App Store ecosystem ""facilitated half a trillion dollars"" of trade in 2019.The firm said more than 85% of that figure occurred via transactions from which it did not take a commission.The announcement comes at a time Apple and other US tech giants are facing increased anti-competition scrutiny.A leading developer has also called on the iPhone-maker to lower the fees it charges, ahead of its annual developers' conference next week.An Apple representative told the BBC that it was proud of the commerce that it had enabled and welcomed scrutiny of its App Store.The study was commissioned by Apple but carried out by economists at the Boston-based consultancy Analysis Group.It surveyed billings and sales related to apps running on the tech firm's iOS, Mac, Watch and Apple TV platforms.This included:The report attempted to account for spending that occurred externally but led to content being used within an app - for example a direct payment to Spotify, whose songs were then listened to via its iPhone app.Likewise it subtracted a proportion of the charge of in-app purchases whose content was used elsewhere - for example a Now TV subscription taken out via Sky's app, if most of the shows were then watched directly on a TV's own app.In total, the economists said $519bn (£406bn) had been generated via Apple's software ecosystem. The figure excludes sales generated by the Android and Windows versions of the same products. Physical goods and offline services accounted for the biggest share of the sum - $413bn.By contrast, digital goods and services - from which Apple typically takes a 30% cut - accounted for $61bn.(Sales in billions of dollars)The study's publications coincides with a call by the US House Judiciary Committee for Apple's chief executive Tim Cook and other tech leaders to answer questions about anti-trust concerns, according to reports.News site Axios said on Friday that the committee also planned to compel Apple, Google, Amazon and Facebook to disclose internal documents about their digital markets if they did not share them voluntarily.And in Europe, Rakuten's e-book division Kobo and the music streaming service Spotify are both urging the European Commission to carry out its own investigation into the fact the US company takes a cut from in-app fees while running competing platforms of its own - Apple Books and Apple Music.Apple plans to host its Worldwide Developers Conference next week. Ahead of the event, a leading software developer published his own list of concerns about Apple's business practices.Among changes called for by Wil Shipley - who co-founded Omni Group before going on to run Delicious Monster Software - were:""Apple has a market cap of about $1.5tn and it extracts more margin than any other company from the mobile phone market,"" commented Ben Wood from the consultancy CCS Insight.""It's keen to remind people that it has had to work to build this platform. But now it has become so powerful, it's unsurprising that people are questioning whether the original terms of engagement are still fair.""",15 June 2020,technology
Apple's annual developer showcase overshadowed by app row,"Apple is facing mounting pressure over how it runs its app store ahead of its major global developers' conference, which starts on Monday.The firm has been accused of creating ""hostile"" policies within its fee structure, and is dealing with two EU competition probes announced this week.But it is also embroiled in a row with some of its own developers.That has now widened into a debate involving politicians and other major technology firms. Apple's Worldwide Developers Conference often features new product announcements but is mainly an event for software developers working on Apple's platforms - some of whom are now voicing discontent about its pricing.The argument was ignited in part by an email app called Hey, created by developer David Heinemeier Hansson. It had an update rejected by the Apple app store early this week because it does not allow in-app purchases - from which Apple takes a 30% cut.Many developers do not offer in-app subscriptions to avoid that levy - or raise the price of in-app subscriptions for the end user.But not all apps are affected, Mr Hansson says. He pointed to email apps from Gmail and Microsoft's Outlook, which he says are treated differently, but which Apple would not discuss with him. Hey's annual subscription of $99 (£80) is available only directly from the company online, and the app does not tell users where to buy it - so the firm believed it was following all the rules, similar to other email apps.But Apple told him the app should never have been approved in the first place - and could be removed.""If we don't like the deal Apple is offering us - which is to either pay them 30% or get kicked out - what are we going to do about that? Where are we going to go?"" he told the BBC.""If you launch a new piece of software today, and you're not available on the iPhone, you're invisible.""The cry has now been taken up by others, including blogger John Gruber, whose blog, Daring Fireball, is widely read among Apple developers. He wrote that if Hey's issues were not a mistake, the decision was ""outrageous"".Such issues are behind an anti-competition probe announced by the EU this week, prompted by a complaint from Spotify. The Swedish firm also takes issue with Apple's approach to charging subscriptions and the cut it takes.The anti-competition probe, coinciding with the row over Hey's business model, has snowballed into a much bigger argument.Microsoft President Brad Smith entered the debate, saying that regulators on both sides of the Atlantic should have a ""focused conversation"" about app stores and the rules in place - though he did not mention Apple by name.Microsoft has itself been the subject of competition probes, hit with hefty fines over its dominant market position with Microsoft Windows and its web browser.But he said the restrictions and demands placed on developers today are far higher than anything that existed 20 years ago, at the height of Microsoft's software dominance.Facebook, meanwhile, told the New York Times that its Gaming app had been rejected from Apple's app store five times.Sources who spoke to the newspaper said it might be because the app offers simple games that do not have to be downloaded in the traditional way - through Apple's store.Even the chairman of the House antitrust committee - the group of politicians that deals with competition law in the United States - has voiced his concern.""Because of the market power that Apple has, it is charging exorbitant rents - highway robbery, basically - bullying people to pay 30% or denying access to their market,"" David Cicilline told The Verge.""It's crushing small developers who simply can't survive with those kinds of payments. If there were real competition in this marketplace, this wouldn't happen.""The committee has asked the heads of major tech companies - including Tim Cook at Apple - to attend a session about competition in the tech sector. Mr Cook, it is reported, has yet to agree to attend.But despite the international attention on Apple's policies, its head of marketing, Phil Schiller, told Techcrunch the company was not considering any changes to its rules.",19 June 2020,technology
Apple claims 'half a trillion dollars' App Store economy,"Apple has said that its App Store ecosystem ""facilitated half a trillion dollars"" of trade in 2019.The firm said more than 85% of that figure occurred via transactions from which it did not take a commission.The announcement comes at a time Apple and other US tech giants are facing increased anti-competition scrutiny.A leading developer has also called on the iPhone-maker to lower the fees it charges, ahead of its annual developers' conference next week.An Apple representative told the BBC that it was proud of the commerce that it had enabled and welcomed scrutiny of its App Store.The study was commissioned by Apple but carried out by economists at the Boston-based consultancy Analysis Group.It surveyed billings and sales related to apps running on the tech firm's iOS, Mac, Watch and Apple TV platforms.This included:The report attempted to account for spending that occurred externally but led to content being used within an app - for example a direct payment to Spotify, whose songs were then listened to via its iPhone app.Likewise it subtracted a proportion of the charge of in-app purchases whose content was used elsewhere - for example a Now TV subscription taken out via Sky's app, if most of the shows were then watched directly on a TV's own app.In total, the economists said $519bn (£406bn) had been generated via Apple's software ecosystem. The figure excludes sales generated by the Android and Windows versions of the same products. Physical goods and offline services accounted for the biggest share of the sum - $413bn.By contrast, digital goods and services - from which Apple typically takes a 30% cut - accounted for $61bn.(Sales in billions of dollars)The study's publications coincides with a call by the US House Judiciary Committee for Apple's chief executive Tim Cook and other tech leaders to answer questions about anti-trust concerns, according to reports.News site Axios said on Friday that the committee also planned to compel Apple, Google, Amazon and Facebook to disclose internal documents about their digital markets if they did not share them voluntarily.And in Europe, Rakuten's e-book division Kobo and the music streaming service Spotify are both urging the European Commission to carry out its own investigation into the fact the US company takes a cut from in-app fees while running competing platforms of its own - Apple Books and Apple Music.Apple plans to host its Worldwide Developers Conference next week. Ahead of the event, a leading software developer published his own list of concerns about Apple's business practices.Among changes called for by Wil Shipley - who co-founded Omni Group before going on to run Delicious Monster Software - were:""Apple has a market cap of about $1.5tn and it extracts more margin than any other company from the mobile phone market,"" commented Ben Wood from the consultancy CCS Insight.""It's keen to remind people that it has had to work to build this platform. But now it has become so powerful, it's unsurprising that people are questioning whether the original terms of engagement are still fair.""",15 June 2020,technology
