Trump signs executive order targeting Twitter after fact-checking row,"US President Donald Trump has signed an executive order aimed at removing some of the legal protections given to social media platforms.He said the firms had ""unchecked power"" to censure and edit the views of users.President Trump has regularly accused platforms such as Twitter and Facebook of stifling conservative voices.The order, which is expected to face legal challenges, comes after Twitter decided to append fact-check labels to two of his tweets this week.On Wednesday Mr Trump accused the company of election interference after it added a warning label to the tweets about claims of widespread fraud in mail-in voting - also known as postal votes.Twitter and other social media platforms strongly condemned the executive order.And early on Friday, Twitter hid one of President Trump's tweets from his profile, saying it violates rules about glorifying violence.Under a 1996 law, website operators, unlike traditional publishers, cannot generally be held responsible for content posted by users.The sites are also protected from lawsuits if they block posts deemed obscene, violent ""or otherwise objectionable, whether or not such material is constitutionally protected"".The executive order argues that this immunity should no longer apply if a social network edits posts, such as by adding a warning or a label. It also says ""deceptive"" blocking, including removing a post for reasons other than those described in a website's terms of service, should not be protected.Republican Senator Marco Rubio is among those arguing that the platforms take on the role of a ""publisher"" when they add fact-check labels to posts.""The law still protects social media companies like Twitter because they are considered forums not publishers,"" Mr Rubio said.""But if they have now decided to exercise an editorial role like a publisher, then they should no longer be shielded from liability."" The executive order also calls for the Federal Communications Commission (FCC) to spell out what type of content blocking will be considered deceptive or inconsistent with a service provider's terms and conditions.Donald Trump promised ""big action"" in response to Twitter's decision to append a fact-check message to two of his posts. While his announcement of an executive order was heavy on rhetoric - accusing social media companies of being monopolies that threaten free speech - it will be a long process before the talk turns into real action, big or otherwise.Independent government agencies will have to review federal law, promulgate new regulations, vote on them and then - in all likelihood - defend them in court. By the time it's all over, the November presidential election could have come and gone.That explains why Trump is also pushing for new congressional legislation - a more straightforward way of changing US policy toward social media companies. The real purpose of the president's order, however, may be symbolic. At the very least, the move will cause Twitter to think twice about attempting to moderate or fact-check his posts on their service. The president relies on Twitter to get his message out without filtering from the mainstream media. If Twitter itself start blunting one of his favourite communication tools, he is sending a message that he will push back - and make things, at a minimum, uncomfortable for the company.Twitter called the order ""a reactionary and politicized approach to a landmark law,"" adding that Section 230 ""protects American innovation and freedom of expression, and it's underpinned by democratic values"".Google, which owns YouTube, said changing Section 230 would ""hurt America's economy and its global leadership on internet freedom.""""Our platforms have empowered a wide range of people and organizations from across the political spectrum, giving them a voice and new ways to reach their audiences,"" the firm said in a statement to the BBC.In an interview with Fox News on Wednesday, Facebook's chief executive, Mark Zuckerberg, said censoring a social media platform would not be the ""right reflex"" for a government concerned about censorship. ""I just believe strongly that Facebook shouldn't be the arbiter of truth of everything that people say online,"" said Mr Zuckerberg. The long-running dispute between Mr Trump and social media companies flared up again on Tuesday, when two of his posts were given a fact-check label by Twitter for the first time.He had tweeted, without providing evidence: ""There is no way (zero) that mail-in ballots will be anything less than substantially fraudulent.""Twitter added a warning label to the post and linked to a page describing the claims as ""unsubstantiated"".Then on Wednesday, Mr Trump threatened to ""strongly regulate"" social-media platforms.He tweeted to his more than 80 million followers that Republicans felt the platforms ""totally silence conservatives"", and that he would not allow this to happen. In an earlier tweet, he said Twitter was ""completely stifling free speech"".Twitter's chief executive, Jack Dorsey, responded to criticism of the platform's fact-checking policies in a series of posts, saying: ""We'll continue to point out incorrect or disputed information about elections globally.""Fact check: there is someone ultimately accountable for our actions as a company, and that’s me. Please leave our employees out of this. We’ll continue to point out incorrect or disputed information about elections globally. And we will admit to and own any mistakes we make.End of Twitter post  by @jackTwitter has tightened its policies in recent years, as it faced criticism that its hands-off approach allowed fake accounts and misinformation to thrive.",29 May 2020,technology
Thousands of TalkTalk users hit by internet problems,"Tens of thousands of TalkTalk customers reported problems with their internet connection on Friday morning.Popular tracking website DownDetector logged more than 30,000 reports beginning at around 10:00 BST, scattered across the UK.TalkTalk's Twitter feed was flooded with reports from users trying to work from home without internet.The firm said the problem was fixed at around 11:30 BST, but it did not provide any details about the cause.""We're aware that some customers were unable to access certain websites for a short period earlier today,"" the company said in a statement.""The issue has now been resolved and we apologise for any inconvenience this may have caused.""Earlier, it had suggested that some services were unaffected by the problem. We're aware that some customers were unable to access certain websites for a short period earlier today. The issue has now been resolved and we apologise for any inconvenience this may have causedEnd of Twitter post  by @TalkTalkThe scale of the failure is similar to one that struck Virgin Media a month ago, which caused intermittent problems until the following morning.At the time, Virgin blamed the problem on ""a technical fault in our core network"".",29 May 2020,technology
Uber destroys thousands of bikes and scooters,"Uber is destroying thousands of electric bikes and scooters, after selling its Jump business to Lime.Videos of its red bikes being crushed at a US recycling centre were shared on social media, angering cycling advocates.Uber said it had decided to destroy thousands of its older-model vehicles due to maintenance, liability and safety concerns.In the UK, Uber continues to operate Jump and has not scrapped any bikes.A spokesman told the BBC the sale of Jump to Lime had not been completed in Europe, and that Jump continued to operate ""as normal"" in London.In 2018, Uber said it would focus more on its electric bike and scooter business than on cars.But on 7 May this year, Uber announced a deal that saw Lime take over the Jump bike business.As part of the deal, Uber invested $170m (£139m) in Lime, while Lime acquired ""tens of thousands"" of Uber's Jump bikes - and the associated intellectual property.Lime's chief executive Wayne Ting has said he prefers the design of Uber's bikes and will deploy more of them in the future.However, there were also ""tens of thousands"" of older-model bikes that Lime did not inherit as part of the deal.Videos shared on Twitter show the bikes arriving at a recycling facility in North Carolina to be destroyed.Disappointed charities and organisations suggested the bikes could have been donated to community groups, or sold to individuals to boost the uptake of electric bikes.""Why not at least peel the decals [branding] off and sell the bikes to individuals?"" Jon Orcutt of Bike New York, a non-profit group, told news site Motherboard.""We explored donating the remaining, older-model bikes,"" Uber said in a statement.""But given many significant issues - including maintenance, liability, safety concerns, and a lack of consumer-grade charging equipment - we decided the best approach was to responsibly recycle them.""",28 May 2020,technology
Facebook dominates cases of recorded social media grooming,"Police in England and Wales recorded more than 10,000 online grooming offences on social media over two-and-a-half years.Where the method was recorded, more than half - 55% - took place on a Facebook-owned app.The figures come from freedom of information requests lodged by child protection charity the NSPCC. It is calling for the government to introduce stronger protections, warning that the rate of offences is rising.Just under a quarter of recorded offences - 23% - took place in the six months to October last year, the most recent period for which data is available.The data covers the first 30 months since the introduction of a law that made sexual communication with a child an explicit offence. In that time, police in the two nations recorded 10,119 offences. But police only recorded the platform used in 5,784 of those cases.Of those, more than half took place on a Facebook platform - including Facebook itself, its messenger app, Instagram, and Whatsapp. Instagram was the most common method among the Facebook-owned app, with 1,630 recorded offences - 16% of the total. Of 5,784 reports where the method of communication was recorded by policeThe NSPCC has previously warned that Facebook's shift to tightly encrypted messaging would aid offenders, and shareholders recently tried to block its plans for encryption on that basis.A Facebook spokesperson said: ""There is no place for grooming or child exploitation on our platforms, and we use technology to proactively find and quickly remove it.""We have a content and security team of over 35,000 people investigating reports from our community and working to keep our platforms safe. Our teams also work closely with child protection experts and law enforcement, reporting content directly to specialists.""Another 1,060 offences (18%) were recorded as taking place on Snapchat, owned by Snap Inc. It also said the exploitation of young people is absolutely unacceptable, and that eliminating such abuse was a priority for the company. The rest of the cases were made up of small numbers of cases across dozens of other platforms such as text messaging, online gaming, or websites.Because the data begins in early 2017 and runs to October 2019, it may not account for the most recent trends in platforms that young people use.The NSPCC says its information demonstrates the need for new regulation, and warned that the coronavirus lockdown had created ""a perfect storm for abusers"".It is calling for the government to push ahead with the proposed Online Harms Bill within 18 months.NSPCC chief executive Peter Wanless said: ""Child abuse is an inconvenient truth for tech bosses who have failed to make their sites safe and enabled offenders to use them as a playground in which to groom our kids.""Now is the time to get regulation done and create a watchdog with the teeth to hold tech directors criminally accountable if their platforms allow children to come to serious but avoidable harm.""",29 May 2020,technology
Trading Standards squad targets anti-5G USB stick,"Trading Standards officers are seeking to halt sales of a device that has been claimed to offer protection against the supposed dangers of 5G via use of quantum technology.Cyber-security experts say the £339 5GBioShield appears to no more than a basic USB drive.""We consider it to be a scam,"" Stephen Knight, operations director for London Trading Standards told the BBC.His said his team is working with City of London Police's Action Fraud squad.They are seeking a court order to take down the company's website.""People who are vulnerable need protection from this kind of unscrupulous trading,"" he added.The intervention follows an examination of the device, which was first reported by the BBC.The vendor - BioShield Distribution - had previously said the device was backed by ""research"", but has not responded to the latest development.The rollout of the new 5G mobile networks began in the UK only last summer and has not yet reached outside urban areas. Yet across the country there is already a cottage industry offering protection against the supposed negative health effects, even though they have been dismissed by regulators and mainstream scientists.The 5GBioShield was recommended by a member of Glastonbury Town Council's 5G Advisory Committee, which has called for an inquiry into 5G. One of nine external members, Toby Hall, said: ""We use this device and find it helpful,"" and provided a link to its website, which describes it as a USB key that ""provides protection for  your home and family, thanks to the wearable holographic nano-layer catalyser, which can be worn or placed near to a smartphone or any other electrical, radiation or EMF [electromagnetic field] emitting device"".""Through a process of quantum oscillation, the 5GBioShield USB key balances and re-harmonises the disturbing frequencies arising from the electric fog induced by devices, such as laptops, cordless phones, wi-fi, tablets, et cetera,"" it adds.Each of these USB keys costs £339.60 including VAT, though there is a special offer of three for £958.80.But, at first sight, it seems to be just that - a USB key, with just 128MB of storage.""So what's different between it and a virtually identical 'crystal' USB key available from various suppliers in Shenzhen, China, for around £5 per key?"" asks Ken Munro, whose company, Pen Test Partners, specialises in taking apart consumer electronic products to spot security vulnerabilities.And the answer appears to be a circular sticker. ""Now, we're not 5G quantum experts but said sticker looks remarkably like one available in sheets from stationery suppliers for less than a penny each,"" he says.Mr Munro and his colleague Phil Eveleigh proceeded to dismantle the USB key to find out if there were any whizz-bang electronics inside. But all they found was an LED light on the circuit board, similar to those on any other USB key.Their conclusion was that trading standards bodies should carry out their own investigations.A search in Companies House shows the two directors of BioShield Distribution are Anna Grochowalska and Valerio Laghezza. Both of them appear to have been involved previously in a business called Immortalis, which sells a dietary supplement called Klotho Formula. Its website - rather similar in design to that of the BioShield - says Klotho Formula uses a ""proprietary procedure that leads to relativistic time dilation and biological quantum entanglement at the DNA level"".Ms Grochowalska told BBC News her company was the sole global distributor of the 5GBioShield -  but it did not manufacture or own the product. ""We are in possession of a great deal of technical information, with plenty of back-up historical research,"" she said.""As you can understand, we are not authorised to fully disclose all this sensitive information to third parties, for obvious reasons.""And she rejected the suggestion selling a £5 product for more than £300 was unreasonable.""In regard to the costs analysis your research has produced, I believe that the lack of in-depth information will not drive you to the exact computation of our expenses and production costs, including the cost of IP [intellectual property rights], and so on,"" she said.""It is therefore hard to take your evaluation seriously, since you have evidently not researched the background facts in any meaningful way.""Mr Hall said his remarks in Glastonbury Town Council's 5G Advisory Committee report should not be seen as a recommendation to buy the product.But he had no regrets about buying it and since plugging it in had felt beneficial effects, including being able to sleep through the night and having more dreams. ""I also felt a 'calmer' feel to the home,"" he told BBC News.And he had thought the company might be able to develop a system that could offer protection to the whole town of Glastonbury against the effects of radiation from electromagnetic fields.It's worth noting though that the regulator Ofcom has published the results of EMF measurements at 16 sites, which were taken following the launch of 5G. It said that in each case, emissions were ""a small fraction"" of the levels deemed safe under international guidelines.",28 May 2020,technology
Trump signs executive order targeting Twitter after fact-checking row,"US President Donald Trump has signed an executive order aimed at removing some of the legal protections given to social media platforms.He said the firms had ""unchecked power"" to censure and edit the views of users.President Trump has regularly accused platforms such as Twitter and Facebook of stifling conservative voices.The order, which is expected to face legal challenges, comes after Twitter decided to append fact-check labels to two of his tweets this week.On Wednesday Mr Trump accused the company of election interference after it added a warning label to the tweets about claims of widespread fraud in mail-in voting - also known as postal votes.Twitter and other social media platforms strongly condemned the executive order.And early on Friday, Twitter hid one of President Trump's tweets from his profile, saying it violates rules about glorifying violence.Under a 1996 law, website operators, unlike traditional publishers, cannot generally be held responsible for content posted by users.The sites are also protected from lawsuits if they block posts deemed obscene, violent ""or otherwise objectionable, whether or not such material is constitutionally protected"".The executive order argues that this immunity should no longer apply if a social network edits posts, such as by adding a warning or a label. It also says ""deceptive"" blocking, including removing a post for reasons other than those described in a website's terms of service, should not be protected.Republican Senator Marco Rubio is among those arguing that the platforms take on the role of a ""publisher"" when they add fact-check labels to posts.""The law still protects social media companies like Twitter because they are considered forums not publishers,"" Mr Rubio said.""But if they have now decided to exercise an editorial role like a publisher, then they should no longer be shielded from liability."" The executive order also calls for the Federal Communications Commission (FCC) to spell out what type of content blocking will be considered deceptive or inconsistent with a service provider's terms and conditions.Donald Trump promised ""big action"" in response to Twitter's decision to append a fact-check message to two of his posts. While his announcement of an executive order was heavy on rhetoric - accusing social media companies of being monopolies that threaten free speech - it will be a long process before the talk turns into real action, big or otherwise.Independent government agencies will have to review federal law, promulgate new regulations, vote on them and then - in all likelihood - defend them in court. By the time it's all over, the November presidential election could have come and gone.That explains why Trump is also pushing for new congressional legislation - a more straightforward way of changing US policy toward social media companies. The real purpose of the president's order, however, may be symbolic. At the very least, the move will cause Twitter to think twice about attempting to moderate or fact-check his posts on their service. The president relies on Twitter to get his message out without filtering from the mainstream media. If Twitter itself start blunting one of his favourite communication tools, he is sending a message that he will push back - and make things, at a minimum, uncomfortable for the company.Twitter called the order ""a reactionary and politicized approach to a landmark law,"" adding that Section 230 ""protects American innovation and freedom of expression, and it's underpinned by democratic values"".Google, which owns YouTube, said changing Section 230 would ""hurt America's economy and its global leadership on internet freedom.""""Our platforms have empowered a wide range of people and organizations from across the political spectrum, giving them a voice and new ways to reach their audiences,"" the firm said in a statement to the BBC.In an interview with Fox News on Wednesday, Facebook's chief executive, Mark Zuckerberg, said censoring a social media platform would not be the ""right reflex"" for a government concerned about censorship. ""I just believe strongly that Facebook shouldn't be the arbiter of truth of everything that people say online,"" said Mr Zuckerberg. The long-running dispute between Mr Trump and social media companies flared up again on Tuesday, when two of his posts were given a fact-check label by Twitter for the first time.He had tweeted, without providing evidence: ""There is no way (zero) that mail-in ballots will be anything less than substantially fraudulent.""Twitter added a warning label to the post and linked to a page describing the claims as ""unsubstantiated"".Then on Wednesday, Mr Trump threatened to ""strongly regulate"" social-media platforms.He tweeted to his more than 80 million followers that Republicans felt the platforms ""totally silence conservatives"", and that he would not allow this to happen. In an earlier tweet, he said Twitter was ""completely stifling free speech"".Twitter's chief executive, Jack Dorsey, responded to criticism of the platform's fact-checking policies in a series of posts, saying: ""We'll continue to point out incorrect or disputed information about elections globally.""Fact check: there is someone ultimately accountable for our actions as a company, and that’s me. Please leave our employees out of this. We’ll continue to point out incorrect or disputed information about elections globally. And we will admit to and own any mistakes we make.End of Twitter post  by @jackTwitter has tightened its policies in recent years, as it faced criticism that its hands-off approach allowed fake accounts and misinformation to thrive.",29 May 2020,technology
Thousands of TalkTalk users hit by internet problems,"Tens of thousands of TalkTalk customers reported problems with their internet connection on Friday morning.Popular tracking website DownDetector logged more than 30,000 reports beginning at around 10:00 BST, scattered across the UK.TalkTalk's Twitter feed was flooded with reports from users trying to work from home without internet.The firm said the problem was fixed at around 11:30 BST, but it did not provide any details about the cause.""We're aware that some customers were unable to access certain websites for a short period earlier today,"" the company said in a statement.""The issue has now been resolved and we apologise for any inconvenience this may have caused.""Earlier, it had suggested that some services were unaffected by the problem. We're aware that some customers were unable to access certain websites for a short period earlier today. The issue has now been resolved and we apologise for any inconvenience this may have causedEnd of Twitter post  by @TalkTalkThe scale of the failure is similar to one that struck Virgin Media a month ago, which caused intermittent problems until the following morning.At the time, Virgin blamed the problem on ""a technical fault in our core network"".",29 May 2020,technology
