Twitter hides Trump tweet for 'glorifying violence',"Twitter has hidden one of President Donald Trump's tweets from his profile, saying it violates rules about glorifying violence.But instead of being deleted, it has been replaced with a warning and can be viewed by clicking on it.The warning says ""Twitter has determined that it may be in the public's interest for the Tweet to remain accessible.""It is the latest in an escalating row between Twitter and the White House.Mr Trump was tweeting about the US city of Minneapolis, which has seen consecutive nights of protests following the death of a black man in police custody.The president said he would ""send in the National Guard"", and followed that up with a warning that ""when the looting starts, the shooting starts.""That second tweet was hidden by Twitter for ""glorifying violence"".Hours later, the official White House account tweeted a copy of the president's words, which Twitter has yet to take any action on.Twitter's policy of adding a warning to, rather than deleting, tweets that break its rules when it comes to major public figures was announced in mid-2019. But the social network has never used it on Mr Trump - nor deleted any of his tweets before.""This is the bravest and riskiest thing I've ever seen Twitter - or any social media giant - do,"" said Carl Miller, from the Centre for the Analysis of Social Media at UK-based think-tank Demos.""This pours rocket fuel over the online-harm-versus-free-speech debate. Online content policy doesn't get more incendiary than this.""The same post remains unaltered on Facebook, without any warning attached.For years Twitter resisted calls to treat Donald Trump like any other user and make him follow its rules. Then, on Wednesday, it made a first small move, not removing a tweet but adding a fact-checking link. The company then had two choices - hunker down and weather the storm or continue to take action in accordance with its stated rules. It has now chosen the latter course of action,  calling the President out for glorifying violence. Any other user would have had their tweet removed, and might have seen their account suspended. It now looks as though there is no easy way out for either of the two adversaries - a huge battle over the limits of free speech and the rights of social media firms to moderate content is looming.The move means that other users will not be able to like, reply, or retweet it, Twitter said - but would still be able to retweet with a comment attached.In a Twitter thread, the social network said: ""This tweet violates our policies regarding the glorification of violence based on the historical context of the last line, its connection to violence, and the risk it could inspire similar actions today.""The ""historical context"" is a reference to the phrase ""when the looting starts, the shooting starts"" coined by Miami Police Chief Walter Headley in 1967, in reference to his aggressive policing policies in black neighbourhoods.A later US report found that his ""get tough"" policy, involving ""the frequent display of shotguns and dogs by Miami police in black neighbourhoods"" contributed to a state of agitation in the black community until the eruption of the 1968 Miami riot some eight months later.Twitter said: ""We've taken action in the interest of preventing others from being inspired to commit violent acts, but have kept the tweet on Twitter because it is important that the public still be able to see the tweet given its relevance to ongoing matters of public importance.""Hours after the warning was added, President Trump tweeted: ""Twitter is doing nothing about all of the lies & propaganda being put out by China or the Radical Left Democrat Party"" and alleged that the social network was targeting Republicans.Twitter is doing nothing about all of the lies & propaganda being put out by China or the Radical Left Democrat Party. They have targeted Republicans, Conservatives & the President of the United States. Section 230 should be revoked by Congress. Until then, it will be regulated!End of Twitter post  by @realDonaldTrumpHe directly referenced the executive order he signed the previous evening, aimed at removing some of the legal protections given to social media platforms.Earlier this week, Twitter used its fact-checking function to attach warnings to the president's tweets for the first time. That led the President to threaten to ""shut down"" the social networks over allegedly stifling free speech.The executive order signed by Mr Trump has no immediate effect on the social networks, however - it instead begins a lengthy process that may result in changes down the line.",29 May 2020,technology
Trump signs executive order targeting Twitter after fact-checking row,"US President Donald Trump has signed an executive order aimed at removing some of the legal protections given to social media platforms.He said the firms had ""unchecked power"" to censure and edit the views of users.President Trump has regularly accused platforms such as Twitter and Facebook of stifling conservative voices.The order, which is expected to face legal challenges, comes after Twitter decided to append fact-check labels to two of his tweets this week.On Wednesday Mr Trump accused the company of election interference after it added a warning label to the tweets about claims of widespread fraud in mail-in voting - also known as postal votes.Twitter and other social media platforms strongly condemned the executive order.And early on Friday, Twitter hid one of President Trump's tweets from his profile, saying it violates rules about glorifying violence.Under a 1996 law, website operators, unlike traditional publishers, cannot generally be held responsible for content posted by users.The sites are also protected from lawsuits if they block posts deemed obscene, violent ""or otherwise objectionable, whether or not such material is constitutionally protected"".The executive order argues that this immunity should no longer apply if a social network edits posts, such as by adding a warning or a label. It also says ""deceptive"" blocking, including removing a post for reasons other than those described in a website's terms of service, should not be protected.Republican Senator Marco Rubio is among those arguing that the platforms take on the role of a ""publisher"" when they add fact-check labels to posts.""The law still protects social media companies like Twitter because they are considered forums not publishers,"" Mr Rubio said.""But if they have now decided to exercise an editorial role like a publisher, then they should no longer be shielded from liability."" The executive order also calls for the Federal Communications Commission (FCC) to spell out what type of content blocking will be considered deceptive or inconsistent with a service provider's terms and conditions.Donald Trump promised ""big action"" in response to Twitter's decision to append a fact-check message to two of his posts. While his announcement of an executive order was heavy on rhetoric - accusing social media companies of being monopolies that threaten free speech - it will be a long process before the talk turns into real action, big or otherwise.Independent government agencies will have to review federal law, promulgate new regulations, vote on them and then - in all likelihood - defend them in court. By the time it's all over, the November presidential election could have come and gone.That explains why Trump is also pushing for new congressional legislation - a more straightforward way of changing US policy toward social media companies. The real purpose of the president's order, however, may be symbolic. At the very least, the move will cause Twitter to think twice about attempting to moderate or fact-check his posts on their service. The president relies on Twitter to get his message out without filtering from the mainstream media. If Twitter itself start blunting one of his favourite communication tools, he is sending a message that he will push back - and make things, at a minimum, uncomfortable for the company.Twitter called the order ""a reactionary and politicized approach to a landmark law,"" adding that Section 230 ""protects American innovation and freedom of expression, and it's underpinned by democratic values"".Google, which owns YouTube, said changing Section 230 would ""hurt America's economy and its global leadership on internet freedom.""""Our platforms have empowered a wide range of people and organizations from across the political spectrum, giving them a voice and new ways to reach their audiences,"" the firm said in a statement to the BBC.In an interview with Fox News on Wednesday, Facebook's chief executive, Mark Zuckerberg, said censoring a social media platform would not be the ""right reflex"" for a government concerned about censorship. ""I just believe strongly that Facebook shouldn't be the arbiter of truth of everything that people say online,"" said Mr Zuckerberg. The long-running dispute between Mr Trump and social media companies flared up again on Tuesday, when two of his posts were given a fact-check label by Twitter for the first time.He had tweeted, without providing evidence: ""There is no way (zero) that mail-in ballots will be anything less than substantially fraudulent.""Twitter added a warning label to the post and linked to a page describing the claims as ""unsubstantiated"".Then on Wednesday, Mr Trump threatened to ""strongly regulate"" social-media platforms.He tweeted to his more than 80 million followers that Republicans felt the platforms ""totally silence conservatives"", and that he would not allow this to happen. In an earlier tweet, he said Twitter was ""completely stifling free speech"".Twitter's chief executive, Jack Dorsey, responded to criticism of the platform's fact-checking policies in a series of posts, saying: ""We'll continue to point out incorrect or disputed information about elections globally.""Fact check: there is someone ultimately accountable for our actions as a company, and that’s me. Please leave our employees out of this. We’ll continue to point out incorrect or disputed information about elections globally. And we will admit to and own any mistakes we make.End of Twitter post  by @jackTwitter has tightened its policies in recent years, as it faced criticism that its hands-off approach allowed fake accounts and misinformation to thrive.",29 May 2020,technology
Twitter tags Trump tweet with fact-checking warning,"A post by US President Donald Trump has been given a fact-check label by Twitter for the first time.Mr Trump tweeted, without providing evidence: ""There is NO WAY (ZERO!) that Mail-In Ballots will be anything less than substantially fraudulent.""Twitter put a warning label in the post and linked to a page that described the claims as ""unsubstantiated"".Mr Trump on Wednesday threatened to ""strongly regulate"" or even ""close down"" social media platforms.He tweeted to his 80 million followers that Republicans felt the platforms ""totally silence conservatives"" and that he would not allow this to happen. In an earlier tweet, he said that Twitter was ""completely stifling free speech"".Later on Wednesday he said that Twitter ""has now shown everything we have been saying about them... is correct"" and vowed ""big action to follow"".It is unclear what regulatory steps the president could take without new laws passed by Congress. The White House has yet to offer further details.For years, Twitter has faced criticism for not acting on the president's controversial tweets, which include personal attacks on political rivals and debunked conspiracy theories. This month the platform introduced a new policy on misleading information amid the coronavirus pandemic.But recent posts in which Mr Trump - who has more than 80 million followers on Twitter - promoted a conspiracy theory about the death of political aide Lori Klausutis, blaming a high-profile critic, have not received the same treatment.The notification on Mr Trump's tweet shows a blue exclamation mark and a link suggesting readers ""get the facts about mail-in ballots"".It directs users to a page on which Mr Trump's claims are described as ""unsubstantiated"", citing reporting by CNN, the Washington Post and others.The pandemic is putting pressure on US states to expand the use of postal voting because people are worried about becoming infected at polling stations.In a ""what you need to know"" section, Twitter writes that Mr Trump ""falsely claimed mail-in ballots would lead to 'a Rigged Election'."" ""Fact-checkers say there is no evidence that mail-in ballots are linked to voter fraud,"" it continues.The company had pledged to increase the use of warning labels about false or misleading information on its site, but has been slow to take steps against the US president.Mr Trump posted the same claim about mail-in ballots on Facebook, but it is not fact-checked on that platform.Mr Trump then accused Twitter of interfering in the US presidential election scheduled for 3 November 2020, saying the company was ""completely stifling free speech, and I, as president, will not allow it to happen"".His tweet on Wednesday told social media to ""clean up your act now"" and that he would not let a ""more sophisticated version"" of what they had ""attempted to do, and failed, in 2016"" happen again. He did not elaborate.With more than 52,000 tweets currently to his name, Mr Trump is a prolific tweeter and relies on the platform to disseminate his views to millions of people.He has used Twitter to launch attacks on opponents, with targets ranging from North Korean leader Kim Jong-un to his political rivals in the US.In 2017 he used anti-Muslim tweets aimed at London Mayor Sadiq Khan to serve a domestic political purpose of warning about immigration, BBC North America reporter Anthony Zurcher reported.On Tuesday Mr Trump's presidential campaign manager Brad Parscale also criticised Twitter's decision.""Partnering with biased fake news 'fact checkers' is a smoke screen to lend Twitter's obvious political tactics false credibility. There are many reasons we pulled all our advertising from Twitter months ago, and clear political bias is one of them,"" Mr Parscale tweeted.They are voting bulletins that are distributed and returned by post. In a recent opinion survey conducted by the Pew Research Center, 66% of Americans said they would not be comfortable going to a polling place to cast their ballot during the coronavirus outbreak.Such concerns have increased pressure on states to expand the availability of mail-in ballots for all voters in order to minimise the risk of viral exposure from in-person voting.While every state provides some form of remote voting, the requirements to qualify vary greatly.Five states in the western US, including Washington, Oregon and Colorado, conduct their elections entirely via mail-in ballot. Others, like California, provide a postal ballot to anyone who requests it.On the other end of the spectrum, 17 states require voters to provide a valid reason why they are unable to vote in-person in order to qualify for an absentee ballot. The move comes on the heels of Twitter's decision not to remove a comment President Trump made about the death of Lori Klausutis in 2001. The president has tweeted several messages promoting a conspiracy theory that Ms Klausutis was murdered by MSNBC host Joe Scarborough. Her widower Timothy Klausutis asked Twitter to remove the post, saying it included ""horrifying lies"".The company told Mr Klausutis it was ""deeply sorry"" about the pain caused by the president's statements, but said the tweets did not violate their policies.",27 May 2020,technology
Trump signs executive order targeting Twitter after fact-checking row,"US President Donald Trump has signed an executive order aimed at removing some of the legal protections given to social media platforms.He said the firms had ""unchecked power"" to censure and edit the views of users.President Trump has regularly accused platforms such as Twitter and Facebook of stifling conservative voices.The order, which is expected to face legal challenges, comes after Twitter decided to append fact-check labels to two of his tweets this week.On Wednesday Mr Trump accused the company of election interference after it added a warning label to the tweets about claims of widespread fraud in mail-in voting - also known as postal votes.Twitter and other social media platforms strongly condemned the executive order.And early on Friday, Twitter hid one of President Trump's tweets from his profile, saying it violates rules about glorifying violence.Under a 1996 law, website operators, unlike traditional publishers, cannot generally be held responsible for content posted by users.The sites are also protected from lawsuits if they block posts deemed obscene, violent ""or otherwise objectionable, whether or not such material is constitutionally protected"".The executive order argues that this immunity should no longer apply if a social network edits posts, such as by adding a warning or a label. It also says ""deceptive"" blocking, including removing a post for reasons other than those described in a website's terms of service, should not be protected.Republican Senator Marco Rubio is among those arguing that the platforms take on the role of a ""publisher"" when they add fact-check labels to posts.""The law still protects social media companies like Twitter because they are considered forums not publishers,"" Mr Rubio said.""But if they have now decided to exercise an editorial role like a publisher, then they should no longer be shielded from liability."" The executive order also calls for the Federal Communications Commission (FCC) to spell out what type of content blocking will be considered deceptive or inconsistent with a service provider's terms and conditions.Donald Trump promised ""big action"" in response to Twitter's decision to append a fact-check message to two of his posts. While his announcement of an executive order was heavy on rhetoric - accusing social media companies of being monopolies that threaten free speech - it will be a long process before the talk turns into real action, big or otherwise.Independent government agencies will have to review federal law, promulgate new regulations, vote on them and then - in all likelihood - defend them in court. By the time it's all over, the November presidential election could have come and gone.That explains why Trump is also pushing for new congressional legislation - a more straightforward way of changing US policy toward social media companies. The real purpose of the president's order, however, may be symbolic. At the very least, the move will cause Twitter to think twice about attempting to moderate or fact-check his posts on their service. The president relies on Twitter to get his message out without filtering from the mainstream media. If Twitter itself start blunting one of his favourite communication tools, he is sending a message that he will push back - and make things, at a minimum, uncomfortable for the company.Twitter called the order ""a reactionary and politicized approach to a landmark law,"" adding that Section 230 ""protects American innovation and freedom of expression, and it's underpinned by democratic values"".Google, which owns YouTube, said changing Section 230 would ""hurt America's economy and its global leadership on internet freedom.""""Our platforms have empowered a wide range of people and organizations from across the political spectrum, giving them a voice and new ways to reach their audiences,"" the firm said in a statement to the BBC.In an interview with Fox News on Wednesday, Facebook's chief executive, Mark Zuckerberg, said censoring a social media platform would not be the ""right reflex"" for a government concerned about censorship. ""I just believe strongly that Facebook shouldn't be the arbiter of truth of everything that people say online,"" said Mr Zuckerberg. The long-running dispute between Mr Trump and social media companies flared up again on Tuesday, when two of his posts were given a fact-check label by Twitter for the first time.He had tweeted, without providing evidence: ""There is no way (zero) that mail-in ballots will be anything less than substantially fraudulent.""Twitter added a warning label to the post and linked to a page describing the claims as ""unsubstantiated"".Then on Wednesday, Mr Trump threatened to ""strongly regulate"" social-media platforms.He tweeted to his more than 80 million followers that Republicans felt the platforms ""totally silence conservatives"", and that he would not allow this to happen. In an earlier tweet, he said Twitter was ""completely stifling free speech"".Twitter's chief executive, Jack Dorsey, responded to criticism of the platform's fact-checking policies in a series of posts, saying: ""We'll continue to point out incorrect or disputed information about elections globally.""Fact check: there is someone ultimately accountable for our actions as a company, and that’s me. Please leave our employees out of this. We’ll continue to point out incorrect or disputed information about elections globally. And we will admit to and own any mistakes we make.End of Twitter post  by @jackTwitter has tightened its policies in recent years, as it faced criticism that its hands-off approach allowed fake accounts and misinformation to thrive.",29 May 2020,technology
