Vue sets out cinema reopening plan with physical distancing,"Vue has laid out a plan to reopen cinemas using physical distancing measures, as soon as the government gives the green light.The chain said families could safely sit together, away from strangers, to watch movies.Screening times would be staggered, and there would also be enhanced cleaning.The government has said some hospitality businesses like cinemas could reopen from 4 July - depending on how the pandemic progresses.""We have been liaising closely with authorities across Europe to design operating procedures that can provide the degree of social distancing required and allow an experience for our customers and staff that is as safe as possible,"" Vue said.The company said measures could include ""physically isolating family groups through our online booking systems, staggering film times to maintain social distancing and operate responsibly, and introducing enhanced cleaning and employee protection protocols"".Vue - one of the biggest UK cinema chains - added that ""big screen entertainment is a force for good in society"", and would provide ""an accessible and controlled way for families to begin to enjoy life outside their homes"".Earlier this month, chief executive Tim Richards told the BBC he hoped to have the chain up and running in time for the launch of director Christopher Nolan's action movie Tenet on 17 July.""We can control how many people come into our cinemas,"" he noted.UK cinemas shut in mid-March. The boss of the UK Cinema Association told the BBC ""most venues"" would be ready to reopen by the end of June, as long as safeguards were in place.Phil Clapp said he welcomed the proposed July restart, while recognising ""there are a host of wider public health considerations which mean that may not be possible, and we will of course respond accordingly"".He said: ""We remain in discussion with the government on the exact nature of the safeguards that will be required, some of which have been touched upon by Vue in their response, but all of which will be observed by the entire cinema sector to offer every reassurance to audiences and staff around their continued safety.""Step three of the government's new coronavirus conditional plan would potentially see leisure facilities like cinemas reopen, along with food service providers, pubs, hotels and places of worship - but only if they meet the Covid-19 Secure guidelines.Buildings that are more likely to attract crowds, like gig venues and theatres, will not be allowed to properly reopen at this suggested earliest stage.Last week, Cambridge University virologist Dr Chris Smith questioned the validity of reopening any such venues, from both a medical and economic standpoint, until a vaccine emerges.",13 May 2020,entertainment
Blue Peter: New presenter to be unveiled during lockdown,"Blue Peter usually introduces its new presenters doing something dramatic and daring, like jumping out of a plane.But on Thursday, its 39th presenter - Mwaka Mudenda - will be unveiled virtually from home due to the UK's lockdown restrictions.That doesn't mean she won't face a challenge though - she will be tasked with breaking a surprise world record.Mudenda, 25, who described landing her new role as ""mind-blowing"", won't find out what it is until her first show.""Despite lockdown, I've felt so welcomed by the incredible behind-the-scenes team that help run and deliver such a wonderful show - and I already feel like a big part of the Blue Peter family,"" Mudenda said.""I'm so excited to begin my adventure, with all the fun challenges it has in store. The chance to be a part of such a well-loved programme that has such an inspiring and creative young audience is a real blessing.""Mudenda - known as Mwaksy - will be joining fellow presenters Lindsey, Richie and Henry the dog.She was already working for the BBC in its sports department as an assistant producer in Salford when she was talent-spotted after appearing in some online sport videos.The Londoner moved to Manchester to study anthropology before landing a job at the BBC two years ago.Blue Peter editor Ellen Evans, says: ""It's going to be an extraordinary launch for Mwaksy in extraordinary times, she has had to do her first show - and her first Blue Peter presenter challenge - from her home, but I have been blown away by her positivity, her warmth, her humour and her willingness to give things a go so she'll fit perfectly with the Blue Peter family.""Mwaksy's debut can be seen on CBBC on Thursday at 17:30 BST.",13 May 2020,entertainment
Music royalties reach a record high - but a storm is coming,"Musicians and songwriters in the UK received a record amount of money last year, but the loss of live music poses a major threat to income in 2020.The warning was issued by PRS for Music, the body that makes sure 145,000 songwriters, composers and publishers in the UK are paid when their music is played or performed around the world.The organisation collected a record £810m last year, a rise of 8.7%.But it said Covid-19 would result in an ""inevitable decline"" in 2020 and 2021.""Even though we had a record-breaking year, we know very well that we're in unprecedented, unpredictable times,"" chief executive Andrea Martin told the BBC.Revenues from ""live music and public performance will be hit"" not just in 2020 but in 2021, as international payments often take time to trickle down, she said.""There will be a downfall,"" she added. ""But by how much and by what per cent... your guess is just as good as mine.""PRS processed 18.8 trillion ""performances"" of music last year, including streams, downloads, radio and TV broadcasts, and music played in pubs, clubs, hairdressers and concert venues. UK songwriters contributed to many of the year's most-played hits, including like Someone You Loved by Lewis Capaldi, Old Town Road by Lil Nas X and Don't Call Me Up by Mabel.Live music generated £54m in royalties, up £15m since 2018. Revenues were boosted by major tours from the Spice Girls, Sir Elton John, Ed Sheeran and the return of Glastonbury after a fallow year in 2018.But with an entire summer of festivals cancelled and dozens of major tours postponed until 2021, that figure will be impossible to recreate in next year's results.Last week, UK Music revealed the contribution of live music to the UK economy is set to drop in 2020 from an estimated £1.1bn to £200m, describing it as a ""catastrophic"" blow to the industry.Meanwhile, the Ivors Academy of songwriters and composers said it anticipated a loss of £25,000 per member over a six-month period.The lockdown also means songwriters will lose out on royalties gathered when their music is played in shops, cinemas, pubs, clubs and restaurants. In 2019, that figure was £168.2m.There is some good news, however. Royalties from music streaming rose 22.1% to £155m, while the money generated from music on video-on-demand services like Amazon and Netflix increased 47.5% to £17.7m.Early figures suggest more people have taken out streaming subscriptions during the lockdown, which may provide a small counterweight to the loss of live music.But many musicians have noted that the money they receive from the likes of Spotify, Apple Music and Amazon is not enough to sustain a career.Tom Gray from indie band Gomez recently shared a chart, originally compiled by The Trichordist, showing how many streams artists require to make a living in the UK.On YouTube, a song would have to be played 7,267 times to generate £8.72 - or one hour of minimum wage. On Spotify, the figure was 3,114 streams, and on Apple Music 1,615 streams.Terrifying. The most up-to-date streaming rates adapted for £ and for UK minimum wage. Data from the excellent  @thetrichordist.  #BrokenRecord pic.twitter.com/XOoZ3IGisTEnd of Twitter post  by @MrTomGrayThat has led to a campaign, #BrokenRecord, seeking a more equitable system of distributing streaming money.Spearheaded by the Ivors Academy and the Musicians' Union, it is calling for a new system, where your subscription fee is distributed to the artists you actually listen to - rather than going into a central pot, where money is split between the most-streamed songs on a percentage basis.""This is what the consumer wants,"" said Graham Davies of the Ivors Academy, who is calling for a government-backed review.""They want their £9.99 a month to be paid to the artists, performers, songwriters and composers of the music they love.""In the meantime, the PRS Emergency Relief Fund has raised more than £2.1m to help members who have lost income as a result of Covid-19. Martin says 1,600 songwriters have applied for assistance in the last week alone.Another £5m fund, set up by the charity Help Musicians, ran out of cash within a week after being launched in March.Trade body UK Music has subsequently called on the government to set up a new taskforce to revive the music industry as it navigates the pandemic.",14 May 2020,entertainment
Vue sets out cinema reopening plan with physical distancing,"Vue has laid out a plan to reopen cinemas using physical distancing measures, as soon as the government gives the green light.The chain said families could safely sit together, away from strangers, to watch movies.Screening times would be staggered, and there would also be enhanced cleaning.The government has said some hospitality businesses like cinemas could reopen from 4 July - depending on how the pandemic progresses.""We have been liaising closely with authorities across Europe to design operating procedures that can provide the degree of social distancing required and allow an experience for our customers and staff that is as safe as possible,"" Vue said.The company said measures could include ""physically isolating family groups through our online booking systems, staggering film times to maintain social distancing and operate responsibly, and introducing enhanced cleaning and employee protection protocols"".Vue - one of the biggest UK cinema chains - added that ""big screen entertainment is a force for good in society"", and would provide ""an accessible and controlled way for families to begin to enjoy life outside their homes"".Earlier this month, chief executive Tim Richards told the BBC he hoped to have the chain up and running in time for the launch of director Christopher Nolan's action movie Tenet on 17 July.""We can control how many people come into our cinemas,"" he noted.UK cinemas shut in mid-March. The boss of the UK Cinema Association told the BBC ""most venues"" would be ready to reopen by the end of June, as long as safeguards were in place.Phil Clapp said he welcomed the proposed July restart, while recognising ""there are a host of wider public health considerations which mean that may not be possible, and we will of course respond accordingly"".He said: ""We remain in discussion with the government on the exact nature of the safeguards that will be required, some of which have been touched upon by Vue in their response, but all of which will be observed by the entire cinema sector to offer every reassurance to audiences and staff around their continued safety.""Step three of the government's new coronavirus conditional plan would potentially see leisure facilities like cinemas reopen, along with food service providers, pubs, hotels and places of worship - but only if they meet the Covid-19 Secure guidelines.Buildings that are more likely to attract crowds, like gig venues and theatres, will not be allowed to properly reopen at this suggested earliest stage.Last week, Cambridge University virologist Dr Chris Smith questioned the validity of reopening any such venues, from both a medical and economic standpoint, until a vaccine emerges.",13 May 2020,entertainment
Blue Peter: New presenter to be unveiled during lockdown,"Blue Peter usually introduces its new presenters doing something dramatic and daring, like jumping out of a plane.But on Thursday, its 39th presenter - Mwaka Mudenda - will be unveiled virtually from home due to the UK's lockdown restrictions.That doesn't mean she won't face a challenge though - she will be tasked with breaking a surprise world record.Mudenda, 25, who described landing her new role as ""mind-blowing"", won't find out what it is until her first show.""Despite lockdown, I've felt so welcomed by the incredible behind-the-scenes team that help run and deliver such a wonderful show - and I already feel like a big part of the Blue Peter family,"" Mudenda said.""I'm so excited to begin my adventure, with all the fun challenges it has in store. The chance to be a part of such a well-loved programme that has such an inspiring and creative young audience is a real blessing.""Mudenda - known as Mwaksy - will be joining fellow presenters Lindsey, Richie and Henry the dog.She was already working for the BBC in its sports department as an assistant producer in Salford when she was talent-spotted after appearing in some online sport videos.The Londoner moved to Manchester to study anthropology before landing a job at the BBC two years ago.Blue Peter editor Ellen Evans, says: ""It's going to be an extraordinary launch for Mwaksy in extraordinary times, she has had to do her first show - and her first Blue Peter presenter challenge - from her home, but I have been blown away by her positivity, her warmth, her humour and her willingness to give things a go so she'll fit perfectly with the Blue Peter family.""Mwaksy's debut can be seen on CBBC on Thursday at 17:30 BST.",13 May 2020,entertainment
Leaf Arbuthnot: How rent-a-gran scheme sparked a debut novel,"By rights, freelance journalist Leaf Arbuthnot should have been pretty busy of late with preparations to launch her first novel. But, like for so many of us, normal life ground to a halt as the coronavirus swept in. That meant abandoning any ideas of a (cheap) white wine-fuelled press party or public readings from her novel Looking For Eliza, she says.""I feel like my life has been thrust into the deep freeze. It's sad to see all those things disappear. It's a bit depressing,"" she adds. Instead, holed up at her parents' house near Reading, rather than in her London flat, she's been trying distraction techniques to quash worries about how her book will fare and the future of her arts and culture freelance career.Baking has been high on the list, as has playing with the ""ridiculously fluffy"" Norbert - a chick from the family's chooks.But these things only go so far in a crisis, especially when the events she would normally cover have stalled and papers,  struggling even before the pandemic, are tentative about commissioning freelancers.  ""I'm frustrated by the way I'm dealing with this. I seem to be more paranoid. My friends tell me this is completely fine. This is a pandemic, your career isn't ending,"" says Leaf, who writes for the likes of the Guardian, the Spectator and the Sunday Times. ""I realise just how much of my work relied on the world happening with business as usual. But I know I'm lucky my book is coming out at all and without the internet I'd really be up the creek. ""Yet I feel like I need to touch base with reassurances again and again. I have low level neediness. That makes me dislike myself.""Her feelings will chime with those of a lot of people - and so will the themes of her book.Though unsurprisingly nothing to do with a pandemic, Looking For Eliza is about cross-generational loneliness - increasingly debated in recent years - and the value in forming human bonds outside your comfort zone.  Its protagonists are the widowed, disenchanted poet Ada in her 70s and the 25-year-old first-year Italian PhD Oxford student Eliza. Both are suffocated by loneliness, in its truest form. No efforts towards social interaction - be that fresher events and sex for Eliza, or hiring herself out as supportive ""rent-a-gran"" for Ada - can fill their individual emotional voids. And though they live across the road from each other, they could be worlds apart, like so many neighbours even without the barriers raised by a health crisis. And the generation gap doesn't help. But underneath they are two sides of one coin, having both become disconnected from a sense of self or place through the loss of a significant other.""I see Eliza as a young vine,"" says Leaf. ""She's recently disentangled herself from quite an abusive and intense relationship with her ex-girlfriend, Ruby, which started just as she was becoming an adult. ""She's grown up with that support, even if it was quite twisted. Now she's suddenly having to work out who she is by herself but lacks the tools to scoop her out of loneliness.""As for Ada, whose husband was a revered university professor, ""she's had a really wonderful marriage to a man who was generous and kind"", says Leaf. ""After his death, she realises the friends she thought were theirs collectively were more on his side of the ledger and suddenly all those relationships thin out and fracture. ""She finds she's living alone, not having had children because they couldn't, and she doesn't have the confidence or resources internally to be able to build a new life."" The two are brought together by Ada's Rent-A-Gran venture, through which she's realising just how widespread a problem social dislocation is. Their connection is instant. They bond through simple pleasures, such as cooking and lapsang souchong tea. And crucially, they are curious and non-judgemental about the generational differences in their world views. Ada is particularly interested to learn about Eliza's bisexuality. And, set against the backdrop of the Brexit vote, politics is thrown in (lightly) too. As the friendship grows stronger so does their self-worth. ""I really do think you can tool up against loneliness, you can pull up against it by finding connections close at home,"" says Leaf. ""There's been a real flowering of activity since lockdown, where people are really reinvesting in their local communities and just helping.""I've got friends who now know their neighbours' eating habits because they're doing their shopping. And yet they'd never spoken before and haven't physically met. I've been quite encouraged remotely.""On a community level I think we will enjoy the benefits of having engaged with people nearby and maybe a renewed understanding of how interconnected we all are.""In her own life, Leaf knows the value of reaching out to relationships outside your age bracket. She volunteers for Age UK, has separately made friends with two elderly people, and turns to her ""remarkable"" 100-year-old grandmother for advice. ""I feel I connect much better with two generations up,"" says Leaf. ""There's a real lack of judgment around these relationships and a mutual lack of understanding, which can be quite charming and lead to quite free conversations where you learn a lot about each other's point of view. Even if you don't agree, it doesn't matter.""In its review The Lady magazine said Leaf had been ""even-handed in pointing out the strengths and weaknesses of both women and reminds us how important it is to be with our elders"".While in the Evening Standard, Susannah Butter said of the book: ""There's a lot to identify with, whether you are in your seventies or a millennial.""End of Youtube post  by Link TVAnd as curious as it may sound, the seed of Rent-a-Gran grew from true events. A Google search will throw up agencies offering mainly the childcare services of an elderly lady. But Ada's experiences derive from articles Leaf read about Japan, where actors are hired short-term to fulfil familial roles.""You can rent a girlfriend and even children to take home with you to keep up appearances. I was really struck by that, because I felt that it was incredibly sad,"" says Leaf. ""We've got to a stage where people are so alienated from their families they can't be honest about the littleness of the life they're leading in the big city.""In other cultures, you can hire mourners or singers for funerals and other intimate ceremonies, she also found.Besides her relationships with older people, Leaf also injected other elements of her own life into her story but says: ""I didn't set out to write myself on the page.""She studied modern languages at Cambridge and remembers ""hoping it was going to be a great experience"". But, then not a drinker and being ""quite nerdy"", she felt isolated by the boozy socialising. ""I was both too mature and immature to flower in that context. Also, the horror at thinking, 'if this is going to be the time of my life, well good God, this is not sustainable, it's too disappointing,'"" she says. But like Eliza, she came to admire the Italian writer and Holocaust survivor Primo Levi. His presence looms in the background, ""hopefully to introduce readers to him,"" she says, as does Leaf's love of poetry - she's a judge for the Forward Poetry Prize and dabbles a bit herself.    And then there's a nod to wild swimming, which Leaf does all-year round, often in a mixed-age group. Sub-zero temperatures help her arthritis but she also reaps other rewards.""It's been really good for my mental health and there's a euphoria that sets in after three minutes in three degree water,"" she says. And she concludes: ""It's a good example of cross-generational connection.""",13 May 2020,entertainment
