"Beyoncé releases surprise new song, Black Parade, on Juneteenth","Beyoncé has released a surprise new song, Black Parade, hours after announcing a new initiative to support black-owned businesses.The track includes powerful lyrics about black history, police brutality and the George Floyd protests. ""Put your fists up in the air, show black love,"" sings the star. ""Need peace and reparation for my people.""The song was released on Juneteenth, a holiday marking the official end of slavery in the US.The celebration originated in Beyoncé's home state of Texas but is now celebrated annually on 19 June throughout the US, with varying degrees of official recognition, sometimes under the names Emancipation Day or Black Independence Day.Black Parade is Beyoncé's first solo release since last year's Homecoming, a live album and documentary covering her blockbuster performance at Coachella in 2018; and The Lion King: The Gift, which accompanied Disney's live action remake of its classic animation. ""I'm going back to the South, where my roots ain't watered down,"" she sings as the song opens.The lyrics go on to reference the Covid-19 pandemic (""Fly on the runway in my hazmat""), police brutality (""Rubber bullets bouncing off me"") and Tamika Mallory, a prominent activist in the Women's March and Black Lives Matter movements.Warning: The following song contains explicit language.End of Youtube post  by Beyoncé - TopicThe track appeared on streaming services shortly after the star launched Black Parade Route, an online directory of black-owned businesses selling everything from fashion and beauty products to home furnishings and coffee. ""Being Black is your activism. Black excellence is a form of protest. Black joy is your right,"" wrote the singer on a tagline on her website.According to the site, the initiative will benefit the star's BeyGOOD's Black Business Impact Fund, which ""support[s] Black-owned small businesses in need.""""Happy Juneteenth Weekend! I hope we continue to share joy and celebrate each other, even in the midst of struggle,"" said the star in an Instagram post announcing the launch. ""Please continue to remember our beauty, strength and power.""Beyoncé has been vocal throughout the the anti-racism protests sparked in May by the death of George Floyd.In a video on her Instagram, she said she felt ""broken and disgusted"" and demanded justice for Mr Floyd, who died after a police officer knelt on his neck for almost nine minutes.""No more senseless killings of human beings,"" she said. ""No more seeing people of colour as less than human. We can no longer look away.""""Continue to pray for peace and compassion and healing for our country.",20 June 2020,entertainment
"Alicia Keys, LL Cool J and the new wave of protest songs","The death of George Floyd has prompted one of the biggest movements against racism since the civil rights era.Protests were held globally after video footage from Minneapolis showed a white police officer kneeling on Mr Floyd's neck for almost nine minutes. The 46-year-old could be heard repeatedly telling the officer, ""I can't breathe"".Around the world, music became a crucial way for people to express their grief and anger. Bob Marley's Get Up, Stand Up and Bill Withers' Lean On Me soundtracked several protests, while streaming figures for songs that call out police violence soared: from Childish Gambino's This Is America and Kendrick Lamar's Alright to NWA's visceral hip-hop track [Expletive] Tha Police.The latter was also used by hackers to disrupt police scanners in Chicago during the protests. In a more unifying moment, protestors in Atlanta encouraged the National Guard to join them in performing the Macarena.As the Black Lives Matter movement continues, the record industry has been paused to examine its own history of racial exclusion, and the inequity between black artists and the mainly white executives who profit from their work.Meanwhile, artists have channelled their frustration and anger into a new wave of protest songs, directly inspired by Mr Floyd's death and its aftermath.Here are some of the most striking examples - but please be aware that many of these songs contain explicit language.End of Youtube post  by Alicia Keys - TopicSung from the perspective of a mourning mother whose son has been shot to death, Alicia Keys' new single was released on Juneteenth - a holiday celebrating the emancipation of enslaved people in the US.It was originally written in response to the deaths of Mike Brown and Sandra Bland, the former killed by police in Missouri in 2014, the latter who died in a jail cell in 2015 after Texas police stopped her for a minor traffic violation - but Keys said the message was ""never not going to be relevant"".""Of course there is no perfect way to die,"" she wrote in an Instagram caption, as she premiered the song. ""This phrase doesn't even make sense but that's what makes the title so powerful and heartbreaking because so many have died unjustly. ""We all know none of these innocent lives should have been taken due to the culture of police violence.""End of Youtube post  by HERMusicVEVO""Just by the title, you know that it means something painful,"" said Grammy-nominated R&B artist H.E.R. as she debuted her new song in a living room concert.""These lyrics were kind of easy to write because it came from a conversation of what's happening right now, what's been happening, and the change that we need to see,"" she said before her performance. ""I think music is powerful when it comes to change and when it comes to healing, and that's why I wrote this song, to make a mark in history.""The sombre, guitar-led song asks: ""What is a gun to a man that surrenders / What's it gonna take for someone to defend her / If we all agree that we're equal as people / Then why can't we see what's evil?""H.E.R. said the track tackles the question that's been plaguing her over the last few weeks: Why is there so much hate?""My favourite line in the song is, 'How do we cope when we don't love each other?'"" she told TMZ. ""I think we're all questioning that now.""A post shared by LL COOL J (@llcoolj) on May 31, 2020 at 7:13pm PDTEnd of Instagram post  by llcooljFrom the very first bar, you can tell LL Cool J won't be holding back.""For 400 years you had your knees on our necks,"" he raps. ""A garden of evil with no seeds of respect"".The 52-year-old goes on to ask what would have happened to former Minneapolis police officer Derek Chauvin, had he not been filmed by bystanders during Mr Floyd's fatal arrest.""Watching that man die slow left a hole,"" he says, ""If it wasn't for them phones, Chauvin would be at home / Feeling justified because of George skin tone / I'm telling those with melanin, you're not alone.""End of Youtube post  by Dua SalehMinneapolis artist Dua Saleh originally wrote Body Cast in response to the deaths of Jamar Clark and Philando Castile, who were fatally shot by police in separate incidents in 2015 and 2016.""Unfortunately, I could have written the song at any point in my life and it would have been relevant, which is frightening to say the least,"" they told the Switched On Pop podcast.The intro samples clips of Angela Whitehead, a woman from Montana who went viral last year when she rebuked two police officers for entering her home without a warrant or viable cause.Saleh later references the stand-off in her lyrics, singing: ""You must be crazy, coming up in here talking about you heard something /  You heard me talking, I talk loud and I'm aggressive and guess what? / You did not knock on my door.""""I just don't trust police officers in general,"" the singer said. ""I was just like disgusted at the thought that policing was a safe and viable option for black communities.""Proceeds from the song's download are being donated to the Minneapolis-based organisation, Black Visions Collective.End of Youtube post  by Denzel Curry""Someone asked, how do I feel?"" Terrace Martin wrote, as he introduced his response to George Floyd's death. ""I told them hurt, fearless, angry, aware and fully ready to protect me, my family and my people at all cost. I got together with black men that felt the same way and created a work of truth.""The result is Pig Feet - a frenetic and urgent collision of jazz and hip-hop, where Kamasi Washington's fidgety saxophone emphasises lyrics about structural racism and police brutality.It was first released on YouTube, accompanied by a video compiling clips from recent Black Lives Matter protests, followed by a list of victims of police violence that scroll silently up the screen. just singing what’s on my heart...hope this blesses someone🙏🏾❤️ @sdhtoronto thanks for this dope shirt!!🔥🔥 #ijustwantolive #blacklivesmatter #ijustwannalive #equality #black #blackexcellence #racism #justice @mstinalawsonA post shared by  Keedron Bryant (@keedronbryant) on May 26, 2020 at 2:01pm PDTEnd of Instagram post  by keedronbryantTwelve-year-old Keedron Bryant gave voice to the feelings of thousands when he uploaded a simple, a capella performance of the original song I Just Wanna Live to Instagram three weeks ago.""I'm a young black man / Doing all that I can / To stand, oh but when I look around / And I see what's being done to my kind/ Every day, I'm being hunted as prey,"" he sang, looking directly into the camera.His performance, and the directness of the lyrics, written by his mother, won praise from Barack Obama, LeBron James, Janet Jackson and Katy Perry, who reposted the song to her followers with the message #BLACKLIVESMATTER.On Friday, record label Warner Bros announced it had signed Keedron to a recording contract.",19 June 2020,entertainment
Beyonce drops live album with Netflix film,"Beyoncé's Netflix documentary, Homecoming, has arrived with a surprise: A new Beyoncé album.The star, who perfected the art of stealth releases with a self-titled album in 2013, announced the new record just hours before Homecoming premiered.Both the film and the album capture her 2018 Coachella set - which celebrated black power and liberation.They include live versions of Crazy In Love and Drunk In Love, as well as her reunion with Destiny's Child.Fans also get one new studio recording - a cover of Maze's 1981 hit Before I Let Go, which plays over the closing credits of the film.A post shared by Beyoncé (@beyonce) on Apr 17, 2019 at 12:30am PDTEnd of Instagram post  by beyonceBeyoncé's Coachella performance - which took place over two weekends last April - marked the first time a black woman had headlined the festival.The star pulled out all the stops, employing dozens of dancers and an elaborate marching band, acknowledging the importance of historically black colleges and universities (HBCUs) - institutions established in the US before the 1964 Civil Rights Act to serve the black community that was shut out by predominantly white establishments.Lavished with praise at the time, the release of the Netflix documentary has seen a second wave of acclaim.""For some of us who were actually there at Coachella, there might've been a slight fear that we were overselling the show,"" said Variety Magazine's Chris Willman.""Rewatching it on film a year later, 'high water mark in 21st century entertainment' actually almost feels like it's underselling it.""BBC entertainment correspondent Colin Paterson noted that there was ""very little documentary content, but as a concert film it's up there with Talking Heads' Stop Making Sense and Prince's Sign 'O' The Times"". He added: ""It's like eight Super Bowl half-time shows back to back.""End of Youtube post  by NetflixThe New York Times described the film - which is almost 150 minutes long - as consisting of footage ""viewers have already seen (and, perhaps, seen again and again) this time through a greater variety of angles and Instagram-like filters. ""The 'intimate and 'candid' moments touted by Netflix are brief in comparison,"" they add, ""appearing between long, uninterrupted musical segments from the show.""Those moments will be enough to satisfy the overzealous Beyhive and probably more casual fans and admirers, too.""""While the behind-the-scenes footage is only a fraction of the total film, Beyoncé is refreshingly candid about the hard work that it took to put the shows together,"" wrote Brittany Spanos in Rolling Stone.""Some of the film's best scenes include the pop diva sternly but kindly dragging her team, who seem to have a hard time grasping her highly specific vision.""Fans were similarly enthusiastic, with A Wrinkle In Time director Ava DuVernay writing on Twitter: ""Gah! This has been my favourite thing for a whole year now.""I can watch it on repeat and never, ever get tired. So much to see. So many moves to try in one's mirror. If one were so inclined.""Others were left in awe of the vocal talents of Beyonce and Jay-Z's seven-year-old daughter, Blue Ivy Carter - who emulates her mother's performance of the ""black national anthem"" Lift Every Voice and Sing.Sarah V tweeted: ""Listening to Blue Ivy signing on Beyoncé Homecoming album she is clearly a young star in the making!""",17 April 2019,entertainment
Beyonce speaks out against racism and sexism in graduation speech,"Beyonce thanked graduates for ""using their collective voice"" to support the Black Lives Matter movement in an emotional online speech on Sunday.YouTube's global virtual graduation ceremony, Dear Class of 2020, took place after universities closed their doors amid Covid-19 concerns.The singer was joined by other big names such as Alicia Keyes, Lady Gaga and former US president Barack Obama.There were no actual scrolls to hand out, but plenty of pearls of wisdom.The first lady of pop, Beyonce, gave kudos to scholars for their qualifications, which she said arrived ""in the middle of a global crisis, a racial pandemic and worldwide expression of outrage"", referring to the protests around the death of George Floyd.""And you still made it. We're so proud of you,"" she declared.She went on to thank graduates everywhere for spreading the word that ""Black Lives Matter"".""Real change has started with you, this new generation of high school and college graduates we celebrate today,"" she added.The Grammy-winning star also took aim at sexism within the music industry and beyond, and signed off with a shout-out to marginalised groups.""Your queerness is beautiful, your blackness is beautiful, your compassion, your understanding,"" she beamed. ""Your fight for people who may be different from you is beautiful.""Fellow singer Alicia Keys also used the streaming platform to acknowledge the efforts of protesting students. ""I see you. You're unstoppable,"" she told them.Lady Gaga admitted she had written her speech two weeks ago but had to give it a re-write in light of recent events.An emotional Gaga declared there is ""much to be sad about, [but also] there is much to be celebrated"".""You are watching what is a pivotal moment in this country's evolution. You're watching society change in a deeply important way,"" she declared.The singer compared contemporary America to a forest, ""planted with racist seeds"".""It's you who are the seeds of the future"" she told the alumnus, calling on them to continue to change perceptions about race, as they begin their new lives.""Congratulations to the class of 2020; I can't wait to see your forest.""Set against the backdrop of a worldwide coronavirus crisis, and mass Black Lives Matter protests, this year's socially-distanced graduation ceremony was, admitted the former POTUS, ""not how any of you imagined"".""Don't let the lack of a big crowded ceremony take anything away from what your graduation signifies"" though, Obama encouraged.""Go ahead and bask in the glory of your achievement.""And wherever you are take lots of photos - although when I look at my graduation pictures the main thing I realise is that I should've got a haircut more often!"" he joked.President Trump's predecessor added that this year's crop were ""graduating into a world that faces more profound challenges than any generation in decades,"" but that they were up to it.""You make me optimistic about our future,"" he said, as ""the old normal wasn't good enough"".He urged: ""Be alive to one another's struggles. Stand up for one another's rights. Leave behind all the old ways of thinking that divide us: sexism, racial prejudice, status, greed. Set the world on a different path.""Michelle Obama encouraged graduates to go beyond social media to try to bring about change.""Sometimes it's easier to stand with strangers at a protest than it is to challenge someone in your own backyard. So if you hear people express bigoted views or talking down to 'those people,' it is up to you to call them out. Because we won't solve anything if we're only willing to do what's easiest.""Also on the live-streamed video, K-pop megastars BTS, who have donated $1m to Black Lives Matter, treated everyone to a celebratory 12-minute medley of their hits.Katy Perry performed her new single Daisies. ""You are the future, make the world a better place,"" she declared.And Star Wars actors Mark Hamill and Daisy Ridley read sections of the fitting Dr Seuss story, Oh, the Places You'll Go!""With that, your training is over,"" Hamill told young Jedis everywhere, afterwards. ""Now go forth and become more powerful than you can possibly imagine.""The full four-and-a-half hour star-studded show, also featured Missy Elliot, Jennifer Lopez, Taylor Swift, Billie Eilish and an opening classical flute solo by Lizzo.",8 June 2020,entertainment
"Alicia Keys, LL Cool J and the new wave of protest songs","The death of George Floyd has prompted one of the biggest movements against racism since the civil rights era.Protests were held globally after video footage from Minneapolis showed a white police officer kneeling on Mr Floyd's neck for almost nine minutes. The 46-year-old could be heard repeatedly telling the officer, ""I can't breathe"".Around the world, music became a crucial way for people to express their grief and anger. Bob Marley's Get Up, Stand Up and Bill Withers' Lean On Me soundtracked several protests, while streaming figures for songs that call out police violence soared: from Childish Gambino's This Is America and Kendrick Lamar's Alright to NWA's visceral hip-hop track [Expletive] Tha Police.The latter was also used by hackers to disrupt police scanners in Chicago during the protests. In a more unifying moment, protestors in Atlanta encouraged the National Guard to join them in performing the Macarena.As the Black Lives Matter movement continues, the record industry has been paused to examine its own history of racial exclusion, and the inequity between black artists and the mainly white executives who profit from their work.Meanwhile, artists have channelled their frustration and anger into a new wave of protest songs, directly inspired by Mr Floyd's death and its aftermath.Here are some of the most striking examples - but please be aware that many of these songs contain explicit language.End of Youtube post  by Alicia Keys - TopicSung from the perspective of a mourning mother whose son has been shot to death, Alicia Keys' new single was released on Juneteenth - a holiday celebrating the emancipation of enslaved people in the US.It was originally written in response to the deaths of Mike Brown and Sandra Bland, the former killed by police in Missouri in 2014, the latter who died in a jail cell in 2015 after Texas police stopped her for a minor traffic violation - but Keys said the message was ""never not going to be relevant"".""Of course there is no perfect way to die,"" she wrote in an Instagram caption, as she premiered the song. ""This phrase doesn't even make sense but that's what makes the title so powerful and heartbreaking because so many have died unjustly. ""We all know none of these innocent lives should have been taken due to the culture of police violence.""End of Youtube post  by HERMusicVEVO""Just by the title, you know that it means something painful,"" said Grammy-nominated R&B artist H.E.R. as she debuted her new song in a living room concert.""These lyrics were kind of easy to write because it came from a conversation of what's happening right now, what's been happening, and the change that we need to see,"" she said before her performance. ""I think music is powerful when it comes to change and when it comes to healing, and that's why I wrote this song, to make a mark in history.""The sombre, guitar-led song asks: ""What is a gun to a man that surrenders / What's it gonna take for someone to defend her / If we all agree that we're equal as people / Then why can't we see what's evil?""H.E.R. said the track tackles the question that's been plaguing her over the last few weeks: Why is there so much hate?""My favourite line in the song is, 'How do we cope when we don't love each other?'"" she told TMZ. ""I think we're all questioning that now.""A post shared by LL COOL J (@llcoolj) on May 31, 2020 at 7:13pm PDTEnd of Instagram post  by llcooljFrom the very first bar, you can tell LL Cool J won't be holding back.""For 400 years you had your knees on our necks,"" he raps. ""A garden of evil with no seeds of respect"".The 52-year-old goes on to ask what would have happened to former Minneapolis police officer Derek Chauvin, had he not been filmed by bystanders during Mr Floyd's fatal arrest.""Watching that man die slow left a hole,"" he says, ""If it wasn't for them phones, Chauvin would be at home / Feeling justified because of George skin tone / I'm telling those with melanin, you're not alone.""End of Youtube post  by Dua SalehMinneapolis artist Dua Saleh originally wrote Body Cast in response to the deaths of Jamar Clark and Philando Castile, who were fatally shot by police in separate incidents in 2015 and 2016.""Unfortunately, I could have written the song at any point in my life and it would have been relevant, which is frightening to say the least,"" they told the Switched On Pop podcast.The intro samples clips of Angela Whitehead, a woman from Montana who went viral last year when she rebuked two police officers for entering her home without a warrant or viable cause.Saleh later references the stand-off in her lyrics, singing: ""You must be crazy, coming up in here talking about you heard something /  You heard me talking, I talk loud and I'm aggressive and guess what? / You did not knock on my door.""""I just don't trust police officers in general,"" the singer said. ""I was just like disgusted at the thought that policing was a safe and viable option for black communities.""Proceeds from the song's download are being donated to the Minneapolis-based organisation, Black Visions Collective.End of Youtube post  by Denzel Curry""Someone asked, how do I feel?"" Terrace Martin wrote, as he introduced his response to George Floyd's death. ""I told them hurt, fearless, angry, aware and fully ready to protect me, my family and my people at all cost. I got together with black men that felt the same way and created a work of truth.""The result is Pig Feet - a frenetic and urgent collision of jazz and hip-hop, where Kamasi Washington's fidgety saxophone emphasises lyrics about structural racism and police brutality.It was first released on YouTube, accompanied by a video compiling clips from recent Black Lives Matter protests, followed by a list of victims of police violence that scroll silently up the screen. just singing what’s on my heart...hope this blesses someone🙏🏾❤️ @sdhtoronto thanks for this dope shirt!!🔥🔥 #ijustwantolive #blacklivesmatter #ijustwannalive #equality #black #blackexcellence #racism #justice @mstinalawsonA post shared by  Keedron Bryant (@keedronbryant) on May 26, 2020 at 2:01pm PDTEnd of Instagram post  by keedronbryantTwelve-year-old Keedron Bryant gave voice to the feelings of thousands when he uploaded a simple, a capella performance of the original song I Just Wanna Live to Instagram three weeks ago.""I'm a young black man / Doing all that I can / To stand, oh but when I look around / And I see what's being done to my kind/ Every day, I'm being hunted as prey,"" he sang, looking directly into the camera.His performance, and the directness of the lyrics, written by his mother, won praise from Barack Obama, LeBron James, Janet Jackson and Katy Perry, who reposted the song to her followers with the message #BLACKLIVESMATTER.On Friday, record label Warner Bros announced it had signed Keedron to a recording contract.",19 June 2020,entertainment
