Brooklyn Nine-Nine: New episodes 'in the trash' after George Floyd death,"Brooklyn Nine-Nine star Terry Crews has said four new episodes of the police comedy were thrown ""in the trash"" in the wake of the death of George Floyd.Crews said the show would ""start over"" in light of the anti-racism protests.He said: ""We've had a lot of sombre talks about it and deep conversations and we hope through this we're going to make something that will be truly groundbreaking this year.""We have an opportunity and we plan to use it in the best way possible.""Co-creator Dan Goor had four episodes ""all ready to go"" before Mr Floyd's death a month ago prompted widespread Black Lives Matter protests as well as soul-searching in society in the US and beyond.""They just threw them in the trash,"" Crews told Access Hollywood. ""We have to start over. Right now we don't know which direction it's going to go in.""The actor and America's Got Talent presenter also recounted his own dealings with the police, saying police officers had pointed guns at him, mistakenly, before he became a well-known face.""It's something that every black man has been through and it's hard to really try to get other people to understand,"" he said.The 51-year-old said the momentum for change made it ""Black America's Me Too movement"".""We always knew this was happening, but now white people are understanding,"" he said.Earlier this month, Goor and the cast made a $100,000 (£79,000) donation to the National Bail Fund Network to support ""the many people who are protesting police brutality"".Meanwhile, more than 300 black artists and executives - including Michael B Jordan, Idris Elba and Viola Davis - have signed an open letter calling on Hollywood to invest in black communities and stop the ""glorification of police corruption"" on screen.The letter, published by Variety, was written by Insecure actor Kendrick Sampson, who was hit with police batons and shot with rubber bullets during the recent protests.""The way that Hollywood and mainstream media have contributed to the criminalisation of black people, the misrepresentation of the legal system, and the glorification of police corruption and violence has had dire consequences on Black lives,"" it read.It also demanded greater opportunities for black creatives off-camera and in senior management roles, as well as guaranteeing that marketing budgets were no longer slashed due to ""myths of limited international sales and lack of universality of Black-led stories"".The letter noted how ""distribution and marketing processes are often marred, filtered, and manipulated by the white gaze"".The open call comes in the same week that, in the UK, the BBC committed to investing £100m of its TV budget over a three year period to produce ""diverse and inclusive content"".Terry said the worldwide movement is a chance for deep and meaningful change.""This is an opportunity right now for us all to unite and get together and understand what this is and that we have to battle this together,"" he said.",24 June 2020,entertainment
BBC commits £100m to increasing diversity on TV,"The BBC is to increase diversity by investing £100m of its TV budget over a three year period to produce ""diverse and inclusive content"".Director general Tony Hall has described the move, which will apply from April 2021, as ""a big leap"".The BBC has set itself a mandatory target - 20% of off-screen talent must come from under-represented groups.That includes those with a disability or from a BAME or disadvantaged socio-economic background.There will also be three ""tests"" for diversity in the BBC's TV output, with programmes needing to meet two of them to qualify - diverse stories and portrayal on-screen, diverse production teams and talent and diverse-led production companies.The announcement follows widespread Black Lives Matter protests, after the death of George Floyd while in police custody in the US.""The senseless killing of George Floyd - and what it tells us about the stain of systemic racism - has had a profound impact on all of us,"" said Lord Hall.""It's made us question ourselves about what more we can do to help tackle racism - and drive inclusion within our organisation and in society as a whole.""This is our response - it's going to drive change in what we make and who makes it.  It's a big leap forward - and we'll have more to announce in the coming weeks.""Recent BBC productions from ethnic minority creatives and featuring actors from BAME backgrounds include Michaela Coel's 12-part drama, I May Destroy You. It charts the fallout from a sexual assault and received rave reviews.Elsewhere, the story of Anthony Bryan and the Windrush scandal was brought to our screens in the feature-length drama, Sitting In Limbo.In fact, the diversity announcement arrives on the 72nd anniversary of the day the Empire Windrush arrived at the port of Tilbury symbolising the beginning of the migration of thousands of people from the Caribbean to the UK.In October last year, TV presenter and campaigner June Sarpong was appointed as the BBC's director of creative diversity, as it pledged to ensure 50% of on-air roles will go to women by 2020, with targets of 15% for black, Asian and minority ethnic groups [BAME], 8% for disabled people and 8% for LGBT staff.Off air, the BBC promised at the time to increase the proportion of leadership roles filled by women from 44% to 50% by next year, and raise the share of such senior roles held by BAME staff from 11.5% to 15%.Reacting to Monday's latest package, Sarpong said: ""I came to the BBC as an outsider. Before joining I had an idea of this being an organisation that did not want to change. What I found was something different: an organisation that had ambitious goals for diversity and inclusion but didn't know how to reach them.""She believes the commitment ""will help to drive real change that will be felt by all audiences"".""I'm pleased that we're announcing this fund as the first of a series of bold steps that will help make the BBC an instrument of real change.""""As a black woman,"" she added, ""I feel and share in the pain that so many are feeling worldwide.""It makes it all the more important that we show up now not just with words but with meaningful action.""The cash injection will support diversity and inclusion across all genres of TV, including Children's, Education and Current Affairs.The BBC is calling it ""the biggest financial investment to on-air inclusion in the industry"", declaring that ""the media industry is not changing fast enough"".""The measures announced today are designed to accelerate the pace of change in increasing diversity and inclusion both on and off air,"" the statement read.Speaking to The Observer on Sunday, director Steve McQueen led the attack on racism in the British film and TV industry and the lack of diversity.""It's just not healthy,"" said Sir Steve. ""It's wrong. And yet, many people in the industry go along with it as if it is normal. It's not normal. It is anything but normal. It's blindingly, obviously wrong. It's blatant racism. Fact. I grew up with it.""The BBC's director of content, Charlotte Moore, said McQueen challenged her and the organisation to ""set meaningful targets and take proper action"" last year during the making of his upcoming anthology series, Small Axe.""He was right,"" said Moore. ""Today's announcement represents a truly transformational commitment to both on and off screen representation.""Concrete, tangible action is the only way we can bring about real sustainable change.""Meanwhile, actors including Chiwetel Ejiofor, Michaela Coel and Noel Clarke, as well as David Oyelowo and Meera Syal, have signed an open letter demanding that the UK film and TV industry will now ""put its money and practices where its mouth is"".The document, revealed on Monday, has more than 4,000 signatures, including those of presenter Anita Rani and directors Asif Kapadia, Gurinder Chadha and Rapman.",22 June 2020,entertainment
BBC commits £100m to increasing diversity on TV,"The BBC is to increase diversity by investing £100m of its TV budget over a three year period to produce ""diverse and inclusive content"".Director general Tony Hall has described the move, which will apply from April 2021, as ""a big leap"".The BBC has set itself a mandatory target - 20% of off-screen talent must come from under-represented groups.That includes those with a disability or from a BAME or disadvantaged socio-economic background.There will also be three ""tests"" for diversity in the BBC's TV output, with programmes needing to meet two of them to qualify - diverse stories and portrayal on-screen, diverse production teams and talent and diverse-led production companies.The announcement follows widespread Black Lives Matter protests, after the death of George Floyd while in police custody in the US.""The senseless killing of George Floyd - and what it tells us about the stain of systemic racism - has had a profound impact on all of us,"" said Lord Hall.""It's made us question ourselves about what more we can do to help tackle racism - and drive inclusion within our organisation and in society as a whole.""This is our response - it's going to drive change in what we make and who makes it.  It's a big leap forward - and we'll have more to announce in the coming weeks.""Recent BBC productions from ethnic minority creatives and featuring actors from BAME backgrounds include Michaela Coel's 12-part drama, I May Destroy You. It charts the fallout from a sexual assault and received rave reviews.Elsewhere, the story of Anthony Bryan and the Windrush scandal was brought to our screens in the feature-length drama, Sitting In Limbo.In fact, the diversity announcement arrives on the 72nd anniversary of the day the Empire Windrush arrived at the port of Tilbury symbolising the beginning of the migration of thousands of people from the Caribbean to the UK.In October last year, TV presenter and campaigner June Sarpong was appointed as the BBC's director of creative diversity, as it pledged to ensure 50% of on-air roles will go to women by 2020, with targets of 15% for black, Asian and minority ethnic groups [BAME], 8% for disabled people and 8% for LGBT staff.Off air, the BBC promised at the time to increase the proportion of leadership roles filled by women from 44% to 50% by next year, and raise the share of such senior roles held by BAME staff from 11.5% to 15%.Reacting to Monday's latest package, Sarpong said: ""I came to the BBC as an outsider. Before joining I had an idea of this being an organisation that did not want to change. What I found was something different: an organisation that had ambitious goals for diversity and inclusion but didn't know how to reach them.""She believes the commitment ""will help to drive real change that will be felt by all audiences"".""I'm pleased that we're announcing this fund as the first of a series of bold steps that will help make the BBC an instrument of real change.""""As a black woman,"" she added, ""I feel and share in the pain that so many are feeling worldwide.""It makes it all the more important that we show up now not just with words but with meaningful action.""The cash injection will support diversity and inclusion across all genres of TV, including Children's, Education and Current Affairs.The BBC is calling it ""the biggest financial investment to on-air inclusion in the industry"", declaring that ""the media industry is not changing fast enough"".""The measures announced today are designed to accelerate the pace of change in increasing diversity and inclusion both on and off air,"" the statement read.Speaking to The Observer on Sunday, director Steve McQueen led the attack on racism in the British film and TV industry and the lack of diversity.""It's just not healthy,"" said Sir Steve. ""It's wrong. And yet, many people in the industry go along with it as if it is normal. It's not normal. It is anything but normal. It's blindingly, obviously wrong. It's blatant racism. Fact. I grew up with it.""The BBC's director of content, Charlotte Moore, said McQueen challenged her and the organisation to ""set meaningful targets and take proper action"" last year during the making of his upcoming anthology series, Small Axe.""He was right,"" said Moore. ""Today's announcement represents a truly transformational commitment to both on and off screen representation.""Concrete, tangible action is the only way we can bring about real sustainable change.""Meanwhile, actors including Chiwetel Ejiofor, Michaela Coel and Noel Clarke, as well as David Oyelowo and Meera Syal, have signed an open letter demanding that the UK film and TV industry will now ""put its money and practices where its mouth is"".The document, revealed on Monday, has more than 4,000 signatures, including those of presenter Anita Rani and directors Asif Kapadia, Gurinder Chadha and Rapman.",22 June 2020,entertainment
Brooklyn Nine-Nine: New episodes 'in the trash' after George Floyd death,"Brooklyn Nine-Nine star Terry Crews has said four new episodes of the police comedy were thrown ""in the trash"" in the wake of the death of George Floyd.Crews said the show would ""start over"" in light of the anti-racism protests.He said: ""We've had a lot of sombre talks about it and deep conversations and we hope through this we're going to make something that will be truly groundbreaking this year.""We have an opportunity and we plan to use it in the best way possible.""Co-creator Dan Goor had four episodes ""all ready to go"" before Mr Floyd's death a month ago prompted widespread Black Lives Matter protests as well as soul-searching in society in the US and beyond.""They just threw them in the trash,"" Crews told Access Hollywood. ""We have to start over. Right now we don't know which direction it's going to go in.""The actor and America's Got Talent presenter also recounted his own dealings with the police, saying police officers had pointed guns at him, mistakenly, before he became a well-known face.""It's something that every black man has been through and it's hard to really try to get other people to understand,"" he said.The 51-year-old said the momentum for change made it ""Black America's Me Too movement"".""We always knew this was happening, but now white people are understanding,"" he said.Earlier this month, Goor and the cast made a $100,000 (£79,000) donation to the National Bail Fund Network to support ""the many people who are protesting police brutality"".Meanwhile, more than 300 black artists and executives - including Michael B Jordan, Idris Elba and Viola Davis - have signed an open letter calling on Hollywood to invest in black communities and stop the ""glorification of police corruption"" on screen.The letter, published by Variety, was written by Insecure actor Kendrick Sampson, who was hit with police batons and shot with rubber bullets during the recent protests.""The way that Hollywood and mainstream media have contributed to the criminalisation of black people, the misrepresentation of the legal system, and the glorification of police corruption and violence has had dire consequences on Black lives,"" it read.It also demanded greater opportunities for black creatives off-camera and in senior management roles, as well as guaranteeing that marketing budgets were no longer slashed due to ""myths of limited international sales and lack of universality of Black-led stories"".The letter noted how ""distribution and marketing processes are often marred, filtered, and manipulated by the white gaze"".The open call comes in the same week that, in the UK, the BBC committed to investing £100m of its TV budget over a three year period to produce ""diverse and inclusive content"".Terry said the worldwide movement is a chance for deep and meaningful change.""This is an opportunity right now for us all to unite and get together and understand what this is and that we have to battle this together,"" he said.",24 June 2020,entertainment
BBC commits £100m to increasing diversity on TV,"The BBC is to increase diversity by investing £100m of its TV budget over a three year period to produce ""diverse and inclusive content"".Director general Tony Hall has described the move, which will apply from April 2021, as ""a big leap"".The BBC has set itself a mandatory target - 20% of off-screen talent must come from under-represented groups.That includes those with a disability or from a BAME or disadvantaged socio-economic background.There will also be three ""tests"" for diversity in the BBC's TV output, with programmes needing to meet two of them to qualify - diverse stories and portrayal on-screen, diverse production teams and talent and diverse-led production companies.The announcement follows widespread Black Lives Matter protests, after the death of George Floyd while in police custody in the US.""The senseless killing of George Floyd - and what it tells us about the stain of systemic racism - has had a profound impact on all of us,"" said Lord Hall.""It's made us question ourselves about what more we can do to help tackle racism - and drive inclusion within our organisation and in society as a whole.""This is our response - it's going to drive change in what we make and who makes it.  It's a big leap forward - and we'll have more to announce in the coming weeks.""Recent BBC productions from ethnic minority creatives and featuring actors from BAME backgrounds include Michaela Coel's 12-part drama, I May Destroy You. It charts the fallout from a sexual assault and received rave reviews.Elsewhere, the story of Anthony Bryan and the Windrush scandal was brought to our screens in the feature-length drama, Sitting In Limbo.In fact, the diversity announcement arrives on the 72nd anniversary of the day the Empire Windrush arrived at the port of Tilbury symbolising the beginning of the migration of thousands of people from the Caribbean to the UK.In October last year, TV presenter and campaigner June Sarpong was appointed as the BBC's director of creative diversity, as it pledged to ensure 50% of on-air roles will go to women by 2020, with targets of 15% for black, Asian and minority ethnic groups [BAME], 8% for disabled people and 8% for LGBT staff.Off air, the BBC promised at the time to increase the proportion of leadership roles filled by women from 44% to 50% by next year, and raise the share of such senior roles held by BAME staff from 11.5% to 15%.Reacting to Monday's latest package, Sarpong said: ""I came to the BBC as an outsider. Before joining I had an idea of this being an organisation that did not want to change. What I found was something different: an organisation that had ambitious goals for diversity and inclusion but didn't know how to reach them.""She believes the commitment ""will help to drive real change that will be felt by all audiences"".""I'm pleased that we're announcing this fund as the first of a series of bold steps that will help make the BBC an instrument of real change.""""As a black woman,"" she added, ""I feel and share in the pain that so many are feeling worldwide.""It makes it all the more important that we show up now not just with words but with meaningful action.""The cash injection will support diversity and inclusion across all genres of TV, including Children's, Education and Current Affairs.The BBC is calling it ""the biggest financial investment to on-air inclusion in the industry"", declaring that ""the media industry is not changing fast enough"".""The measures announced today are designed to accelerate the pace of change in increasing diversity and inclusion both on and off air,"" the statement read.Speaking to The Observer on Sunday, director Steve McQueen led the attack on racism in the British film and TV industry and the lack of diversity.""It's just not healthy,"" said Sir Steve. ""It's wrong. And yet, many people in the industry go along with it as if it is normal. It's not normal. It is anything but normal. It's blindingly, obviously wrong. It's blatant racism. Fact. I grew up with it.""The BBC's director of content, Charlotte Moore, said McQueen challenged her and the organisation to ""set meaningful targets and take proper action"" last year during the making of his upcoming anthology series, Small Axe.""He was right,"" said Moore. ""Today's announcement represents a truly transformational commitment to both on and off screen representation.""Concrete, tangible action is the only way we can bring about real sustainable change.""Meanwhile, actors including Chiwetel Ejiofor, Michaela Coel and Noel Clarke, as well as David Oyelowo and Meera Syal, have signed an open letter demanding that the UK film and TV industry will now ""put its money and practices where its mouth is"".The document, revealed on Monday, has more than 4,000 signatures, including those of presenter Anita Rani and directors Asif Kapadia, Gurinder Chadha and Rapman.",22 June 2020,entertainment
Mel Gibson and Winona Ryder at odds over anti-Semitism claims,"Mel Gibson and Winona Ryder have become embroiled in a row after she claimed he made anti-Semitic comments to her.The actress said he referred to her as an ""oven dodger"" in an apparent reference to her Jewish background.Gibson's representative said Ryder's allegations, which she made in 2010 and repeated in a recent interview with The Sunday Times, were ""100% untrue"".Ryder responded by asserting again that she and a late friend had been ""on the receiving end of his hateful words"".The Stranger Things actress described the alleged encounter as ""a painful and vivid memory"".Ryder first made the claims in an interview with GQ in 2010. She told this weekend's Sunday Times: ""We were at a crowded party with one of my good friends, and Mel Gibson was smoking a cigar, and we're all talking and he said to my friend, who's gay, 'Oh wait, am I gonna get Aids?'""And then something came up about Jews, and he said, 'You're not an oven dodger, are you?'""Ryder, 48, said Gibson, 64, had tried to apologise to her at a later date.The Braveheart star's representative disputed Ryder's version of events, however, accusing her of ""lying"" about both the alleged comments and apology.Gibson, he claimed, ""did reach out to [Ryder], many years ago, to confront her about her lies and she refused to address it with him"".Ryder responded by offering more details, including that the encounter occurred ""around 1996"".""I believe in redemption and forgiveness and hope that Mr Gibson has found a healthy way to deal with his demons, but I am not one of them,"" she said in a statement.""Only by accepting responsibility for our behaviour in this life can we make amends and truly respect each other, and I wish him well on this life-long journey.""Ryder, whose father is Jewish, was born Winona Laura Horowitz in 1971. In the Sunday Times she said she was ""not religious"" but identified as Jewish.It is not the only time Gibson has been accused of using the offensive term, which alludes to the mass murder of Jews in Nazi death camps during World War Two.In 2012 screenwriter Joe Eszterhas accused the actor of using it while they were working on a film about Jewish hero Judah Maccabee.Gibson, who made widely documented anti-Semitic comments when he was arrested for drink-driving in 2006, called Eszterhas's claims ""utter fabrications"".This week it was announced that Britain's Aardman Animations is teaming up with Netflix to make its upcoming Chicken Run sequel.It has not been confirmed whether Gibson, who voiced rooster Rocky in the 2000 original, will return to the role.According to The Wrap, however, he will not be invited back when the film goes into production next year. The BBC has approached Netflix for comment.",24 June 2020,entertainment
