Jimmy Kimmel: TV host sorry for blackface sketches,"US TV host Jimmy Kimmel has apologised for using make-up to impersonate black stars like Snoop Dogg, Oprah Winfrey and basketball player Karl Malone.Kimmel said he had thought of his performances as ""impersonations of celebrities and nothing more"".But, looking back, he admitted they were ""embarrassing"" and described them as ""thoughtless moments"".He said sorry ""to those who were genuinely hurt or offended by the make-up I wore or the words I spoke"".Kimmel fronts a late-night talk show on ABC and hosted the Oscars in 2017 and 2018.He had been under pressure to address his past use of blackface, especially after fellow presenter Jimmy Fallon issued a similar apology last month.It has also just been revealed that Tina Fey asked for four episodes of sitcom 30 Rock in which characters appear in blackface to be taken down.Kimmel said he had been reluctant to speak about his sketches, however, because he thought that ""would be celebrated as a victory by those who equate apologies with weakness and cheer for leaders who use prejudice to divide us"". He added: ""That delay was a mistake.""In a statement on Tuesday, he explained that he did an impression of former NBA star Malone on his radio show in the 1990s, and continued to impersonate the sportsman when he moved onto TV.""We hired make-up artists to make me look as much like Karl Malone as possible,"" he said. ""I never considered that this might be seen as anything other than an imitation of a fellow human being, one that had no more to do with Karl's skin colour than it did his bulging muscles and bald head.""I've done dozens of impressions of famous people, including Snoop Dogg, Oprah, Eminem, Dick Vitale, Rosie, and many others. In each case, I thought of them as impersonations of celebrities and nothing more.""Looking back, many of these sketches are embarrassing, and it is frustrating that these thoughtless moments have become a weapon used by some to diminish my criticisms of social and other injustices.""He added that he believed he had ""evolved and matured"" over the past two decades.""Thank you for giving me an opportunity to explain and to those I've disappointed, I am sorry,"" he concluded.",23 June 2020,entertainment
Megan Fox says she was 'never preyed upon' by Michael Bay,"US actress Megan Fox has defended film director Michael Bay after a 2009 interview where she described an encounter with him resurfaced online.The interview showed Fox describe how Bay got her to ""dance underneath a waterfall"" in a bikini when she was 15 years old, for the film Bad Boys II. Some Twitter users said Bay, who later directed Fox in two Transformer films, had ""sexualised"" her as a teenager.But Fox said she was ""never assaulted or preyed upon"" sexually.The video of Fox being interviewed by Jimmy Kimmel was shared on Twitter with the comment: ""Clip from 2009 where Megan Fox tells a story about Michael Bay sexualising her as a 15 y/o. The crowd laughs, and Kimmel makes gross jokes. Teen girls being preyed on by older men has never been taken seriously and still isn't.""Writing on Instagram, Fox said: ""Please hear me when I thank you for your support but these specific instances were inconsequential in a long and arduous journey along which I have endured some genuinely harrowing experiences in a ruthlessly misogynistic industry.""When it comes to my direct experiences with Michael, I was never assaulted or preyed upon in what I felt was a sexual manner.""She said she was posting in order to ""clarify some details as they have been lost in the retelling of the events and cast a sinister shadow that doesn't really, in my opinion, belong"". May we all continue waking up❤️A post shared by  Megan Fox (@meganfox) on Jun 22, 2020 at 6:15pm PDTEnd of Instagram post  by meganfoxFox continued: ""There are many names that deserve to be going viral in cancel culture right now, but they are safely stored in the fragmented recesses of my heart. ""I'm thankful to all of you who are brave enough to speak out and I'm grateful to all of you who are taking it upon yourselves to support, uplift, and bring comfort to those who have been harmed by a violent and toxic societal paradigm.""Others responding to the 2009 interview with Jimmy Kimmel also referred to reports that Spielberg, an executive producer on Transformers, had forced Fox to leave the series after she compared Bay to Adolf Hitler.Fox's publicist said at the time that the actress left of her own accord.In a later interview though, Fox said: ""All I had to do was apologise - and I refused. I was so self-righteous at 23, I couldn't see [that] it was for the greater good. I really thought I was Joan of Arc.""But in her new Instagram post, she said she was ""never assaulted or preyed upon"" by Spielberg either.In reference to another story about her auditioning for her Transformers role, Fox said she was 19 or 20 at the time and had to pretend ""to work on one of Michael's Ferraris... there were several other crew members and employees present and I was at no point undressed or anything similar.""I was not made to 'wash' or work on someone's cars in a way that was extraneous from the material in the actual script.""The first two Transformers films, starring Fox, were released in 2007 and 2009.The BBC has asked representatives for Bay and Spielberg for comment.",23 June 2020,entertainment
Mel Gibson and Winona Ryder at odds over anti-Semitism claims,"Mel Gibson and Winona Ryder have become embroiled in a row after she claimed he made anti-Semitic comments to her.The actress said he referred to her as an ""oven dodger"" in an apparent reference to her Jewish background.Gibson's representative said Ryder's allegations, which she made in 2010 and repeated in a recent interview with The Sunday Times, were ""100% untrue"".Ryder responded by asserting again that she and a late friend had been ""on the receiving end of his hateful words"".The Stranger Things actress described the alleged encounter as ""a painful and vivid memory"".Ryder first made the claims in an interview with GQ in 2010. She told this weekend's Sunday Times: ""We were at a crowded party with one of my good friends, and Mel Gibson was smoking a cigar, and we're all talking and he said to my friend, who's gay, 'Oh wait, am I gonna get Aids?'""And then something came up about Jews, and he said, 'You're not an oven dodger, are you?'""Ryder, 48, said Gibson, 64, had tried to apologise to her at a later date.The Braveheart star's representative disputed Ryder's version of events, however, accusing her of ""lying"" about both the alleged comments and apology.Gibson, he claimed, ""did reach out to [Ryder], many years ago, to confront her about her lies and she refused to address it with him"".Ryder responded by offering more details, including that the encounter occurred ""around 1996"".""I believe in redemption and forgiveness and hope that Mr Gibson has found a healthy way to deal with his demons, but I am not one of them,"" she said in a statement.""Only by accepting responsibility for our behaviour in this life can we make amends and truly respect each other, and I wish him well on this life-long journey.""Ryder, whose father is Jewish, was born Winona Laura Horowitz in 1971. In the Sunday Times she said she was ""not religious"" but identified as Jewish.It is not the only time Gibson has been accused of using the offensive term, which alludes to the mass murder of Jews in Nazi death camps during World War Two.In 2012 screenwriter Joe Eszterhas accused the actor of using it while they were working on a film about Jewish hero Judah Maccabee.Gibson, who made widely documented anti-Semitic comments when he was arrested for drink-driving in 2006, called Eszterhas's claims ""utter fabrications"".This week it was announced that Britain's Aardman Animations is teaming up with Netflix to make its upcoming Chicken Run sequel.It has not been confirmed whether Gibson, who voiced rooster Rocky in the 2000 original, will return to the role.According to The Wrap, however, he will not be invited back when the film goes into production next year. The BBC has approached Netflix for comment.",24 June 2020,entertainment
"Steve Bing: Film producer took his own life, coroner says","Filmmaker Steve Bing took his own life, a coroner in Los Angeles has confirmed.Bing, who had a son with actress Elizabeth Hurley, was found dead on Monday at the age of 55. The LA County Medical Examiner-Coroner's Office listed his cause of death as ""multiple blunt trauma"" and said the manner was suicide. The case is now closed, the coroner added.Hurley has paid tribute to him, as have former US president Bill Clinton and Rolling Stones singer Sir Mick Jagger.In Hollywood, Bing was known for co-writing the 2003 film Kangaroo Jack; financing 2004's The Polar Express, voiced by Tom Hanks; and producing the 2000 remake of Get Carter starring Sylvester Stallone and Martin Scorsese's Rolling Stones documentary Shine a Light.Sir Mick, said it was ""so sad to hear of Steve Bing's passing"".The star wrote: ""He was such a kind and generous friend and supported so many good and just causes. I will miss him very much.""Hurley remembered the producer and philanthropist as a ""sweet, kind man"".She wrote on Instagram: ""I am saddened beyond belief that my ex Steve is no longer with us. It is a terrible end.""Their son, Damian, 18, added: ""Thank you from the bottom of my heart to everyone that has reached out following the devastating news.""I'm trying to reply to as many of you as I can, but please know I will always remember your kindness. This is a very strange and confusing time and I'm immensely grateful to be surrounded by my phenomenal family and friends.""At the age of 18, Steve Bing inherited a $600m property fortune from his grandfather Leo Bing.He was a big supporter of Clinton, having donated at least $10m to his foundation and paid for the former president's trip to North Korea in 2009 to negotiate for the release of two US journalists.""I loved Steve Bing very much,"" the former president said.""He had a big heart, and he was willing to do anything he could for the people and causes he believed in. I will miss him and his enthusiasm more than I can say, and I hope he's finally found peace.""For information and support on mental health and suicide, access the BBC Action Line.",24 June 2020,entertainment
Jimmy Kimmel: TV host sorry for blackface sketches,"US TV host Jimmy Kimmel has apologised for using make-up to impersonate black stars like Snoop Dogg, Oprah Winfrey and basketball player Karl Malone.Kimmel said he had thought of his performances as ""impersonations of celebrities and nothing more"".But, looking back, he admitted they were ""embarrassing"" and described them as ""thoughtless moments"".He said sorry ""to those who were genuinely hurt or offended by the make-up I wore or the words I spoke"".Kimmel fronts a late-night talk show on ABC and hosted the Oscars in 2017 and 2018.He had been under pressure to address his past use of blackface, especially after fellow presenter Jimmy Fallon issued a similar apology last month.It has also just been revealed that Tina Fey asked for four episodes of sitcom 30 Rock in which characters appear in blackface to be taken down.Kimmel said he had been reluctant to speak about his sketches, however, because he thought that ""would be celebrated as a victory by those who equate apologies with weakness and cheer for leaders who use prejudice to divide us"". He added: ""That delay was a mistake.""In a statement on Tuesday, he explained that he did an impression of former NBA star Malone on his radio show in the 1990s, and continued to impersonate the sportsman when he moved onto TV.""We hired make-up artists to make me look as much like Karl Malone as possible,"" he said. ""I never considered that this might be seen as anything other than an imitation of a fellow human being, one that had no more to do with Karl's skin colour than it did his bulging muscles and bald head.""I've done dozens of impressions of famous people, including Snoop Dogg, Oprah, Eminem, Dick Vitale, Rosie, and many others. In each case, I thought of them as impersonations of celebrities and nothing more.""Looking back, many of these sketches are embarrassing, and it is frustrating that these thoughtless moments have become a weapon used by some to diminish my criticisms of social and other injustices.""He added that he believed he had ""evolved and matured"" over the past two decades.""Thank you for giving me an opportunity to explain and to those I've disappointed, I am sorry,"" he concluded.",23 June 2020,entertainment
Megan Fox says she was 'never preyed upon' by Michael Bay,"US actress Megan Fox has defended film director Michael Bay after a 2009 interview where she described an encounter with him resurfaced online.The interview showed Fox describe how Bay got her to ""dance underneath a waterfall"" in a bikini when she was 15 years old, for the film Bad Boys II. Some Twitter users said Bay, who later directed Fox in two Transformer films, had ""sexualised"" her as a teenager.But Fox said she was ""never assaulted or preyed upon"" sexually.The video of Fox being interviewed by Jimmy Kimmel was shared on Twitter with the comment: ""Clip from 2009 where Megan Fox tells a story about Michael Bay sexualising her as a 15 y/o. The crowd laughs, and Kimmel makes gross jokes. Teen girls being preyed on by older men has never been taken seriously and still isn't.""Writing on Instagram, Fox said: ""Please hear me when I thank you for your support but these specific instances were inconsequential in a long and arduous journey along which I have endured some genuinely harrowing experiences in a ruthlessly misogynistic industry.""When it comes to my direct experiences with Michael, I was never assaulted or preyed upon in what I felt was a sexual manner.""She said she was posting in order to ""clarify some details as they have been lost in the retelling of the events and cast a sinister shadow that doesn't really, in my opinion, belong"". May we all continue waking up❤️A post shared by  Megan Fox (@meganfox) on Jun 22, 2020 at 6:15pm PDTEnd of Instagram post  by meganfoxFox continued: ""There are many names that deserve to be going viral in cancel culture right now, but they are safely stored in the fragmented recesses of my heart. ""I'm thankful to all of you who are brave enough to speak out and I'm grateful to all of you who are taking it upon yourselves to support, uplift, and bring comfort to those who have been harmed by a violent and toxic societal paradigm.""Others responding to the 2009 interview with Jimmy Kimmel also referred to reports that Spielberg, an executive producer on Transformers, had forced Fox to leave the series after she compared Bay to Adolf Hitler.Fox's publicist said at the time that the actress left of her own accord.In a later interview though, Fox said: ""All I had to do was apologise - and I refused. I was so self-righteous at 23, I couldn't see [that] it was for the greater good. I really thought I was Joan of Arc.""But in her new Instagram post, she said she was ""never assaulted or preyed upon"" by Spielberg either.In reference to another story about her auditioning for her Transformers role, Fox said she was 19 or 20 at the time and had to pretend ""to work on one of Michael's Ferraris... there were several other crew members and employees present and I was at no point undressed or anything similar.""I was not made to 'wash' or work on someone's cars in a way that was extraneous from the material in the actual script.""The first two Transformers films, starring Fox, were released in 2007 and 2009.The BBC has asked representatives for Bay and Spielberg for comment.",23 June 2020,entertainment
"How and when will cinemas reopen in England, and which films can you see?","Cinemas in England can reopen from 4 July, the government has confirmed - although many will not be ready to do so by that date.Below, find out which cinemas are reopening when, what safety measures will be in place, and which films you'll be able to watch.Of the UK's main cinema chains:Vue had previously been aiming for 4 July, but needs more time to make the necessary preparations.Many independent cinemas are choosing to wait longer. In a survey by the Independent Cinema Office, 13% of venues said they would be back in July, with 15% reopening in August and a further 23% in September.Manchester's Home is among those holding off until September. Executive director Jon Gilchrist said July was not the best option for venues ""whose programmes do not focus on the summer blockbusters"".He said: ""Instead we want to take the time to ensure that we have time to make the necessary adjustments to the building, and to speak to our audiences about how they can be involved in our plans.""Details of reopenings in Scotland, Wales and Northern Ireland have yet to be announced by the respective governments.The chains that have detailed their safety procedures have said they will put in place:The UK Cinema Association will publish full government-agreed guidelines for reopening in the coming days.Showcase, which has released the greatest detail, said it would encourage customers to use face masks, although a safety video suggests people can remove them once they have taken their seats.The chain also promised that an ""anti-viral fogging machine"" will be used on every seat between every screening, and each auditorium will have an air purifying system. People will be able to order popcorn and snacks in advance, and scan their own tickets to gain entry.Vue said it was waiting for advice from government, but that its methods had been ""responsibly and robustly"" tested in its venues in countries like Taiwan, Germany and Denmark.Odeon said it had been ""working hard to implement new health and safety measures across all of our sites"", and Cineworld said it was following government guidelines ""in order to make cinemagoers feel as comfortable and safe as possible"".Cinemas that are open in early- and mid-July will start by showing classic films.Vue has said it will screen a 2K print of Star Wars: The Empire Strikes Back plus Christopher Nolan's Inception for its 10th anniversary.Cinemas have been given access to an archive of 450 films to choose from while the schedule of new releases ramps up.Then, major new film releases scheduled for July include:In the autumn and winter - assuming cinemas are not forced to shut again - there will be a glut of big movies, many of which had been delayed. They include: A Quiet Place Part II (4 September), The King's Man (16 September), Wonder Woman 1984 (2 October), Black Widow (28 October), No Time To Die (12 November), Soul (20 November), and Top Gun: Maverick (23 December).",23 June 2020,entertainment
