X Factor's Alexandra Burke reveals music industry racism,"Singer Alexandra Burke has spoken out about her experiences of racism in the music industry, revealing she was asked to bleach her skin ""to look whiter"".After winning X Factor, Burke said she was told she would ""have to work 10 times harder than a white artist, because of the colour of your skin"".In a 15-minute Instagram video, she recalls being told: ""You can't have braids, you can't have an afro.""You have to have hair... that appeals to white people.""The 31-year-old star, who won the TV talent show in 2008 at the age of 19, described the experiences as ""heartbreaking"".Burke, who refused to bleach her skin, said she was inspired to tell her story by fellow X Factor contestant Misha B, who recently spoke out about ""being devalued"" at the hands of the music industry.Misha B claimed the X Factor projected ""this angry black girl narrative"", using words such as ""feisty"" and ""bully"" to describe her after one a live performance on the show. The 2011 contestant said it left her feeling suicidal.""I could have spoken up much earlier, but was too scared to,"" said Burke, whose Instagram post has attracted a lot of attention, and sympathy, on social media.The music star revealed the micro-aggressions she experienced at the hands of record labels, being told regularly that she ""comes across aggressive"".She said she was told: ""You can't release this kind of music, because white people don't understand that"", and added: ""I am so upset with myself that I allowed that."" Burke, whose hit singles Hallelujah, Bad Boys and All Night Long were all nominated for Brit Awards, also played the lead in the critically acclaimed West End musical The Bodyguard.The singer said was told: ""Because you're a black girl, you won't make it that far in the industry... if you were white, you would be bigger than what you are now, you could sell more records, you'd be a Brit Award-winner"".""It's hurtful,"" she added.She was raised in north London by her mother, Soul II Soul singer Melissa Bell, who died in August 2017 - just before Burke was due to take part in Strictly Come Dancing.She recalled how one journalist accused her of ""being a diva"" when she asked not to do any publicity on the show's red carpet, which happened to be taking place on the same day as her mother died.""That was the image they had of me, because of the papers."" she said. ""I was so scared on that show. So many trolls, telling me all kinds of stuff. ""I have no idea how I got through it. I don't even like thinking about that experience. It's simply because of me being a black, strong woman. ""I can speak up for myself because that's how I've been taught. But I would never do it in a way that offends people or hurts anyone.""She said the Black Lives Matter movement had persuaded her to share her experiences because ""the truth is all we've got"".""I just feel like people need to not see colour,"" said Burke. ""My mum always raised me to never see colour. I will continue that way because that's what makes me happy. ""People are people. We are all human, we all have feelings. So be kind.""",20 June 2020,entertainment
Sir Ian Holm: Lord of the Rings and Alien star dies aged 88,"Stage and film actor Sir Ian Holm, who played Bilbo Baggins in The Lord of the Rings films, has died aged 88.Sir Ian, Oscar-nominated as Olympic running coach Sam Mussabini in Chariots of Fire, also played the android Ash in 1979's Alien.""It is with great sadness we can confirm that the actor Sir Ian Holm CBE passed away this morning at the age of 88,"" his agent said in a statement.""He died peacefully in hospital with his family and carer,"" he added.His illness was Parkinson's-related, his agent confirmed.Holm, who also played Dr Willis in The Madness of King George, was classically trained and put in memorable performances in numerous plays.The National Theatre remembered him as an ""extraordinary actor"" whose performance as King Lear in 1997 created ""wonderful memories"".Samuel West, whose father Timothy played Gloucester in the production, recalled on Twitter that the older cast members were all asked to grow beards.When they came together for a read-through, he remembered, ""[director] Richard Eyre said it looked like a garden gnome convention"".Sir Ian originated the role of Lenny in Harold Pinter's The Homecoming in 1965, reprising his performance on film eight years later. However, his stage career was cut short after he developed acute stage fright during a production of The Iceman Cometh in 1976.He went on to work primarily in film, thanks to roles in such high-profile movies as The Fifth Element and the Lord of the Rings series.It was 1981's Chariots of Fire that saw him receive his best supporting actor Oscar nomination.The same film won him a Bafta, as did his supporting performance in The Bofors Gun in 1968.Sir Ian played Bilbo in Peter Jackson's Lord of the Rings films, having played Frodo Baggins for BBC radio in 1981.Diminutive in stature, he was similarly well-cast as Pod in 1992 children's series The Borrowers.""I'm never the same twice,"" he told the Los Angeles Times in 2000, ""and I'm not a movie star-type, so people don't demand that I'm always the same.""He received a knighthood in 1998 for his contribution to drama following the CBE he received in 1989.Comedian Eddie Izzard remembered Sir Ian as ""a wonderful actor"", adding: ""It's so sad to see him go.""Director Edgar Wright also paid tribute, calling him ""a genius actor who brought considerable presence to parts funny, heartbreaking and terrifying"".""What an actor,"" tweeted League of Gentleman star Reece Shearsmith. ""A lifetime of incredible performances.""Peep Show star Robert Webb was among many others to express respect for ""a splendid actor"" who ""could be very funny too"".",19 June 2020,entertainment
"Alicia Keys, LL Cool J and the new wave of protest songs","The death of George Floyd has prompted one of the biggest movements against racism since the civil rights era.Protests were held globally after video footage from Minneapolis showed a white police officer kneeling on Mr Floyd's neck for almost nine minutes. The 46-year-old could be heard repeatedly telling the officer, ""I can't breathe"".Around the world, music became a crucial way for people to express their grief and anger. Bob Marley's Get Up, Stand Up and Bill Withers' Lean On Me soundtracked several protests, while streaming figures for songs that call out police violence soared: from Childish Gambino's This Is America and Kendrick Lamar's Alright to NWA's visceral hip-hop track [Expletive] Tha Police.The latter was also used by hackers to disrupt police scanners in Chicago during the protests. In a more unifying moment, protestors in Atlanta encouraged the National Guard to join them in performing the Macarena.As the Black Lives Matter movement continues, the record industry has been paused to examine its own history of racial exclusion, and the inequity between black artists and the mainly white executives who profit from their work.Meanwhile, artists have channelled their frustration and anger into a new wave of protest songs, directly inspired by Mr Floyd's death and its aftermath.Here are some of the most striking examples - but please be aware that many of these songs contain explicit language.End of Youtube post  by Alicia Keys - TopicSung from the perspective of a mourning mother whose son has been shot to death, Alicia Keys' new single was released on Juneteenth - a holiday celebrating the emancipation of enslaved people in the US.It was originally written in response to the deaths of Mike Brown and Sandra Bland, the former killed by police in Missouri in 2014, the latter who died in a jail cell in 2015 after Texas police stopped her for a minor traffic violation - but Keys said the message was ""never not going to be relevant"".""Of course there is no perfect way to die,"" she wrote in an Instagram caption, as she premiered the song. ""This phrase doesn't even make sense but that's what makes the title so powerful and heartbreaking because so many have died unjustly. ""We all know none of these innocent lives should have been taken due to the culture of police violence.""End of Youtube post  by HERMusicVEVO""Just by the title, you know that it means something painful,"" said Grammy-nominated R&B artist H.E.R. as she debuted her new song in a living room concert.""These lyrics were kind of easy to write because it came from a conversation of what's happening right now, what's been happening, and the change that we need to see,"" she said before her performance. ""I think music is powerful when it comes to change and when it comes to healing, and that's why I wrote this song, to make a mark in history.""The sombre, guitar-led song asks: ""What is a gun to a man that surrenders / What's it gonna take for someone to defend her / If we all agree that we're equal as people / Then why can't we see what's evil?""H.E.R. said the track tackles the question that's been plaguing her over the last few weeks: Why is there so much hate?""My favourite line in the song is, 'How do we cope when we don't love each other?'"" she told TMZ. ""I think we're all questioning that now.""A post shared by LL COOL J (@llcoolj) on May 31, 2020 at 7:13pm PDTEnd of Instagram post  by llcooljFrom the very first bar, you can tell LL Cool J won't be holding back.""For 400 years you had your knees on our necks,"" he raps. ""A garden of evil with no seeds of respect"".The 52-year-old goes on to ask what would have happened to former Minneapolis police officer Derek Chauvin, had he not been filmed by bystanders during Mr Floyd's fatal arrest.""Watching that man die slow left a hole,"" he says, ""If it wasn't for them phones, Chauvin would be at home / Feeling justified because of George skin tone / I'm telling those with melanin, you're not alone.""End of Youtube post  by Dua SalehMinneapolis artist Dua Saleh originally wrote Body Cast in response to the deaths of Jamar Clark and Philando Castile, who were fatally shot by police in separate incidents in 2015 and 2016.""Unfortunately, I could have written the song at any point in my life and it would have been relevant, which is frightening to say the least,"" they told the Switched On Pop podcast.The intro samples clips of Angela Whitehead, a woman from Montana who went viral last year when she rebuked two police officers for entering her home without a warrant or viable cause.Saleh later references the stand-off in her lyrics, singing: ""You must be crazy, coming up in here talking about you heard something /  You heard me talking, I talk loud and I'm aggressive and guess what? / You did not knock on my door.""""I just don't trust police officers in general,"" the singer said. ""I was just like disgusted at the thought that policing was a safe and viable option for black communities.""Proceeds from the song's download are being donated to the Minneapolis-based organisation, Black Visions Collective.End of Youtube post  by Denzel Curry""Someone asked, how do I feel?"" Terrace Martin wrote, as he introduced his response to George Floyd's death. ""I told them hurt, fearless, angry, aware and fully ready to protect me, my family and my people at all cost. I got together with black men that felt the same way and created a work of truth.""The result is Pig Feet - a frenetic and urgent collision of jazz and hip-hop, where Kamasi Washington's fidgety saxophone emphasises lyrics about structural racism and police brutality.It was first released on YouTube, accompanied by a video compiling clips from recent Black Lives Matter protests, followed by a list of victims of police violence that scroll silently up the screen. just singing what’s on my heart...hope this blesses someone🙏🏾❤️ @sdhtoronto thanks for this dope shirt!!🔥🔥 #ijustwantolive #blacklivesmatter #ijustwannalive #equality #black #blackexcellence #racism #justice @mstinalawsonA post shared by  Keedron Bryant (@keedronbryant) on May 26, 2020 at 2:01pm PDTEnd of Instagram post  by keedronbryantTwelve-year-old Keedron Bryant gave voice to the feelings of thousands when he uploaded a simple, a capella performance of the original song I Just Wanna Live to Instagram three weeks ago.""I'm a young black man / Doing all that I can / To stand, oh but when I look around / And I see what's being done to my kind/ Every day, I'm being hunted as prey,"" he sang, looking directly into the camera.His performance, and the directness of the lyrics, written by his mother, won praise from Barack Obama, LeBron James, Janet Jackson and Katy Perry, who reposted the song to her followers with the message #BLACKLIVESMATTER.On Friday, record label Warner Bros announced it had signed Keedron to a recording contract.",19 June 2020,entertainment
"Beyoncé releases surprise new song, Black Parade, on Juneteenth","Beyoncé has released a surprise new song, Black Parade, hours after announcing a new initiative to support black-owned businesses.The track includes powerful lyrics about black history, police brutality and the George Floyd protests. ""Put your fists up in the air, show black love,"" sings the star. ""Need peace and reparation for my people.""The song was released on Juneteenth, a holiday marking the official end of slavery in the US.The celebration originated in Beyoncé's home state of Texas but is now celebrated annually on 19 June throughout the US, with varying degrees of official recognition, sometimes under the names Emancipation Day or Black Independence Day.Black Parade is Beyoncé's first solo release since last year's Homecoming, a live album and documentary covering her blockbuster performance at Coachella in 2018; and The Lion King: The Gift, which accompanied Disney's live action remake of its classic animation. ""I'm going back to the South, where my roots ain't watered down,"" she sings as the song opens.The lyrics go on to reference the Covid-19 pandemic (""Fly on the runway in my hazmat""), police brutality (""Rubber bullets bouncing off me"") and Tamika Mallory, a prominent activist in the Women's March and Black Lives Matter movements.Warning: The following song contains explicit language.End of Youtube post  by Beyoncé - TopicThe track appeared on streaming services shortly after the star launched Black Parade Route, an online directory of black-owned businesses selling everything from fashion and beauty products to home furnishings and coffee. ""Being Black is your activism. Black excellence is a form of protest. Black joy is your right,"" wrote the singer on a tagline on her website.According to the site, the initiative will benefit the star's BeyGOOD's Black Business Impact Fund, which ""support[s] Black-owned small businesses in need.""""Happy Juneteenth Weekend! I hope we continue to share joy and celebrate each other, even in the midst of struggle,"" said the star in an Instagram post announcing the launch. ""Please continue to remember our beauty, strength and power.""Beyoncé has been vocal throughout the the anti-racism protests sparked in May by the death of George Floyd.In a video on her Instagram, she said she felt ""broken and disgusted"" and demanded justice for Mr Floyd, who died after a police officer knelt on his neck for almost nine minutes.""No more senseless killings of human beings,"" she said. ""No more seeing people of colour as less than human. We can no longer look away.""""Continue to pray for peace and compassion and healing for our country.",20 June 2020,entertainment
"Alicia Keys, LL Cool J and the new wave of protest songs","The death of George Floyd has prompted one of the biggest movements against racism since the civil rights era.Protests were held globally after video footage from Minneapolis showed a white police officer kneeling on Mr Floyd's neck for almost nine minutes. The 46-year-old could be heard repeatedly telling the officer, ""I can't breathe"".Around the world, music became a crucial way for people to express their grief and anger. Bob Marley's Get Up, Stand Up and Bill Withers' Lean On Me soundtracked several protests, while streaming figures for songs that call out police violence soared: from Childish Gambino's This Is America and Kendrick Lamar's Alright to NWA's visceral hip-hop track [Expletive] Tha Police.The latter was also used by hackers to disrupt police scanners in Chicago during the protests. In a more unifying moment, protestors in Atlanta encouraged the National Guard to join them in performing the Macarena.As the Black Lives Matter movement continues, the record industry has been paused to examine its own history of racial exclusion, and the inequity between black artists and the mainly white executives who profit from their work.Meanwhile, artists have channelled their frustration and anger into a new wave of protest songs, directly inspired by Mr Floyd's death and its aftermath.Here are some of the most striking examples - but please be aware that many of these songs contain explicit language.End of Youtube post  by Alicia Keys - TopicSung from the perspective of a mourning mother whose son has been shot to death, Alicia Keys' new single was released on Juneteenth - a holiday celebrating the emancipation of enslaved people in the US.It was originally written in response to the deaths of Mike Brown and Sandra Bland, the former killed by police in Missouri in 2014, the latter who died in a jail cell in 2015 after Texas police stopped her for a minor traffic violation - but Keys said the message was ""never not going to be relevant"".""Of course there is no perfect way to die,"" she wrote in an Instagram caption, as she premiered the song. ""This phrase doesn't even make sense but that's what makes the title so powerful and heartbreaking because so many have died unjustly. ""We all know none of these innocent lives should have been taken due to the culture of police violence.""End of Youtube post  by HERMusicVEVO""Just by the title, you know that it means something painful,"" said Grammy-nominated R&B artist H.E.R. as she debuted her new song in a living room concert.""These lyrics were kind of easy to write because it came from a conversation of what's happening right now, what's been happening, and the change that we need to see,"" she said before her performance. ""I think music is powerful when it comes to change and when it comes to healing, and that's why I wrote this song, to make a mark in history.""The sombre, guitar-led song asks: ""What is a gun to a man that surrenders / What's it gonna take for someone to defend her / If we all agree that we're equal as people / Then why can't we see what's evil?""H.E.R. said the track tackles the question that's been plaguing her over the last few weeks: Why is there so much hate?""My favourite line in the song is, 'How do we cope when we don't love each other?'"" she told TMZ. ""I think we're all questioning that now.""A post shared by LL COOL J (@llcoolj) on May 31, 2020 at 7:13pm PDTEnd of Instagram post  by llcooljFrom the very first bar, you can tell LL Cool J won't be holding back.""For 400 years you had your knees on our necks,"" he raps. ""A garden of evil with no seeds of respect"".The 52-year-old goes on to ask what would have happened to former Minneapolis police officer Derek Chauvin, had he not been filmed by bystanders during Mr Floyd's fatal arrest.""Watching that man die slow left a hole,"" he says, ""If it wasn't for them phones, Chauvin would be at home / Feeling justified because of George skin tone / I'm telling those with melanin, you're not alone.""End of Youtube post  by Dua SalehMinneapolis artist Dua Saleh originally wrote Body Cast in response to the deaths of Jamar Clark and Philando Castile, who were fatally shot by police in separate incidents in 2015 and 2016.""Unfortunately, I could have written the song at any point in my life and it would have been relevant, which is frightening to say the least,"" they told the Switched On Pop podcast.The intro samples clips of Angela Whitehead, a woman from Montana who went viral last year when she rebuked two police officers for entering her home without a warrant or viable cause.Saleh later references the stand-off in her lyrics, singing: ""You must be crazy, coming up in here talking about you heard something /  You heard me talking, I talk loud and I'm aggressive and guess what? / You did not knock on my door.""""I just don't trust police officers in general,"" the singer said. ""I was just like disgusted at the thought that policing was a safe and viable option for black communities.""Proceeds from the song's download are being donated to the Minneapolis-based organisation, Black Visions Collective.End of Youtube post  by Denzel Curry""Someone asked, how do I feel?"" Terrace Martin wrote, as he introduced his response to George Floyd's death. ""I told them hurt, fearless, angry, aware and fully ready to protect me, my family and my people at all cost. I got together with black men that felt the same way and created a work of truth.""The result is Pig Feet - a frenetic and urgent collision of jazz and hip-hop, where Kamasi Washington's fidgety saxophone emphasises lyrics about structural racism and police brutality.It was first released on YouTube, accompanied by a video compiling clips from recent Black Lives Matter protests, followed by a list of victims of police violence that scroll silently up the screen. just singing what’s on my heart...hope this blesses someone🙏🏾❤️ @sdhtoronto thanks for this dope shirt!!🔥🔥 #ijustwantolive #blacklivesmatter #ijustwannalive #equality #black #blackexcellence #racism #justice @mstinalawsonA post shared by  Keedron Bryant (@keedronbryant) on May 26, 2020 at 2:01pm PDTEnd of Instagram post  by keedronbryantTwelve-year-old Keedron Bryant gave voice to the feelings of thousands when he uploaded a simple, a capella performance of the original song I Just Wanna Live to Instagram three weeks ago.""I'm a young black man / Doing all that I can / To stand, oh but when I look around / And I see what's being done to my kind/ Every day, I'm being hunted as prey,"" he sang, looking directly into the camera.His performance, and the directness of the lyrics, written by his mother, won praise from Barack Obama, LeBron James, Janet Jackson and Katy Perry, who reposted the song to her followers with the message #BLACKLIVESMATTER.On Friday, record label Warner Bros announced it had signed Keedron to a recording contract.",19 June 2020,entertainment
